0,1,2
300159,How much would it cost too own one!?,"[('curiosity', 0.9340144395828247)]"
300159,It looks really cool. Reminds me of fish version minion lol,"[('admiration', 0.9574002623558044), ('amusement', 0.802428662776947)]"
300159,Makes me feel like drawing two cards,"[('neutral', 0.9421119093894958)]"
300159,"Can I have one? I will give you money. Or. I have 95 followers, I can give you exposure. No, not 95k. Just 95. Or money.","[('curiosity', 0.4822337329387665), ('neutral', 0.8984193801879883)]"
300159,"That's amazing, subject and execution is just perfect. Expect to see this copied extensively and soon.","[('admiration', 0.9981541037559509)]"
300159,Deep-sea fangly fish needs a party deck on the back.,"[('neutral', 0.9990831613540649)]"
300159,This would be really cool as a piano lamp!,"[('admiration', 0.9950593709945679)]"
300159,"That is the niftiest thing I've ever seen, I want one!","[('desire', 0.9814780950546265)]"
300159,Minion pirhana?  On a serious note that’s pretty cool,"[('admiration', 0.9925242066383362)]"
300159,Just keep swimming swimming swimming,"[('approval', 0.9963794350624084)]"
300159,Imagine waking up to a monster like that! Mom help me! ! Awesome work though!,"[('admiration', 0.9905893802642822)]"
300159,"This is beautiful and a super fun design. I hope you do make a business out of this and grow your talent. It might be worth it to make the prototypes yourself and find a company to produce them since it takes so long per piece. Your concept seems extremely profitable and fresh—the interest is huge!  Wish you much sucess, talented person!  This was a happy one to see and read before bed. Proud for a stranger. Yay, internet.","[('admiration', 0.9977280497550964)]"
300159,That is an awesome piece of art! Absolutely awesome!,"[('admiration', 0.9799990057945251)]"
300159,I'm feeling happy.which is a big deal.for me,"[('joy', 0.9927082657814026)]"
300159,"I love this, great concept","[('admiration', 0.9701129198074341), ('love', 0.9307870268821716)]"
300159,\+1 for map of British Columbia,"[('neutral', 0.9989755153656006)]"
300159,Seriously Love it! Such a unique piece “excrement trail” notwithstanding !,"[('admiration', 0.41948437690734863), ('love', 0.9903372526168823)]"
300159,Now this I like. Good job!,"[('admiration', 0.9323824048042297), ('joy', 0.3850880563259125)]"
300159,Man that is awesome. If I could make that I'd make myself a Nautilus ship with lights in it. Nice OP,"[('admiration', 0.9976438879966736)]"
300159,Sick. My daughter has a huge stuffed angler fish that she got from the aquarium. These animals are rad and your light sculpture is amazing.,"[('admiration', 0.9947512745857239)]"
300159,My girlfriend would love that,"[('love', 0.9076602458953857), ('optimism', 0.8038313388824463)]"
300159,Should totes dm me a price for a copy bro.,"[('neutral', 0.996691107749939)]"
300159,Soo good it kinda reminds me of finding Nemo when they go into deep ocean and find the piranha lol but that’s just my personal relation but this is so dang good man,"[('admiration', 0.9324187636375427), ('amusement', 0.8878594636917114)]"
300159,Great proportions and execution,"[('admiration', 0.9970892071723938)]"
300159,That’s so cool! I want one!,"[('admiration', 0.9342081546783447), ('desire', 0.5721378326416016)]"
300159,Wow! This is really unique and well done. Angler fish are badass and so is this lamp. I would love to see you continue making these for us less talented folks to purchase and enjoy. Great job!,"[('admiration', 0.9981556534767151)]"
300159,I bet it looks really cool with the ceiling lights turned off/at nighttime!,"[('admiration', 0.7933518886566162), ('approval', 0.3737342357635498), ('joy', 0.7817189693450928), ('optimism', 0.3308712840080261)]"
300159,Has a bit of a Digimon Frontier feel too. Angler + Worm  ,"[('neutral', 0.998649537563324)]"
300159,It's so pretty. I wanna touch it.,"[('admiration', 0.980533242225647), ('desire', 0.47374385595321655)]"
300159,I want this! Beautiful piece,"[('admiration', 0.8288183212280273), ('desire', 0.8602287769317627)]"
300159,This is the most creative piece ive seen all year,"[('admiration', 0.9963561296463013)]"
300159,Man this looks something right or of Nine ,"[('neutral', 0.9979050159454346)]"
300159,That is sick lookin. Great job.,"[('admiration', 0.9960477948188782)]"
300159,"I want it, but I also don't. Amazing work!","[('admiration', 0.8345825672149658), ('disappointment', 0.37778621912002563)]"
300159,Doope and simple! lof et,"[('neutral', 0.9983807802200317)]"
300159,So.how much to make another one?,"[('curiosity', 0.9708942770957947)]"
300159,I really love this piece. Looks fantastic. If I had to make one criticism it'd be that I feel like the scales over lap in the wrong direction.,"[('admiration', 0.996390163898468), ('love', 0.9303982257843018)]"
300159,So.how much to make another one?,"[('curiosity', 0.9708942770957947)]"
300159,This is amazing! Good work!,"[('admiration', 0.9889023900032043)]"
300159,What was the game again that starts with this fish. Old point and click adventure I believe?,"[('confusion', 0.44963324069976807), ('curiosity', 0.8580788373947144)]"
300159,I think I had that same globe growing up.,"[('neutral', 0.9976394176483154)]"
300159,Where can one get one of these?,"[('neutral', 0.9048197865486145)]"
300159,"Boar vessel, Etruscan Ceramic, 80 to 50 BC","[('neutral', 0.9990456700325012)]"
300159,This is awesome! Well done.,"[('admiration', 0.9900760054588318)]"
300159,Which way do we go. I’m falling the light,"[('confusion', 0.3086957037448883), ('curiosity', 0.879500150680542)]"
300159,"At first I read ""anger fish"" which is applicable too I guess","[('approval', 0.9903528094291687)]"
300159,Yay what a lovely celebration of our angler fish friends ,"[('admiration', 0.6423622369766235), ('joy', 0.9695685505867004)]"
300159,very kewl stuff - you certainly have your own style.,"[('admiration', 0.9935775399208069)]"
300159,Amazing work. I’ll take one too. Sounds like you should start a business.,"[('admiration', 0.9952682852745056), ('optimism', 0.3344413638114929)]"
300159,"I love it, but the eye reminds me of a minion lmao","[('love', 0.9907869696617126)]"
300159,SUTT-KALAG!,"[('neutral', 0.9979681372642517)]"
300159,Nice! I used to work in a foundry and was surrounded by scrap metal. In awe of the beauty ya see in scrap!,"[('admiration', 0.9851456880569458), ('excitement', 0.38561585545539856)]"
300159,I would put this in my house. Make more!,"[('neutral', 0.9990453124046326)]"
300159,Isn't the scales the wrong way around?,"[('confusion', 0.9046502113342285), ('curiosity', 0.4031932055950165)]"
300159,"This is probably a strange request but that globe is giving me flashbacks, I had one just like it when I was a kid and I spent a lot of time looking at it. Could you get a close up of the label for me so I could look into it further? The angler fish is rad, well done.","[('admiration', 0.9952652454376221)]"
300159,It looks like this piece would be right at home in a Tim Burton movie. Very cool.,"[('admiration', 0.9979828596115112)]"
300159,That's amazing man! Kinda feel obligated to tell you that the scales are reversed tho,"[('admiration', 0.9946664571762085)]"
300159,"Awesome and great.but if I could be constructive.the base .could it have been more. Fishy? I add this only as you have so many acolades you know it's great. But for me the square 4 point could have been many other things. Regards and admiration. Fins, coral, bones?.","[('admiration', 0.9974138140678406)]"
300159,I’d like it more if there wasn’t a minion vibe.,"[('desire', 0.8164433836936951)]"
300159,Thank you so much for posting this\~ the scales gave me an idea for an assortment of knicknacks I want to repurpose.,"[('gratitude', 0.9988252520561218)]"
300159,My first thought was the angler fish from spongebob,"[('neutral', 0.9989546537399292)]"
300159,I want a little one for my nightstand!,"[('desire', 0.8262746334075928), ('neutral', 0.757244348526001)]"
300159,Imagin there is a switch mechanism whenever anglar fish closes it's mouth lights goes off.,"[('neutral', 0.9972085356712341)]"
300159,That is unbelievably cool!,"[('admiration', 0.994182288646698)]"
300159,"You should enter Art Prize in Grand Rapids, Michigan. One of the largest art festivals in the world.","[('neutral', 0.9940906167030334)]"
300159,Fish looks great try turnerfinearts.com if you need an agent it's right up his street,"[('admiration', 0.995502769947052)]"
300159,I want it. Where can I get one. Who do I need to talk to?,"[('curiosity', 0.3743281960487366), ('neutral', 0.8701813220977783)]"
300159,Amazing work but unless angler fish are weird the scales are pointed in the wrong direction.,"[('admiration', 0.9986705780029297)]"
300159,Love him!  Exactly so!  All teeth & exactly like a nightmare.,"[('love', 0.9772775173187256)]"
300159,Add a Dory and a Merlin too.,"[('neutral', 0.9989180564880371)]"
300159,"Awesome! Saw a watercolor on here of the same fish a month or so ago. This is a super cool version and prob very difficult to make, I dig it!","[('admiration', 0.9972437620162964)]"
300159,haha wow! you are my hero for the week! frickin awesome.,"[('admiration', 0.9843317270278931)]"
300159,I’ll take it. But seriously start mass producing these ,"[('approval', 0.7456433176994324), ('caring', 0.31682467460632324)]"
300159,I this lamp it's so awesome,"[('admiration', 0.9918832778930664)]"
300159,It actually reminds me of Minion form Megamind,"[('realization', 0.5716258883476257), ('neutral', 0.8660954236984253)]"
300159,If you use post-it notes to keep track of tasks. Those teeth would be a perfect graveyard.,"[('neutral', 0.9977624416351318)]"
300159,This is fantastic! I want one.,"[('admiration', 0.8823452591896057), ('desire', 0.7969834804534912), ('excitement', 0.37579289078712463)]"
300159,Seriously? What’s the price/name of your shop! Love love love this!,"[('curiosity', 0.5037194490432739), ('love', 0.9899131059646606)]"
300159,This would look so cool as a hanging lamp. Kind of like its swimming!,"[('approval', 0.8934723138809204)]"
300159,I’ll take 10!  ,"[('neutral', 0.9985785484313965)]"
300159,Looks like the enemy sub from Stingray,"[('neutral', 0.991338849067688)]"
300159,What a weird piece of art. I want 90.,"[('annoyance', 0.43583863973617554), ('neutral', 0.9008007645606995)]"
300159,This is awesome. I want one.,"[('admiration', 0.9351972341537476), ('desire', 0.8999862670898438)]"
300159,#Can you show us how you made it please  .,"[('curiosity', 0.9615628719329834)]"
300159,"I HAVE THAT EXACT. SAME. GLOBE. I love the lamp sculpture, but I'm very excited about that globe also","[('excitement', 0.9159933924674988), ('love', 0.9010844826698303)]"
300159,This is the best thing I have seen all day.,"[('admiration', 0.993902325630188)]"
300159,Very creative! Wish I had something like this!,"[('admiration', 0.9811074733734131), ('desire', 0.9039210677146912)]"
300159,This is soo soo dope!,"[('neutral', 0.9967048764228821)]"
300159,"OP, this looks fantastic! Hope to see more of your works in the future. Well done.","[('admiration', 0.9958257675170898), ('optimism', 0.382989764213562)]"
300159,Scales are backward. Can't swim very fast that way,"[('disapproval', 0.31898730993270874), ('neutral', 0.975999116897583)]"
300159,Even included the fused male.,"[('neutral', 0.998855710029602)]"
300159,This looks like a puzle from The Room,"[('neutral', 0.9985312223434448)]"
300159,first thing i thought about is finding nemo,"[('neutral', 0.9989954829216003)]"
300159,"Looks really dangerous to fall on, I want it!","[('fear', 0.990972638130188)]"
300159, I think you need this as a background prop.,"[('neutral', 0.9877339601516724)]"
300159,Reminds me of Shovel Knight,"[('neutral', 0.9979323148727417)]"
300159,It looks like its wearing Minion goggles,"[('neutral', 0.9958837628364563)]"
300159,"Love it buddy. Also, think about a black cord if it's on the darker side in person ","[('love', 0.9979161620140076)]"
300159,Hey this things great! What gauge sheet are the scales and did you have to shear and dish all them? That's a lot of love gone into that fish,"[('admiration', 0.9958679676055908)]"
300159,I shall call him SQUISHY and he shall be MINE and he shall be MY squishy!,"[('neutral', 0.9949504137039185)]"
300159,Whyd you have to get it a Minion eye ,"[('annoyance', 0.33340948820114136), ('neutral', 0.8388562798500061)]"
300159,"Half Angler Fish, Half Minion.","[('neutral', 0.9988178610801697)]"
300159,Love ur work but the light needs to be dimmer no one likes bright lights in such low position,"[('love', 0.99812251329422)]"
300159,"Very nice, best I’ve seen but what’s with the backwards scales?","[('admiration', 0.9952477812767029), ('curiosity', 0.4375756084918976)]"
300159,That room is so detailed and realistic! Impressive!,"[('admiration', 0.9964309930801392)]"
300159,Love that it doubles function as a lamp,"[('love', 0.9916130304336548)]"
300159,"That's some serious talent bro, looks amazing.","[('admiration', 0.9957795143127441)]"
300159,Would you do commissions? This looks awesome and once I make some money I'd love to get myself one,"[('admiration', 0.8821119666099548), ('curiosity', 0.500617504119873), ('love', 0.81822669506073)]"
300159,"I love this so much. Well done, OP! Your artistry is incredible!","[('admiration', 0.9977935552597046), ('love', 0.502334475517273)]"
300159,This same work was actually done by a Disney Imagineer years ago!,"[('approval', 0.5511898398399353), ('realization', 0.6253942251205444)]"
300159,I’ve never wanted something so bad,"[('disapproval', 0.8587605953216553)]"
300159,Piranha Apocalypse This is epic! I had to do it,"[('admiration', 0.4602675437927246), ('excitement', 0.8621448278427124)]"
300159,I have a feeling he is part minion too.,"[('admiration', 0.48642516136169434), ('neutral', 0.9481726884841919)]"
300159,Why was I struck with a minion-esque vibe?,"[('confusion', 0.5376952886581421), ('curiosity', 0.8854919672012329)]"
300159,Check out Barbie The Welder. I have an angler she welded.,"[('neutral', 0.998920202255249)]"
300159,"Please, I take this from you, yes? Tradsies for it?","[('curiosity', 0.49851906299591064), ('neutral', 0.8851830363273621)]"
300159,"I AM THE ANGLER, YOU ARE THE FISH.","[('neutral', 0.9954493641853333)]"
300160,the textures in this really made my brain pop. beautiful work. did you use modelling paste?,"[('admiration', 0.9920490384101868), ('curiosity', 0.3602975606918335)]"
300160,those colors and textures! love!,"[('admiration', 0.9801275730133057), ('love', 0.7671396732330322)]"
300160,"Wow, this is brilliant. Well done indeed. Do you ship to Ireland?","[('admiration', 0.9922540187835693)]"
300160,This made my soul feel good,"[('admiration', 0.4620296359062195), ('joy', 0.9446028470993042)]"
300160,I loove the texture and color pallete,"[('neutral', 0.9974703788757324)]"
300160,Stunning! Tactile happiness.,"[('joy', 0.7244107127189636), ('surprise', 0.8878490328788757)]"
300160,The degree of depth really makes this come alive. Stellar work!,"[('admiration', 0.5297446846961975), ('approval', 0.8666597604751587)]"
300160,You are my favorite living artist,"[('admiration', 0.9938848614692688)]"
300160,Wow talk about movement color and texture! I love this. It’s unique and well balanced. I love seeing art that really stands out to me this is an example!,"[('admiration', 0.9920347332954407), ('love', 0.7814958691596985)]"
300160,"your textures and colors are so stunning and fun, very joyful! your work is always a delight!","[('admiration', 0.9722626209259033), ('joy', 0.9062244296073914)]"
300160,The textures compliment your color palette and the palette compliments the texture. 10/10 would want to touch it,"[('admiration', 0.5958167910575867), ('neutral', 0.9049820303916931)]"
300160,This is very joyous to look at.,"[('joy', 0.9776802659034729)]"
300160,"Such a gorgeous piece! As others have said, your technique with texture is beautiful and so unique!","[('admiration', 0.9957823753356934)]"
300160,"I never comment here but this is great. I love the way texture is incorporated, and the colors are brilliant.","[('admiration', 0.9983034133911133)]"
300160,Reminds me of my time in Bat Country.,"[('neutral', 0.9969379901885986)]"
300160,"Ugh. I love every time I see you post. This whole series is so stupid gorgeous. My gf and I are simply in love with your art, thank you so much for sharing!","[('admiration', 0.9857093095779419), ('gratitude', 0.91249018907547), ('love', 0.983059287071228)]"
300160,You are insanely skilled. Wow,"[('admiration', 0.993351936340332)]"
300160,I’ve never commented on anyone’s art before—but this was so good that I had to.,"[('admiration', 0.9922146201133728), ('approval', 0.47984692454338074)]"
300160,Something about that texture just adds so much. Very trippy and beautiful.,"[('admiration', 0.9966147541999817)]"
300160,Your use of light and color is phenomenal. It really evokes a true feeling of a beautiful sunset.,"[('admiration', 0.9955377578735352)]"
300160,Yeah I really love this. The textures are amazing.,"[('admiration', 0.9868482947349548), ('love', 0.5599346160888672)]"
300160,"I haven’t seen anyone with a similar style as yours. This is great, I absolutely love it!","[('admiration', 0.994891881942749), ('love', 0.8067178726196289)]"
300160,I love your art! That technique is awesome!,"[('admiration', 0.9933834671974182), ('love', 0.6983290314674377)]"
300160,Love the title on this one,"[('love', 0.9851320385932922)]"
300160,"This is really great. I love it. You're close to it being something truly marvelous, very close. There's just something about the flatness of the rest of the deep blue sky. Maybe try going even flatter, duller, darker to contrast the brilliance of the rest or go for more of a blended look?","[('admiration', 0.9900237917900085), ('love', 0.855966329574585)]"
300160,Wow I want this in my living room!,"[('excitement', 0.9814488291740417)]"
300160,Currently on mushrooms and it looks well good,"[('admiration', 0.42061999440193176), ('approval', 0.31174278259277344), ('neutral', 0.3678240180015564)]"
300160,The use of color alone makes it so vibrantly alive. I love the textured paint effect as well. Well done!,"[('admiration', 0.9964213371276855)]"
300160,I LOVE all the texture. Been painting for long?,"[('curiosity', 0.31439876556396484), ('love', 0.9865958094596863)]"
300160,So awesome! I love the texture,"[('admiration', 0.983748197555542)]"
300160,This is one of the most amazing things I've seen.,"[('admiration', 0.990784764289856)]"
300160,Do you have any painting tutorials? This is just amazing,"[('admiration', 0.9737333059310913)]"
300160,"Some of the greatest paintings of all time are ""experiments""","[('admiration', 0.9963740706443787)]"
300160,I really like this! Beautiful,"[('admiration', 0.9764497876167297), ('love', 0.8494030833244324)]"
300160,I’ve been enjoying the warm colors and dreamy style with every post. Keep up the beautiful work!,"[('admiration', 0.9965535402297974), ('joy', 0.31912535429000854)]"
300160,"I am in love with this. Thank you so much for sharing! The colors, the textures. It's awesome.","[('admiration', 0.8606588840484619), ('gratitude', 0.9915980100631714), ('joy', 0.3702338635921478), ('love', 0.8384813070297241)]"
300160,Wow what a color selection.very vibrant,"[('admiration', 0.9220104813575745), ('surprise', 0.6586847901344299)]"
300160,Wow that's beautiful,"[('admiration', 0.9887387752532959)]"
300160,Am I being dramatic if I say this is one of the best original paintings I've seen in years? I LOVE this.,"[('admiration', 0.9950693845748901), ('love', 0.8985013365745544)]"
300160,"Whoah, excellent use of color theory!","[('admiration', 0.9952031373977661)]"
300160,"Omg it's gorgeous, like a childhood dream.","[('admiration', 0.9964483976364136)]"
300160,"Digging it a lot, loving the colors and the cloud swirls!","[('joy', 0.6271412968635559), ('love', 0.9843830466270447)]"
300160,What a wonderful painting I love the textures!,"[('admiration', 0.9962834715843201), ('love', 0.3729071319103241)]"
300160,"I love the way you see the world.  Art is interpretation, and this is how I interpret it/what it means to me.  I'm autistic, and oftentimes it provides me sensory hell- sights, sounds, textures can all be too much. But sometimes, especially in nature, when all is ok, my intense sensory input just brings out the beauty in everything.so so much. It brings me to tears sometimes. Your paintings remind me of those moments. Thank you ","[('gratitude', 0.9821604490280151), ('love', 0.9607685804367065)]"
300160,I’m absolutely obsessed with your style.,"[('approval', 0.5927208662033081), ('love', 0.6356386542320251)]"
300160,Been loving these. Beautiful work.,"[('admiration', 0.9964893460273743), ('love', 0.47467538714408875)]"
300160,I saw this and immediately realized it was the same artist as the pretty sky I used as my phone bg for awhile! You’re amazing and I love this,"[('admiration', 0.9913222789764404), ('love', 0.9463549852371216), ('realization', 0.5601460933685303)]"
300160,This is amazing! Have you thought about putting a finish on it? I know linseed oil can be used as a finish for oil paintings but not sure about acrylic.,"[('admiration', 0.9923462867736816)]"
300160,"Anastasia you gotta chill, I just made a sideshow gallery of some of my favorites from you for Screensavers, now I gotta add more.","[('joy', 0.5712621212005615), ('neutral', 0.36323410272598267)]"
300160,"Wow I absolutely love the colors, but for some reason it’s the textures that seal the deal for me.","[('admiration', 0.8188583254814148), ('love', 0.5592954158782959), ('realization', 0.7652884125709534), ('surprise', 0.6882545948028564)]"
300160,"Very nice, this is my lock sxreen now. ","[('admiration', 0.9943722486495972)]"
300160,"I get warm fuzy feelings while looking at this piece, well done!","[('admiration', 0.9974679946899414)]"
300160,Stunning piece. Thank you for sharing OP. One Love,"[('gratitude', 0.9927617907524109), ('love', 0.39742809534072876)]"
300160,This is so beautiful. Love the colors and textures. Great job,"[('admiration', 0.9977914094924927)]"
300160,I'm really diggin' that painting! Hints of psychedelia. Beautiful treatment. Love it!,"[('admiration', 0.9955728054046631), ('love', 0.9217742085456848)]"
300160,"“Creator of texture-graphic impressionism style” Yea, no.","[('disapproval', 0.9520960450172424)]"
300160,"Nice! There's a potential waiting to be unlocked. However, I am not sure about the textured grass and floating leaves. They look like put on top of the smooth water, somewhat disconnected. Maybe the water should be textured a bit more as well? Or maybe it's the grass missing its reflection? Something seems off about it.","[('admiration', 0.5085506439208984), ('confusion', 0.9922783374786377)]"
300160,Very pretty! I am going through an experiment with my paint too. Check out my profile.,"[('admiration', 0.9959622025489807)]"
300160,Love the texture in the sky and the reflection in the pond!,"[('love', 0.9937708973884583)]"
300160,That's really cool. The texture and colors are just amazing. Feels like I'm tripping looking at it.,"[('admiration', 0.9913190007209778)]"
300160,"I love this, I want to touch! Thanks for sharing the colors make me happy","[('gratitude', 0.7163531184196472), ('joy', 0.872859537601471), ('love', 0.9849403500556946)]"
300160,This is inspiring and gorgeous.,"[('admiration', 0.9967167973518372)]"
300160,Wow this is really beautiful I love the colors.,"[('admiration', 0.9977578520774841), ('love', 0.4147254228591919)]"
300160,Love the playful colors and texture!,"[('admiration', 0.5077323913574219), ('love', 0.9813419580459595)]"
300160,Oh man I love this. I love those swirls in the clouds. All the awesome textures I just want to touch it LOL and the colors are beautiful. Well done,"[('admiration', 0.994297206401825), ('amusement', 0.5510090589523315), ('love', 0.8971981406211853)]"
300160,Absolutely amazing! I would 10% have this on my wall,"[('admiration', 0.9832864999771118)]"
300160,Amazing work. I imagine those colors pop even more in person.,"[('admiration', 0.99446702003479)]"
300160,Absolutely gorgeous! Thank you for sharing,"[('admiration', 0.9396998882293701), ('gratitude', 0.9969402551651001)]"
300160,I really like how it looks. It brought me only positive thoughts,"[('admiration', 0.5059361457824707), ('approval', 0.6089075207710266), ('love', 0.7136518359184265)]"
300160,Wonderful colors and composition!,"[('admiration', 0.9914566874504089)]"
300160,This is majestic. Thank you for sharing!,"[('admiration', 0.9597949385643005), ('gratitude', 0.9951409101486206)]"
300160,So alive and beautiful. I love the colors,"[('admiration', 0.9962599277496338), ('love', 0.7659153342247009)]"
300160,"Your art is amazing and your talent is cultivated, you should feel like a badass!","[('admiration', 0.9988697171211243)]"
300160,"The overall composition of this is really nice - and the way you textured the acrylic makes it look like an oil painting. That's nice, added detail!","[('admiration', 0.9973049163818359)]"
300160,Wow that’s a very beautiful painting,"[('admiration', 0.9940993785858154)]"
300160,Your posts are always some of my favorites. The color and texture you’re able to pull off is insane!,"[('admiration', 0.990145742893219), ('love', 0.5006908178329468)]"
300160,Love it! There’s something very uplifting about it!,"[('approval', 0.31311312317848206), ('love', 0.9917425513267517)]"
300160,Thank you for yet another phone wallpaper! ,"[('gratitude', 0.9975702166557312)]"
300160,I absolutely love this style! Gorgeous textures and color.,"[('admiration', 0.9496820569038391), ('love', 0.8880982995033264)]"
300160,Colors and textures are magical,"[('excitement', 0.4426477253437042), ('neutral', 0.9108250141143799)]"
300160,This is absolutely brilliant!,"[('admiration', 0.9942737221717834)]"
