0,1,2
300058,Im getting black mirror vibes from this,"[('neutral', 0.9990847110748291)]"
300058,I can absolutely use the top down shot for my online DND game.,"[('approval', 0.9957879185676575)]"
300058,What's in the box?! Not my gum drop buttons!,"[('neutral', 0.9779185652732849)]"
300058,Morbidly cute n dark at the same time.,"[('neutral', 0.9601380228996277)]"
300058,"""what's your medium?"" ""gingerbread""","[('curiosity', 0.9734200835227966)]"
300058,wE gAvE yOu AlL tHe ClUeS,"[('neutral', 0.8774732351303101)]"
300058,Who did it? Who is the murderer?,"[('confusion', 0.9120890498161316), ('curiosity', 0.7410585880279541)]"
300058,This is stolen. This is actually a gingerbread remake of Wills house in Stranger Things. It was posted on  a few days ago.,"[('neutral', 0.9990492463111877)]"
300058,It's the sound of the police,"[('neutral', 0.9984449744224548)]"
300058,Someone already posted this as stranger things yea?,"[('curiosity', 0.5574249625205994)]"
300058,Reminds me of a Gregory Crewdson photograph,"[('neutral', 0.9955828785896301)]"
300058,crime scene me gingerbread spongeboy me bob,"[('neutral', 0.9976795315742493)]"
300058,"This is so cool! Wish I could steal it, too bad I’m talentless.","[('admiration', 0.9905362725257874), ('disappointment', 0.6171671748161316)]"
300058,I was thinking Stranger Things.,"[('neutral', 0.854827344417572)]"
300058,This is something I would do. My mom would hate me for it but it’s so fun,"[('amusement', 0.5353230834007263), ('joy', 0.8988107442855835)]"
300058,This is the exact scene of a reocurring nightmare I had as a kid. Thanks for reminding me lmao,"[('gratitude', 0.9970989227294922)]"
300058,Soo Nice! Reminds me of a Black mirror episode. The one where the police look into the womans mind for memories,"[('admiration', 0.9948747754096985)]"
300058,Everyone is saying Stranger Things or Fargo. Im getting a 30 Days of Night vibe.,"[('neutral', 0.9977911710739136)]"
300058,The case of the Gum Drop Buttons only goes deeper,"[('neutral', 0.9989186525344849)]"
300058,reminds me of GTA V intro,"[('neutral', 0.9804292917251587)]"
300058,"This looks like the setup from stranger things, minus the forest","[('neutral', 0.9895485639572144)]"
300058,It looks like one of the crime scene nutshells.,"[('approval', 0.9683271050453186), ('neutral', 0.750446081161499)]"
300058,LOVE THIS! It looks soo good! Do you do any dioramas by any chance?,"[('admiration', 0.9016350507736206), ('curiosity', 0.8289747834205627), ('love', 0.5256162285804749)]"
300058,"""And I guess that was your acomplice in the wood chipper.""","[('neutral', 0.9928855299949646)]"
300058,No Country For Old Cookies There Will Be Frosting True Sanding Sugar ,"[('neutral', 0.9989004135131836)]"
300058,Looks like it's from Erased,"[('neutral', 0.9957752823829651)]"
300058,I thought it was Stranger Things inspired,"[('surprise', 0.31994178891181946), ('neutral', 0.84775710105896)]"
300058,Reminds me of Stranger Things!,"[('surprise', 0.818109393119812)]"
300058,This is so incredibly creative!,"[('admiration', 0.9937738180160522)]"
300058,I thought of Stranger Things?,"[('confusion', 0.3408966064453125), ('curiosity', 0.7814132571220398), ('neutral', 0.3758213520050049)]"
300058,"This was a treat, because I clicked on it without looking at the title or sub, and it was only a close look at the car that made me realize the truth of this photo. Well done!","[('admiration', 0.9860833287239075), ('realization', 0.9466390609741211)]"
300058,looks like Stranger Things,"[('neutral', 0.9921590089797974)]"
300058,"Reminds me a little bit of the cop scene from Stephen kings misery, great work","[('admiration', 0.9959557056427002)]"
300058,Looks like the house and she’s from evil dead,"[('neutral', 0.9980249404907227)]"
300058,"An isolated home, covered in snow? Gosh dang it. Looks like SCP-46 struck again.","[('confusion', 0.31124913692474365), ('curiosity', 0.32392463088035583), ('neutral', 0.3516470491886139)]"
300058,What a tasty little murder shack.,"[('anger', 0.39637112617492676), ('annoyance', 0.42616915702819824), ('disgust', 0.966861367225647)]"
300058,There is even tire marks. Well done!,"[('admiration', 0.9978984594345093)]"
300058,This reminds me heavily of stranger things!,"[('realization', 0.573152482509613), ('neutral', 0.7306715250015259)]"
300058,So who killed the gingerbread man op? You can't just leave us in suspense.,"[('curiosity', 0.9974802136421204)]"
300058,"I'll make ya some eggs, Margie","[('neutral', 0.9699609279632568)]"
300058,"A crime scene? Be careful, might be a demonic old lady in the basement and a tape recorder in the next room with a passage from the acursed Necronomicon on it.","[('caring', 0.952385425567627)]"
300058,Looks a little bit like Barker Ranch,"[('neutral', 0.9966655373573303)]"
300058,This is brilliant so creative,"[('admiration', 0.9950173497200012)]"
300058,I thought this was another red dead 2 snowy post.,"[('neutral', 0.9970345497131348)]"
300058,I hope they catch the murderer!,"[('optimism', 0.9817785024642944)]"
300058,"Wow, that's impressive! Is there a gingerbread man covered in raspberry jam inside?","[('admiration', 0.9867688417434692), ('curiosity', 0.4555334150791168)]"
300058,A dismembered gingerbread man would have made it perfect.,"[('admiration', 0.8806588053703308), ('approval', 0.9339255690574646)]"
300058,"Don’t get me wrong, I love it. But I’m also concerned","[('approval', 0.5363652110099792), ('caring', 0.8077198266983032), ('love', 0.982998251914978)]"
300058,I swear I didn't do it officer,"[('disapproval', 0.7868008613586426), ('realization', 0.5093193650245667)]"
300058,What's that Reddit reminder bot? I need it to reminded me to make something like this December 1st 2020,"[('curiosity', 0.8519055843353271), ('neutral', 0.35029059648513794)]"
300058,Wow. Just wow. Breath taking work!,"[('excitement', 0.62323397397995), ('surprise', 0.9346346855163574)]"
300058,It might be Stranger Things fan art but I hear the Law and Order sound when I look at this.,"[('neutral', 0.9856436252593994)]"
300058,You should go on that Food Network show Holiday Gingerbread Showdown. People on that thing make epic gingerbread houses and stuff like this. Sounds silly by my whole family is addicted to that show and I'd love to see something like this on it!,"[('love', 0.980113685131073)]"
300058,What’s the white powder? Powered sugar? Cocaine maybe?,"[('confusion', 0.6455867290496826), ('curiosity', 0.9331763982772827)]"
300058,Try to eat the police in reallife you will get locked up in a toilet size room,"[('neutral', 0.9806541800498962)]"
300058,That's alotta powdered sugar,"[('neutral', 0.9986261129379272)]"
300058,Mr. Police. You have all the clues.,"[('neutral', 0.5351697206497192)]"
300058,Needs a tiny gingerbread woodchipper with a gingerbread leg sticking out of it.,"[('neutral', 0.9824390411376953)]"
300058,Looks like first minutes of GTAV,"[('neutral', 0.998223602771759)]"
300058,Black Mirror White Christmas,"[('neutral', 0.998391330242157)]"
300058,"“Ludendorff, North Yankton, nine years ago”","[('neutral', 0.9986231327056885)]"
300058,I thought this was real for a second good job,"[('admiration', 0.9919398427009583)]"
300058,missing a bloody woodchipper,"[('disappointment', 0.9089230298995972)]"
300058,This remind me to the house of Courage the Cowardly Dog,"[('neutral', 0.9936029314994812)]"
300058,"That's some nice low-rent gingerbread stylings. Somebody got taken out to the corn crib, and they wont be back lol!","[('amusement', 0.994340181350708)]"
300058,This looks like it could be from stranger things,"[('neutral', 0.9896464943885803)]"
300058,seems a bit like the Byers residence from stranger things imo,"[('neutral', 0.9988685846328735)]"
300058,Crime is the lowest it’s very real.,"[('approval', 0.8924229741096497), ('neutral', 0.8685999512672424)]"
300058,This is my favourite gingerbread display of 2019.,"[('love', 0.9101183414459229)]"
300058,I thought this was a stranger things gingerbread house?,"[('curiosity', 0.3808561861515045), ('surprise', 0.849882185459137)]"
300058,Dude this is GREAT. Now I can’t wait to see what you do next,"[('admiration', 0.40509796142578125), ('excitement', 0.9549728035926819)]"
300058,Reminds me of the start of GTA V,"[('neutral', 0.9949919581413269)]"
300058,If its a crime scene where are the drag marks?  Trying to frame this innocent man who went to his murder shed to chop up some meat and fava beans for his hungry family on Christmas eve. For shame.,"[('curiosity', 0.4392453730106354), ('embarrassment', 0.5722825527191162)]"
300058,Got black mirror vibes from that Christmas episode,"[('neutral', 0.9991278052330017)]"
300058,Makes me think of that Calvin and Hobbes when Calvin made the crazy snowmen.,"[('neutral', 0.9916674494743347)]"
300058,This makes me think of Erased for some reason,"[('neutral', 0.9985266923904419)]"
300058,Broo what?! This is insane,"[('curiosity', 0.36030757427215576), ('excitement', 0.5752819180488586), ('surprise', 0.34038686752319336)]"
300058,This is truly wonderful. Well done.,"[('admiration', 0.9949953556060791)]"
300058,always knew he was up to no good,"[('admiration', 0.8316290974617004), ('approval', 0.7409693002700806)]"
300058,Looks like Stranger Things.,"[('surprise', 0.578908383846283), ('neutral', 0.43586254119873047)]"
300058,Reminds me of the show Eyewitness! The beginning.,"[('realization', 0.68052077293396), ('neutral', 0.8202411532402039)]"
300058,"I love this! Great job photographing it as well, so atmospheric!","[('admiration', 0.9971721768379211)]"
300058,That’s really creative! Did you use powdered sugar for the snow?,"[('admiration', 0.9468346834182739), ('curiosity', 0.6011188626289368)]"
300058,This reminds me of Stranger Things,"[('realization', 0.5288427472114563), ('surprise', 0.5407848358154297)]"
300058,It looks like Stranger Things! Joyce's house and Hopper's truck,"[('surprise', 0.4151727259159088), ('neutral', 0.872763991355896)]"
300058,"This is definitely Stranger Things, right? I keep seeing Fargo in the comments and I've not seen that, so I cannot compare.","[('confusion', 0.5148914456367493), ('neutral', 0.6103931069374084)]"
300058,You made a Gingerbread Nutshell! Mrs. Lee would be proud of you.,"[('admiration', 0.9599652290344238), ('approval', 0.36413824558258057)]"
300058,Got a stranger things vibe.,"[('neutral', 0.9988654851913452)]"
300058,Kinda reminds me of Wills house in stranger things. Really cool though ,"[('admiration', 0.7116968631744385), ('approval', 0.4449820816516876), ('realization', 0.7068479061126709)]"
300058,"This is so amazingly haunting. The scene reminds me of Fargo, but also gives me the same vibes as when I watched Hereditary","[('admiration', 0.9978994131088257)]"
300058,Make this into a stop motion movie.,"[('neutral', 0.9925172328948975)]"
300058,Kinda reminded me of Misery! Awesome!,"[('admiration', 0.9803047776222229)]"
300058,Krampus did not come to play,"[('neutral', 0.9984501600265503)]"
300058,Reminds me of the Evil dead cabin and the work shed!,"[('realization', 0.6421497464179993), ('neutral', 0.8982508778572083)]"
300058,Looks like they finally found the gingerbread man.,"[('neutral', 0.8212540149688721)]"
300058,Thought it was the Upside Down from Stranger Things.,"[('neutral', 0.9980100989341736)]"
300058,I didnt know such emotion could be shown via gingerbread.,"[('realization', 0.804606556892395), ('surprise', 0.7291110754013062)]"
300058,Reminds me of the part in the Stephen King book Misery when the cop shows up. Brutal stuff,"[('annoyance', 0.853127658367157)]"
300058,"Ok as a Halloween person, I think I could get into Christmas more if I started making crime scene gingerbread houses. So cool!","[('admiration', 0.34841927886009216), ('excitement', 0.550051748752594), ('joy', 0.4381406307220459), ('optimism', 0.6341963410377502)]"
300058,It looks like a stranger things set up,"[('neutral', 0.9988768696784973)]"
300058,This is unbelievably awesome!,"[('admiration', 0.9960875511169434)]"
300058,"This gives me hardcore ""the thing"" vibes! I love it!","[('love', 0.9932339787483215)]"
300058,LOOL amazing. totally captures the holiday spirit,"[('admiration', 0.9804655313491821), ('amusement', 0.6403018236160278)]"
300058,The Lawson murders! Those poor raisin cake decorating souls.,"[('disappointment', 0.8664491176605225)]"
300058,"Before i saw the last photo, I thought this was real. I was like wow this looks nice oh a drone shot a policeca.walt","[('admiration', 0.9660626649856567), ('surprise', 0.4365827441215515)]"
300058,This reminds of the opening scene in I Saw The Devil. The movie is superbly done from every aspect of hero's journey,"[('admiration', 0.9965860843658447)]"
300058,So where's the deadites and guy with a chainsaw hand and a boomstick?,"[('curiosity', 0.9747723340988159)]"
300058,I love the idea! I'd add more blood splatter  It's not quite gory enough for me ,"[('love', 0.9947578310966492)]"
300058,"Is the gingerbread man's flesh made of gingerbread house, or is the gingerbread house made of gingerbread man flesh?","[('confusion', 0.8877326250076294), ('curiosity', 0.6936133503913879)]"
300058,I thought it was the cabin from Evil Dead when i first looked at it.,"[('neutral', 0.8965463042259216)]"
300058,Now I wanna watch A Simple Plan,"[('desire', 0.9443024396896362)]"
300058,Are the tires chocolate chips?,"[('confusion', 0.7165090441703796), ('curiosity', 0.35579460859298706), ('neutral', 0.3756660521030426)]"
300058,I thought that was drawn it is so good,"[('admiration', 0.9919620156288147)]"
300058,Stranger Things meets Fargo meets Gingerbread.,"[('neutral', 0.9988473653793335)]"
300058,"Remonds me of the Snowman, watched the movie, interesting. Love the work.","[('admiration', 0.9777384996414185), ('love', 0.7759586572647095)]"
300058,The Candy Crusher Gang broke Old Man Gingerbread's legs and ran off with the pop rock gems and minted peppers. They left trail of Gumdrops. Call the Vegans if you know have any information on these Sugar Fiends. Please leave some sugar on the doorstep of the Gingerbread house on 16 Candy Cane Lane. He needs Icing to put be put back together. Doctors say it'll take very long minutes before he makes a full recovery.,"[('neutral', 0.9989940524101257)]"
300058, So desserted and scary.,"[('admiration', 0.7463735938072205), ('fear', 0.9264681935310364)]"
300058,This is awesome! How did you do the lights inside the house and the cool blue lighting?,"[('admiration', 0.9829375147819519)]"
300058,I'm for sure getting strong Fargo vibes and I'm here for it 10%,"[('neutral', 0.9939004182815552)]"
300058,Looks like hopper driving up to his cabin,"[('neutral', 0.998830258846283)]"
300058,This is so unique. I love it.,"[('love', 0.9824063777923584)]"
300058,"Oh REDACTED, Another Weissnacht Event.","[('neutral', 0.9936878085136414)]"
300058,You did not make this some one else did and it’s stranger things,"[('neutral', 0.9966717958450317)]"
300058,I desperately want a point and click murder mystery video game with this art style now,"[('curiosity', 0.5183528065681458), ('desire', 0.9590672254562378)]"
300059,I was telling my seven-year-old students the story of Medusa couple of weeks ago and they absolutely loved it cuz it's so scary but interesting at the same time. We watched bits of Clash of the Titans and now I'll show them this on Monday.,"[('fear', 0.9366084337234497)]"
300059,"It's a lovely morning in ancient Greece, and you are a horrible goose-woman","[('love', 0.8640621900558472)]"
300059,Infinitely more frightening than snakes,"[('fear', 0.9895769357681274)]"
300059,At least they aren't Canadian Geese. That would make her the most horrifying monster ever conceived.,"[('fear', 0.9694983959197998)]"
300059,Me gusta megoosa  ,"[('neutral', 0.998954176902771)]"
300059,I love this so much hahaha beautiful,"[('admiration', 0.875564455986023), ('amusement', 0.3972025215625763), ('love', 0.9669910669326782)]"
300059,"As a Canadian, this terrifies me far more.","[('fear', 0.9848451018333435)]"
300059,A SINGLE LOOK WILL TURN A MAN DOWN,"[('neutral', 0.9222163558006287)]"
300059,"Thought it was about the ""Me Gusta"" meme at first. Good job","[('admiration', 0.9796862006187439)]"
300059,Would be more frightening with canada geese,"[('fear', 0.9912386536598206)]"
300059,"Yup, that’s a dnd monster that I’m going to have to statblock for my campaign. Love it","[('admiration', 0.9500740170478821), ('love', 0.991047203540802)]"
300059,This a whole new mythology,"[('neutral', 0.9812464118003845)]"
300059,A mí Megoosa Every time you look at me that way,"[('neutral', 0.9984159469604492)]"
300059,I need to know what was your motivation behind this lol. What made you think “Medusa but with geese “. Great drawing,"[('admiration', 0.9903783798217773), ('curiosity', 0.6752147674560547)]"
300059,"You come into a sleepy mountain village but something seems off. The windows are boarded up and there are geese roaming free everywhere. You manage to spot someone slipping around a corner. They dart into what appears to be an inn that is still open. As you approach the door, and before you have a chance to enter, an old man with wild eyes bursts towards you. He grabs onto your shoulders and with a low craggly voice he whispers with determination, ""beware the honking! BEWARE the honking!""","[('caring', 0.42299407720565796), ('neutral', 0.8717902302742004)]"
300059,Mind if I use this as a tattoo?,"[('curiosity', 0.9890029430389404)]"
300059,Clever for a spin on a Halloween costume,"[('admiration', 0.9891407489776611)]"
300059,"So, if Medusa turns men to stone, what she do? I love this piece. Totally my style.","[('love', 0.9840198755264282)]"
300059,Peace was never an option.,"[('realization', 0.8061003088951111)]"
300059,One look can turn a man into bread.,"[('neutral', 0.9983525276184082)]"
300059,I'm turning to a duck biblo,"[('neutral', 0.9990403056144714)]"
300059,there's a  joke here somewhere,"[('amusement', 0.4057709276676178), ('neutral', 0.8304259181022644)]"
300059,"LOL! Okay, that's wonderful!","[('admiration', 0.7336642146110535), ('amusement', 0.9681573510169983)]"
300059,Oh that’s great! Good job.,"[('admiration', 0.9924325942993164)]"
300059,"Honestly, this would be a great company logo. I’m not sure what the company would do that would require this but damnit I’d shop there.","[('admiration', 0.9954774975776672), ('confusion', 0.5511860847473145)]"
300059,"Sure she looks nice, but wait till you get the bill.","[('admiration', 0.9855850338935852), ('disappointment', 0.31800878047943115)]"
300059,"Hey! My Tiktok is Megoose Also good job, Melike","[('admiration', 0.9953736662864685)]"
300059,Make them Canadian geese and this would be terrifying,"[('fear', 0.9786961078643799)]"
300059,Me gusta you goose-d-a Medusa,"[('neutral', 0.9976364374160767)]"
300059,I would like to feed them bread,"[('caring', 0.8032479882240295), ('desire', 0.7109694480895996)]"
300059,Silly goose I love it so much,"[('love', 0.9873271584510803)]"
300059,Even more dangerous than the greek creature.,"[('fear', 0.9914549589157104)]"
300059,Do people who gaze on her face turn into bread?,"[('curiosity', 0.7541893720626831), ('neutral', 0.39434492588043213)]"
300059,Don't gander directly into her eyes. Great work! I love this!,"[('admiration', 0.9980489015579224)]"
300059,"It's weird the danger of regular Medusa doesn't sink in, but this does. Like I'd totally try and make out with regular Medusa but I'm not going near those ducks.","[('disgust', 0.5835192203521729), ('neutral', 0.8274835348129272)]"
300059,This is amazing! I adore it!,"[('admiration', 0.9779117107391357)]"
300059,I sort of want to get this as a tattoo.,"[('desire', 0.9777374267578125)]"
300059,Her stare turns you to bread,"[('neutral', 0.9985907673835754)]"
300059,Seeking the artist because I want to get this tattooed on me ,"[('desire', 0.9777662754058838)]"
300059,Ok this concept is hillarious and i adore and also i love your art style! Its kinda similar to mine in that its stylized and i always feel like my art isnt real art but you just proved me wrong cause this is amazing,"[('admiration', 0.9950730204582214), ('love', 0.9160606265068054)]"
300059,"Not sure if it was his idea or not. A buddy of mine ran this in a one-off for D&D. It could turn people into bread instead of stone, it was a pretty entertaining encounter to say the least.","[('admiration', 0.7788565754890442), ('confusion', 0.8890905976295471)]"
300059,I can't wait for Mongoosa.,"[('excitement', 0.9433242678642273)]"
300059,I've been seeing a surge in goose-ified fantasy creatures. I like it.,"[('admiration', 0.3901035189628601), ('excitement', 0.5528099536895752), ('love', 0.5829158425331116)]"
300059,"So the next level of Untitled Goose Game, yeah?","[('curiosity', 0.9935770630836487)]"
300059,Can I use this art as my Profile picture for discord and other platforms? My user fits this picture so well,"[('approval', 0.5943136811256409), ('curiosity', 0.5274379253387451)]"
300059,I've finally found my spirit monster. I can't even express how much I love this.,"[('love', 0.9953224062919617)]"
300059,My players loved this encounter!,"[('love', 0.9843097925186157)]"
300059,"If you are taking requests, would you consider a Memoosa next?","[('curiosity', 0.9434134364128113), ('neutral', 0.3957903981208801)]"
300059,https://i.kym-cdn.com/entries/icons/original/000/002/252/NoMeGusta.jpg,"[('neutral', 0.9977827668190002)]"
300059,So does this make Megoosa more of a hydra?,"[('confusion', 0.37512022256851196), ('curiosity', 0.9152215719223022)]"
300059,this is so silly and well done. I love it.,"[('admiration', 0.6908150911331177), ('love', 0.9877232313156128)]"
300059,Does one turn into stone or a clump of yummy fresh grass?,"[('confusion', 0.9905845522880554)]"
300059,To be fair they both hiss,"[('neutral', 0.9943424463272095)]"
300059,It’ll absolutely haunt me in my dreams. Thanks,"[('fear', 0.39443111419677734), ('gratitude', 0.9389338493347168)]"
300059,I would get this as a tattoo,"[('approval', 0.8712106943130493), ('neutral', 0.8946237564086914)]"
300059,This is strangely adorable and I love it.,"[('admiration', 0.7558237910270691), ('love', 0.9839794635772705)]"
300059,Incredible it took several millennia for humans to finally make this joke,"[('realization', 0.9851674437522888)]"
300059,She's out there woeking making some geese,"[('neutral', 0.991731584072113)]"
300059,A monster from ancient Geese.,"[('neutral', 0.9978552460670471)]"
300059,This guy puts Medusa to shame.,"[('embarrassment', 0.8303073048591614)]"
300059,Asking permission to share this with others? Unaltered of course.,"[('confusion', 0.8130536675453186), ('curiosity', 0.4223581850528717)]"
300059,"I can’t wait to share this with my Latin students! We read the story of Baucis and Philemon, which features a guard goose, and they’ve been obsessed with geese this year ever since!","[('excitement', 0.8497331142425537), ('neutral', 0.566620409488678)]"
300059,"Defeating her requires a special item called ""bread"" from the breadsmith","[('neutral', 0.9990547299385071)]"
300059,This is my favorite thing,"[('joy', 0.6439646482467651), ('love', 0.9500811100006104)]"
300059,"Aside from loving the creativity of this piece, your pun legitimately made me giggle. This would be a fantastic DnD character design in a parody campaign.","[('admiration', 0.9933395981788635), ('amusement', 0.308895081281662), ('joy', 0.34618136286735535)]"
300059,Get the flock out of here!,"[('anger', 0.868075430393219), ('neutral', 0.9726026058197021)]"
300059,"This looks so wholesome, silly and terrifying at the same time, I’m loving it!","[('love', 0.9966837763786316)]"
300059,Death by a thousand honks,"[('neutral', 0.990198016166687)]"
300059,Awesome style. Reminds me of a random game I still haven't beaten Ittle Dew.,"[('admiration', 0.9975641965866089)]"
300059,This is hilarious. I love it.,"[('amusement', 0.8877050876617432), ('love', 0.9637694954872131)]"
300059,no one ask her about thatcher’s current status,"[('neutral', 0.9983515739440918)]"
300059,"When she looks at you, you turn into breadcrumbs and she feeds your breadcrumb corpse to her head geese.","[('neutral', 0.9988182187080383)]"
300059,Someone edit it and put the me gusta face on it,"[('neutral', 0.9991857409477234)]"
300059,Megoosa lost when you gave her ears,"[('neutral', 0.9984527826309204)]"
300059,Way more terrifying that the original,"[('fear', 0.9899294972419739)]"
300059,"This, but with Canadian Geese","[('neutral', 0.9986529350280762)]"
300059,Permission to have this tattooed onto me?,"[('curiosity', 0.9806979894638062)]"
300059,I can't believe ive never heard this pun before I love it,"[('love', 0.9898251891136169)]"
300059,You should check out Sam Flores if you don’t already know him. Very similar aesthetic. ,"[('approval', 0.9835509657859802)]"
300059,You're brilliant and I love it.,"[('admiration', 0.9535636305809021), ('love', 0.9549758434295654)]"
300059,"Goes to rotten politicians and unethical ""spiritual"" doctors, squints menacingly, and her hair just. ""QUACK! QUACK, QUACK!""","[('anger', 0.8691625595092773)]"
300059,This is scarier than the snakes lmao,"[('amusement', 0.9229270815849304), ('neutral', 0.3359962999820709)]"
300059,Make them Canadian geese and then you'll really scare ppl,"[('fear', 0.9115748405456543), ('neutral', 0.36765527725219727)]"
300059,"So much worse than snakes. Snakes are chill, and will leave you alone unless you startle or threaten them in some way.  But a goose? There's no pleasing a goose. There is no chill in a goose. There is only raw hatred and assholery.","[('anger', 0.47373032569885254), ('annoyance', 0.8039485216140747), ('disgust', 0.5124967694282532)]"
300059,There are geese that look like that?,"[('curiosity', 0.7518121600151062), ('neutral', 0.46658653020858765)]"
300059,Well she's not called mcsnakesa,"[('neutral', 0.9961124062538147)]"
