0,1,2
300210,Sup with the pubes floating around in there.,"[('neutral', 0.9989405274391174)]"
300210,Not the 1 terabyte version? Filthy peasant /s,"[('anger', 0.5196465253829956)]"
300210,"Subsurface scattering alone puts me in shivers, nice piece","[('admiration', 0.9644212126731873)]"
300210,If there’s not Rick Astley on that then you’re gonna need a chisel.,"[('neutral', 0.9981575608253479)]"
300210,Would you be fine if I used this as an album art concept? I love mocking up album art for my band,"[('curiosity', 0.5651500225067139), ('love', 0.9774437546730042)]"
300210,Pretty bleak but probably spot on.,"[('neutral', 0.831838846206665)]"
300210,"A flash drive would make more since, just saying","[('neutral', 0.9987896084785461)]"
300210,Imagine future generations having to devolve their technology to figure out what in on that archaic data chip.,"[('neutral', 0.8994472026824951)]"
300210,"Wow, nice,.i.wonder if this idea.could work somehow, I know the sd will lose its charge with time and make the data unreadable, maybe something longer term like optical?","[('admiration', 0.935981810092926), ('surprise', 0.9887738227844238)]"
300210,Why did I think this was a breast implant,"[('confusion', 0.9761837720870972)]"
300210,Who else thought of the Office when they saw this? lol,"[('amusement', 0.9878971576690674)]"
300210,As someone afraid of death. Is there anything that can be done to leave a record for a long time?,"[('curiosity', 0.9888353943824768)]"
300210,Real talk. Would this card work if you took it out of the Amber?,"[('curiosity', 0.622798502445221), ('neutral', 0.559846818447113)]"
300210,Are. are these anime erotica?,"[('curiosity', 0.9827466011047363)]"
300210,would make more sense to do this with a protective card if you really wanted to save it in amber XD,"[('neutral', 0.9971652626991272)]"
300210,"I will spend my life developing ever greater storage media, so that it will be 32 PB instead","[('neutral', 0.9984501600265503)]"
300210,"""After a Long Time, the sap got hardened and became fossilized, just like a Dino-sour bone, preservin' the TNA inside!""","[('neutral', 0.9987305998802185)]"
300210,"MOM I lost my ""homework"" memory card!  Have you seen it?","[('curiosity', 0.5441902875900269), ('disappointment', 0.6838355660438538), ('neutral', 0.3408523499965668)]"
300210,At first glance I saw a memory card and a breast implant,"[('neutral', 0.9757193922996521)]"
300210,I first thought this was a breast implant including cup size in the title,"[('realization', 0.453568696975708), ('neutral', 0.9767358303070068)]"
300210,Put a Bitcoin on that and bury it.,"[('neutral', 0.998968243598938)]"
300210,I thought this was a breast implant.,"[('confusion', 0.3542129397392273), ('neutral', 0.975604236125946)]"
300210,Should of put a mask in gem ;,"[('neutral', 0.9990311861038208)]"
300210,I thought a this was a chunk of cheese wrapped in plastic for an embarrassingly long time.,"[('embarrassment', 0.9835753440856934)]"
300210,Put a rick roll on it and bury it somewhere,"[('neutral', 0.9990708827972412)]"
300210,Dr. Hammond found the homework folder,"[('neutral', 0.9990575909614563)]"
300210,What program did you use for the materials/ rendering?,"[('curiosity', 0.9885572195053101)]"
300210,guy just puts some sd card under a piece of amber lol,"[('amusement', 0.9943185448646545)]"
300210,I would love to pick your brain about how you made the amber material! I've tried to make an amber material before but struggled greatly. Did you make it in Blender?,"[('curiosity', 0.4055077135562897), ('love', 0.9631356596946716)]"
300210,What was the SD card doing in a tree?! I guess we'll never know.,"[('curiosity', 0.9963523149490356)]"
300210,"That looks nice, well done. But why only 32GB thats no way near enough","[('admiration', 0.9957231283187866)]"
300210,Should’ve been a memory stick!,"[('realization', 0.66843181848526), ('neutral', 0.9334348440170288)]"
300210,[https://i.imgur.com/jWO3ICa.gif](https://i.imgur.com/jWO3ICa.gif),"[('neutral', 0.9964130520820618)]"
300210,Getting Jurassic Park vibes.,"[('neutral', 0.9985978007316589)]"
300210,Nothing but Rick rolled memes,"[('neutral', 0.9990184307098389)]"
300210,All the card contains is the live action Cat In The Hat movie,"[('neutral', 0.9987976551055908)]"
300210,Graphics card goes BRR,"[('neutral', 0.9988825917243958)]"
300210,"32Gb huh, basically a single video","[('neutral', 0.9989126920700073)]"
300210,Is it amber or is it shatter?,"[('confusion', 0.971936047077179)]"
300210,"Cue ""Trapped In Amber"" from Halo.","[('neutral', 0.9984170198440552)]"
300210,Someone needs to carve 2020 into a rock.,"[('neutral', 0.9988841414451599)]"
300210,Michael! Jim put my memory card in jello again!,"[('neutral', 0.9988234639167786)]"
300210,I use to see amber but now it’s just a lot of shatter.,"[('realization', 0.9077566266059875), ('neutral', 0.6094986796379089)]"
300210,That is NOT the card we want people to see.,"[('neutral', 0.9946724772453308)]"
300210,Love the small touch of chromatic aberration.,"[('love', 0.9863189458847046)]"
300210,"Well, here we are, Mr. Pilgrim, trapped in the amber of this moment","[('neutral', 0.9987505674362183)]"
300210,"Finally something of interesting in this sub, not mainstream or made to capture the hashtag of the moment. Really I want to hug you! Great job great job! THIS IS ART. Funny, faster, smart, fresh, contemporary and know how to connect images in people mind. Jurassic Park + Memory card appears so immediately to give sense to any following thoughts! It's a perfect equation!  You've all my respect! Amazing","[('admiration', 0.9964917302131653)]"
300210,Real question for those who might have an answer How would this impact the data on the SD card?,"[('neutral', 0.9775937795639038)]"
300210,I bet its full of hentai,"[('neutral', 0.8470519781112671)]"
300210,If all that remained of humanity was my usb. let’s just say they would know ALOT about the human anatomy,"[('neutral', 0.9979434609413147)]"
300210,What would be on the memory card?,"[('confusion', 0.36500120162963867), ('curiosity', 0.7997298836708069)]"
300210,"Data, uh. finds a way!","[('neutral', 0.9987579584121704)]"
300210,"Amber comes from trees, the way we are going there won't be any to make amber.","[('neutral', 0.9988783001899719)]"
300210,I loove simple and stylish app art like this. Makes me think about drawing,"[('admiration', 0.5078244209289551), ('neutral', 0.9802135825157166)]"
300210,Mind if a save the imagen for my next tatto?,"[('curiosity', 0.4455004036426544), ('neutral', 0.9076432585716248)]"
300210,I’m already at 2TB of music I’ve created. Suck on it to get full effect,"[('annoyance', 0.9070006012916565), ('neutral', 0.44984766840934753)]"
300211,This is so pleasing to look at. I especially love how you did the metal,"[('love', 0.9783419370651245)]"
300211,Absolutely stunning! I really love how you've rendered all the metal!,"[('admiration', 0.9962127208709717)]"
300211,Hi! What program do you use?,"[('neutral', 0.9809694290161133)]"
300211,Thought it was a still shot from a Makoto Shinkai film,"[('neutral', 0.9988518953323364)]"
300211,"Reminds me of Waking Life & the A Scanner Darkly film, love it.","[('love', 0.9846392869949341)]"
300211,"I absolutely dig this.  Like. this is life, just everyday life.  But it's got so much color. When i wash dishes i like to think about the best parts of the meal. I feel like the person in this painting is doing that.","[('admiration', 0.9956198334693909)]"
300211,"more often than not, some of the best art in the world is well-done depictions of mundanity","[('admiration', 0.9856297373771667)]"
300211,"Not really a still life, nice though","[('disapproval', 0.9680901765823364)]"
300211,Love this. Excellent angle and composition,"[('admiration', 0.9975663423538208)]"
300211,"looks like some Makoto Shinkai artwork, I love it","[('love', 0.9924312829971313)]"
300211,I like all the colors in this a lot,"[('love', 0.9493871331214905)]"
300211,This is a genius painting.,"[('admiration', 0.995672345161438)]"
300211,Cool . the joy of everyday life lol,"[('amusement', 0.8904449939727783), ('joy', 0.8324639201164246)]"
300211,I wish I could wash my dishes with a bath bomb too!,"[('desire', 0.9580165147781372)]"
300211,This is so cool also can you please tell me what this art style is called? Thanks,"[('curiosity', 0.8901422619819641), ('gratitude', 0.9203990697860718)]"
300211,"I love it, the beauty of everyone’s boring life . Instead of looking at things as drudgery snd work we can all look at the beauty of it. It takes artist to show us the beauty.","[('admiration', 0.9285166263580322), ('love', 0.9628855586051941)]"
300211,Really beautiful art style! Do you have more? It kinda has like a trippy kinda vibe to it,"[('admiration', 0.9871752858161926), ('curiosity', 0.3564000725746155)]"
300211,The coloring is so nice! Well done,"[('admiration', 0.9962087869644165)]"
300211,Can I share this on social media? If yes please tell me your name so I can give you credit and tag you. This is one of the nicest paintings I've seen!,"[('admiration', 0.9872369766235352), ('curiosity', 0.5224195122718811)]"
300211,Oh my God I love this,"[('love', 0.9829974174499512)]"
300211,No ones talking about how amazing the water and bubbles are too,"[('admiration', 0.856841504573822), ('disapproval', 0.5184239745140076)]"
300211,"Yes, I'm being moved to tears by a painting of dishes being done.","[('sadness', 0.8722455501556396), ('neutral', 0.7349712252616882)]"
300211,Lovely colors! I would love to hang something like this right over my kitchen sink someday,"[('love', 0.9962120056152344)]"
300211,Something about this makes me want to clean the dishes in hopes i can achieve whatever feeling this is giving me.,"[('optimism', 0.9889844655990601)]"
300211,Fantastic! I enjoy this very much.,"[('admiration', 0.9598088264465332), ('joy', 0.9763522744178772)]"
300211,I really enjoy this. Love the vibrancy and the style,"[('joy', 0.9908446669578552), ('love', 0.8036138415336609)]"
300211,"This is amazing, I absolutely love it! The metal looks so cool!","[('admiration', 0.9962599277496338), ('love', 0.6575114727020264)]"
300211,Looks like lochlan goudie - absolutely love it!,"[('love', 0.9964355230331421)]"
300211,"This picture reminds me of ""Disco Elysium""","[('realization', 0.9182371497154236), ('neutral', 0.46579399704933167)]"
300211,"That is an amazing picture. You took something that is a routine and at times burdensome, and made it beautiful.","[('admiration', 0.9976683259010315)]"
300211,"Beautiful! To me, this really captures that feeling of just having smoked some weed that makes you feel good, so good that you do the dishes and then you're double-happy because you're doing something productive.","[('admiration', 0.9975646734237671)]"
300211,"Amazing use of colors. I’m following your profile, I want to see everything you create!","[('admiration', 0.9970158338546753)]"
300211,This is incredible! I love the style and detail and the colors work wonderfully together,"[('admiration', 0.997601330280304)]"
300211,Getting scanner darkly vibes from this,"[('neutral', 0.9988553524017334)]"
300211,I really enjoy this picture. Makes me wanna have it to hang above the kitchen sink.,"[('joy', 0.9914603233337402)]"
300211,"I love it, hope to see more","[('love', 0.9922295212745667), ('optimism', 0.619244396686554)]"
300211,I can totally hear this moment. lovely stuff!,"[('admiration', 0.9904229640960693)]"
300211,what type of brush did you use to get those beautiful textures?,"[('curiosity', 0.9898847341537476)]"
300211,Love the colors! Thanks for sharing!,"[('gratitude', 0.9858168959617615), ('love', 0.977514922618866)]"
300211,What acessories you utilize to make these digital masterpieces?,"[('curiosity', 0.9811267256736755)]"
300211,You just reminded me I need to do the dishes! Thanks a ton!,"[('gratitude', 0.9942373037338257)]"
300211,Really wasting water here,"[('annoyance', 0.909295380115509), ('disappointment', 0.33974069356918335), ('disapproval', 0.6487738490104675)]"
300211,Love your color choice. Beautiful work!,"[('admiration', 0.9964609742164612)]"
300211,I would hang this in my home. I can’t give a higher compliment. This would go great in the kitchen.,"[('admiration', 0.9936343431472778)]"
300211,Omg.it's.it's me! You did a fantastic job!,"[('admiration', 0.9609300494194031), ('excitement', 0.5827780961990356)]"
300211,Strong Lucien Freud vibes!,"[('neutral', 0.9986894726753235)]"
300211,"Very nice use of colors, but. it isn't a still life?","[('admiration', 0.9987127780914307)]"
300211,Don't forget to turn the faucet off so you're not wasting water,"[('caring', 0.9519768953323364)]"
300211,"I just love it so much. I can't exactly tell why but I do ! The style, colours, shapes. Awesome work OP ! I'd hang it in my kitchen D","[('admiration', 0.9984484910964966), ('love', 0.7724273800849915)]"
300211,This rocks. Kind of psychedelic in its realism-non-realism,"[('approval', 0.6930992603302002), ('neutral', 0.7993224859237671)]"
300211,I really love it! Do you have more art in the same style? Would love to see more! It gives me a real Edward hopper vibe!,"[('love', 0.9879747629165649)]"
300211,This is gorgeous! I would hang it in my kitchen!,"[('admiration', 0.9945774078369141)]"
300211,I sad day to wash spoons and get water all over everything,"[('sadness', 0.9869462847709656)]"
300211,Upgrade your sink to a rectangular single bowl that is 7-9 inches deep and your dish cleaning game will thank me. It's a literal life changer.,"[('gratitude', 0.9832870960235596)]"
300211,"This is such a cool style, I love it.","[('admiration', 0.9885252118110657), ('love', 0.8279303908348083)]"
300211,You have a beautiful style ,"[('admiration', 0.995674192905426)]"
300211,This is really cool. The texture reminds me of gouache. I kept having to double check that it said digital.,"[('admiration', 0.9966373443603516)]"
300211,"Umm, can we address the amazing glowing light on the spoon handle? Stunning!","[('curiosity', 0.9266510009765625), ('surprise', 0.9400528073310852)]"
300211,Well that's beautiful. Has kind of a 50s diner vibe to it. I love it D,"[('admiration', 0.9972259402275085), ('love', 0.37577322125434875)]"
300211,Beautiful colors. Looks like the reflection of light off of a bubble. Really cool way to bring some whimsy into a painting representing everyday life. Feels very magical realism.,"[('admiration', 0.9957250356674194)]"
300211,"Waking Life vibes, so nice","[('admiration', 0.9970933198928833)]"
300211,Look at fancy pants with 2 sinks,"[('neutral', 0.9901717305183411)]"
300211,May I use this as my phone background op?,"[('curiosity', 0.9534204602241516)]"
300211,I wash in the right and dry in the left. Come at me,"[('neutral', 0.9984185695648193)]"
300211,"Holy cow this looks magical. I absolutely love how vibrant you were able to make this despite it being just a sink and water. Amazing and something different, too ","[('admiration', 0.9987524747848511)]"
300211,this is more real life than real life,"[('neutral', 0.998641312122345)]"
300211,"This reminds me of the art you'd see on a kids' chapter book cover. Ah, to be a child again.","[('realization', 0.9219304323196411)]"
300211,Too real! Wonderful execution ,"[('admiration', 0.9943190217018127)]"
300211,Your Color choices are Fantastic! You've portrayed them ecellentally!,"[('admiration', 0.9964364767074585)]"
300211,This is weird but I have that exact kitchen sink.,"[('disgust', 0.5985287427902222), ('embarrassment', 0.4551628828048706)]"
300211,"This is beautiful to look at and a great concept and execution but I would advise you to get a dishwasher, mate. It's better for the environment.","[('admiration', 0.9980201721191406)]"
300211,It's interesting to see it's 2020 ranking.,"[('excitement', 0.9459601640701294)]"
300211,Why can I hear this? ,"[('neutral', 0.9880605340003967)]"
300211,"For a second it looked like you were washing a wrench, and I was trying to understand the statement you were making by. washing a wrench. Then I realized it was just a spoon and fork. goes to show you what my mind jumped towards, though!","[('realization', 0.993187427520752)]"
300211,"Silly question, did you use reference, love the ""Waking Life"" POV vibes  next you should make it looking at a light switch D","[('curiosity', 0.7831826210021973), ('love', 0.7189104557037354)]"
300211,"Make things beautiful ""I want to learn more and more to see as beautiful what is necessary in things; then I shall be one of those who make things beautiful. Amor fati let that be my love henceforth! I do not want to wage war against what is ugly. I do not want to acuse; I do not even want to acuse those who acuse. Looking away shall be my only negation. And all in all and on the whole some day I wish to be only a Yes-sayer."" - Friedrich Nietzsche","[('desire', 0.9844884872436523)]"
300211,"Woah definitely thought this was painted. So cool  Edit ha whoops, didn’t even pay attention to the medium in the title","[('admiration', 0.8960734009742737)]"
300211,This looks like when you are the drugs are the drugs real or is reality fake who what why how how what who who why hmm,"[('confusion', 0.9144642353057861)]"
300211,All the colors pulled me into this painting. It made me look at it.,"[('neutral', 0.6726356148719788)]"
300211,"It’s not a still life. It’s beautiful, but not a still life . Again all beautifully done but you’d be the person getting a B in High school studio art for not getting any answers correct in the quizes.","[('admiration', 0.997989296913147)]"
300211,This is my life. Washing dishes is my therapy.,"[('neutral', 0.9984286427497864)]"
300211,This is fantastic. Thank you for sharing.,"[('admiration', 0.9276825785636902), ('gratitude', 0.9968003034591675)]"
300211,Am I debating making this my phone background? Yes. Do I know why? No. But I love it.,"[('confusion', 0.8613458871841431), ('curiosity', 0.6981791257858276), ('love', 0.9621317982673645)]"
300211,Which type of brush do you use?,"[('curiosity', 0.9788460731506348)]"
300211,I love how you made a mundane moment kinda magical,"[('love', 0.9720692038536072)]"
300211,Rembrandt o.o idk why or who he is or what style he does but his name pops up when I look at this. Its so.relatable but well done.,"[('admiration', 0.9973794221878052)]"
300211,Very Norman Rockwell of you!,"[('admiration', 0.7403491139411926), ('neutral', 0.5906710624694824)]"
300211,I forking love this. You could title it “Sudsurday”,"[('love', 0.9336146712303162)]"
300211,You are much more than the dishes! Gifted!  Thank you!,"[('gratitude', 0.9973503351211548)]"
300211,Love the work. But OP should invest in a dish wand tbh. Changed my perspective of washing dishes.,"[('admiration', 0.49611541628837585), ('love', 0.9898923635482788)]"
300211,"I like this very much. The blues in the water are found in the silver ware, in water droplets on the back splash, on the soap suds - all over! Just so cool.","[('love', 0.9562250971794128)]"
300211,Seeing a video game based on this are art style would be awesome!,"[('admiration', 0.9883610010147095)]"
300211,"Right there with you buddy. This is the day-to-day. We're all there with each other, going through it, minute by minute. Near or far.","[('neutral', 0.9986129999160767)]"
300211,Oh the color palette on this is gorgeous,"[('admiration', 0.991874635219574)]"
300211,This is beautiful. I imagine this is what tetrachromacy looks like. I absolutely love it!,"[('admiration', 0.9958206415176392), ('love', 0.9518929719924927)]"
300211,I’m a small artist that mainly does ink on paper! I then make it transparent and add color digitally. I really appreciate how much work and detail went into this.,"[('admiration', 0.9959969520568848)]"
300211,I love everything about this! I’d love this on my wall! So talented.,"[('admiration', 0.9117721915245056), ('love', 0.9722164273262024)]"
300211,"The bubbles are amazing, the way they run from greenish food to clean water","[('admiration', 0.989657461643219)]"
300211,Nice. Was hoping it was real paint. Solid lines and use of colour.,"[('admiration', 0.9214912056922913), ('optimism', 0.9849975109100342)]"
300211,Love everything about this. Awesome style.,"[('admiration', 0.9970967769622803)]"
300211,"I don’t know why, but looking at this made me feel peace and comfort. I just had a tough day at work. Can I see more of your art somewhere?","[('curiosity', 0.9570333361625671)]"
300211,that’s super cool! what program did you use?,"[('admiration', 0.9760505557060242), ('curiosity', 0.5809500813484192)]"
300211,Godzilla had a stroke to read the title of this post.,"[('neutral', 0.768491268157959)]"
300211,"I love it. But I also kinda hate that I can smell it, too.","[('love', 0.9922274947166443)]"
300211,"Based on the stainless, your real life is a steel life.","[('neutral', 0.9989532232284546)]"
300211,reminds me of waking life,"[('realization', 0.34511587023735046), ('neutral', 0.9915263056755066)]"
300211,"I extremely love this, very original technique!","[('admiration', 0.9745274782180786), ('love', 0.8774319291114807)]"
300211,This is great. It’s beautiful. The colors are awesome,"[('admiration', 0.9945653676986694)]"
300211,yoo this looks like a still from a makoto shinkai anime,"[('neutral', 0.9899114966392517)]"
300211,"I like your style, its very clean","[('admiration', 0.9892132878303528), ('love', 0.34721341729164124)]"
300211,My life has been one long dream.,"[('desire', 0.9172934293746948)]"
300211,its cool its well made but i don't like it bcs the water.its on and the person they are washing the fork and the spoon and the water its on try to don't.use so much water,"[('disapproval', 0.7739863395690918), ('neutral', 0.4501543343067169)]"
300211,The bane of my existence. You should do laundry next!,"[('neutral', 0.9956531524658203)]"
300211,In LOVE with this art style.,"[('love', 0.943349301815033), ('neutral', 0.3509717583656311)]"
300211,perfect to describe many of us,"[('approval', 0.351229190826416), ('neutral', 0.9623368978500366)]"
300211,I love the colors in this. Almost feels like a frame from Makoto Shinkai's Garden of Words.,"[('love', 0.9813644289970398)]"
300211,"As someone who loves to wash the dishes, I approve of this masterpiece!","[('approval', 0.9971100687980652)]"
300211,This is great! Everyday life made beautiful!,"[('admiration', 0.9913311004638672)]"
300211,woah aowesome work! I love your style,"[('admiration', 0.9846241474151611), ('love', 0.6906843185424805), ('surprise', 0.5276671648025513)]"
300211,Wiw just wow mad claps from me,"[('excitement', 0.8805250525474548), ('surprise', 0.5867000222206116)]"
300211,"Love it , thanks for sharing your work.","[('gratitude', 0.9943215847015381), ('love', 0.9354069828987122)]"
300211,Nice! You really nailed the reflectiveness of the metal on the faucet and spoon,"[('admiration', 0.9976710677146912)]"
300211,Never not cleaning. I feel you. This is amazingly done. Good work!,"[('admiration', 0.996748685836792)]"
300211,"I love this idea. People usually paint beautiful parts of life, I love that you chose to paint the less glamorous parts. Its amazingly done as well!","[('admiration', 0.9946256279945374), ('love', 0.8586926460266113)]"
300211,"I always dread doing the dishes. Thank you for romanticizing something I find so hard to see the beauty in! This set is going to be amazing I can tell, completely up my alley.","[('admiration', 0.8148667216300964), ('gratitude', 0.9987766146659851), ('love', 0.44059324264526367)]"
300211,"I just saw your post of cleaning brushes, and I came to comment on this one.  I love your style ! And I love this one the most. But that's cause off my own love hate relationship with doing the dishes. Now every time I do the dishes i see you painting and doing the dishes got a bit brighter just cause off this ""painting""  Well done, you changed a view by an art work ","[('admiration', 0.9967936873435974), ('love', 0.913144588470459)]"
300211,"It looks like rotoscopy, really digging it","[('neutral', 0.9958750605583191)]"
300211,When you eat an edible and do the dishes,"[('neutral', 0.9988259673118591)]"
300211,"I thought this was an actual picture lol, well done","[('admiration', 0.972135066986084), ('amusement', 0.9331082701683044)]"
300211,This is so satisfying. I’ve always admired people that portray real perspective so well! How do you do it? Do you use a picture as a reference or maybe study still life?,"[('admiration', 0.9969897270202637)]"
300211,"Its random that i am here , looks great","[('admiration', 0.975830614566803)]"
300211,I’m watching Intervention while browsing Reddit. I thought this was two spoons and it had a very different meaning to me.,"[('realization', 0.38023996353149414), ('neutral', 0.9317614436149597)]"
300211,Dude put some gloves on for washing dishes.,"[('neutral', 0.9985998272895813)]"
300211,This is literally my life like 3-4x/day Edit and holy guacamole it’s beautiful,"[('admiration', 0.9964625239372253)]"
300211,"Are there some ""time lapse"" tutorials that I could watch that shows this type of art?","[('curiosity', 0.9779646396636963)]"
300211,the tap handle looks like a ducky,"[('neutral', 0.9989691972732544)]"
300211,That faucet is incredible. The shine is perfect.,"[('admiration', 0.9974998831748962)]"
300211,I know the Facebook filter that does this. That’s so cool you use it too.,"[('admiration', 0.76762855052948), ('approval', 0.9913063645362854)]"
300211,"I love how you painted the metal reflections, and the soap bubbles are very simplified and yet perfectly encapsulate what they are. This is a real cool style.","[('admiration', 0.9813858866691589), ('love', 0.8301536440849304)]"
300211,Have i been using the wrong side of the sink my whole life?,"[('curiosity', 0.710407018661499), ('neutral', 0.83946293592453)]"
300211,Pictures painted before disaster,"[('neutral', 0.9991875290870667)]"
