0,1,2
300054,I couldn’t even begin to imagine losing my father and a sibling in the same moment. I feel so terrible for that family.,"[('fear', 0.6552055478096008), ('sadness', 0.9784352779388428)]"
300054,I wanted to watch this girl become a star.  Rest In Peace.,"[('desire', 0.9863491058349609)]"
300054,There are artists that are quicker than funeral parlours,"[('neutral', 0.9988865256309509)]"
300054,"That’s the part that hurts the most, she died too young.","[('sadness', 0.989763617515564)]"
300054,"I’ve held it back all day, but this one got me. Thanks for the moment","[('gratitude', 0.9941810965538025)]"
300054,I can’t believe we’re at the point in human history where it only takes a few hours between a celebrity death being reported on television and “tribute art” being created. Like did BossLogic see the first reports and immediately sit down to work on this?,"[('curiosity', 0.7155306935310364), ('surprise', 0.8899002075195312)]"
300054,Today I lost one of my childhood hero’s. It should’ve never been like this. RIP Kobe and Gigi.,"[('grief', 0.43474799394607544), ('sadness', 0.7523024082183838)]"
300054,"We've reached the gratuitous phase of grieving, eh?","[('curiosity', 0.9541171789169312), ('sadness', 0.5991772413253784)]"
300054,"I shed a tear every time I think about what he must have been saying to her knowing they wouldn’t be coming out alive. Just hug me baby, close your eyes. It’ll be fine in a minute. Man Rip","[('caring', 0.9873337745666504)]"
300054,"Not trying to be ""negative"" here but we can kind of see how this Bosslogic guy is really skimping on quality and is probably just trying to get views off this incident. These two people don't even look like Kobe or his daughter. He was more on the lean side and this guy has broad shoulders and a large neck. His daughter almost always has kept her hair straight, probably taking after her mom. Not a good piece of work in my opinion, he needed to spend a couple more minutes to do some research. Edit After looking through this guy's portfolio I can see now that he mostly does editing of real photos into art, but doesn't draw very much of his own work. He most likely grabbed stock images of a Black family and photoshopped the rest.","[('neutral', 0.9988034963607788)]"
300054,It's a nice drawing but can't help but feel like people posting 12-24 hours after something like this are just cashing in on a tragic event for the Internet points.,"[('admiration', 0.43271970748901367), ('approval', 0.9495188593864441), ('realization', 0.36402052640914917)]"
300054,Am I the only one who thinks it is incredibly distasteful and disrespectful to create then post this literally less than 24 hours after the crash?,"[('annoyance', 0.36483287811279297), ('curiosity', 0.9753831028938293)]"
300054,"I love this. I’d been thinking about how horrible it would be to know you’re gonna die and to have your kid there with you- like you can’t protect them. I love this image of him with his arm around her like comforting/guiding/escorting her out of this world. Like “it’s okay, daddy is here.” It reframed things for me in a more palatable way. Like maybe him taking some sort of comfort in that she wasn’t alone/without him in her last moments and her taking some sort of comfort that Daddy IS there.","[('love', 0.9952337145805359)]"
300054,"Ah yes, the big basketball hoop in the sky","[('neutral', 0.9905198812484741)]"
300054,"Right? But the other people that died in the helicopter crash, not even an honorable mention. And people think nihilism isnt relevant.","[('confusion', 0.34419238567352295), ('curiosity', 0.9730100631713867)]"
300054,Glad you're on top of promoting your brand.,"[('gratitude', 0.3866759240627289), ('joy', 0.8107916116714478)]"
300054,Reddit people are atheist,"[('neutral', 0.7927217483520508)]"
300054,How do people draw these so fast?,"[('confusion', 0.9401747584342957)]"
300054,Wouldn’t they be dunking into each other’s halos?,"[('curiosity', 0.34179067611694336), ('neutral', 0.9130135774612427)]"
300054,And all the other peeps in the chopper who weren’t famous/rich.,"[('neutral', 0.9986458420753479)]"
300054,That is beautiful. It made me tear up. Thank you.,"[('admiration', 0.9369986653327942), ('gratitude', 0.9962659478187561)]"
300054,This sucks and nobody thinks about the 30 marines that died in a heli crash the day before.,"[('annoyance', 0.9867109656333923)]"
300054,Why is no one mourning the 7 other people who were on that flight?,"[('curiosity', 0.948722779750824)]"
300054,R.I.P to everyone on that helicopter,"[('neutral', 0.9988699555397034)]"
300054,This feels rushed. Like the artist is trying to be first.,"[('neutral', 0.9990108013153076)]"
300054,Didn't this just happen today.?,"[('neutral', 0.9895341992378235)]"
300054,It amazes me how fast the internet is to react to events like this.,"[('surprise', 0.9463525414466858)]"
300054,What a crock picture. People are so selfish.,"[('annoyance', 0.9407833814620972), ('disappointment', 0.329880028963089)]"
300054,Way to make someone’s tragedy about you,"[('neutral', 0.9920361638069153)]"
300054,I’m sorry that the art sub is so awful apparently. I honestly thought I had it sorted by controversial.,"[('disgust', 0.48838430643081665)]"
300054,"Lol, stop making everybody saints. it's tragic and this man probably meant a lot to a lot of people, but get off the hype train and get over it.","[('amusement', 0.9869979619979858)]"
300054,This is really beautiful. RIP Kobe and Gigi and everyone who died in this crash. And all the other forgotten souls across the world.,"[('admiration', 0.9894406199455261)]"
300054,Wow I can't believe someone gave this platinum. haha,"[('amusement', 0.7963777184486389), ('surprise', 0.9103103280067444)]"
300054,"My dream had always been meet him, I'm so sad and broken. He was my dream, an inspiration to everything. Why always the good people.","[('desire', 0.8627103567123413), ('sadness', 0.773766040802002)]"
300054,"So sad! Kinda the same thing as Thurman Munson’s death in the late 70’s Kobe had a much more impact on the game and this world though, and is truly missed by many all across the world. RIP Kobe and Gigi This is a matter of where you need answer as to how and why it happened. I’ve never been one to let deaths from others besides my dear loved ones and close friends get to me, but when these were confirmed it felt that I was letting go of a good friend","[('sadness', 0.9773698449134827)]"
300054,Legend will life inside our,"[('optimism', 0.9579328298568726)]"
300054,Rip Kobe. Saying Kobe while shooting won't be the same anymore,"[('neutral', 0.9979094862937927)]"
300054,Amazing art inspired by devastation.,"[('admiration', 0.9971641898155212)]"
300054,He will never dunk in heaven,"[('neutral', 0.9986866116523743)]"
300054,All we can do now is watch her daughter become a star.,"[('neutral', 0.8876017928123474)]"
300054,I’ve been crying all day. This art piece is hitting hard and I greatly appreciate it.,"[('admiration', 0.9855732321739197), ('gratitude', 0.5976526737213135), ('sadness', 0.30728018283843994)]"
300054,Rest in peace. This one is my fave,"[('caring', 0.8926904797554016), ('love', 0.8444576859474182)]"
300054,Art? Isn’t placing halos over heads photoshoot.,"[('neutral', 0.9976028800010681)]"
300054,Doesn’t everyone find it odd how there are so many people dying in helicopter and private plan crashes? I’m wondering if someone didn’t do their checking about the weather because it’s sort of odd how people are dying using these private related ways of traveling. I feel like this could’ve been prevented.,"[('curiosity', 0.9859907031059265)]"
300054,This is epic! Which software Photoshop?,"[('admiration', 0.6936588287353516), ('curiosity', 0.9529452919960022)]"
300054,Breaks my heart to pieces.,"[('sadness', 0.9905083179473877)]"
300054,"Rip Kobe, Gigi and the other person.","[('neutral', 0.9989651441574097)]"
300054,"Way to credit the artist. Via Bosslogic everyone. His caption was ""Hoops are a little different up here, everyone gets one""","[('neutral', 0.9982582926750183)]"
300054,May his soul and daughters rest!,"[('neutral', 0.9734222292900085)]"
300054,"I remember watching get drafted right out of high school. All the great games, I especially feel honored to see Kobe play against Jordan. Truly a legend. RIP KobeBryant","[('admiration', 0.9915907382965088)]"
300054,Dammit got me in the feels bosslogic!,"[('annoyance', 0.9771241545677185)]"
300054,"A lot of art I’ve been seeing since he and his daughter passed have been just of him, which is fine, but I’m glad to see them both remembered. Sad day. But GOAT is forever.","[('sadness', 0.9885302186012268)]"
300054,You'd think they've reached the hoop by now,"[('neutral', 0.9970093965530396)]"
300054,The deafening silence in the ATC communication channel is soul crushing. Here's the helicopter's last communication with ATC,"[('disappointment', 0.4497268795967102), ('sadness', 0.6426096558570862), ('neutral', 0.7175546288490295)]"
300054,The good die far too young. He was such an inspiration. May we follow his lead. RIP,"[('caring', 0.7060662508010864)]"
300055,So was it a peach instead?,"[('confusion', 0.41890668869018555), ('curiosity', 0.9330962300300598)]"
300055,It never was an apple anyway - the kind of fruit isn’t mentioned in the story. In the Middle Ages it became standard to show an apple because of the symbolism of “malum”  being similar to “malus” .,"[('neutral', 0.998340368270874)]"
300055,I always thought the fruit/snake female/male genitalia thing was intentional.right?! Didn't Milton pick up on this?,"[('neutral', 0.9513611793518066)]"
300055,Did you know apple used to basically just mean fruits and vegetables in general?,"[('curiosity', 0.6397276520729065), ('realization', 0.7863656878471375)]"
300056,"wow I thought this was a painting, beautifully done","[('admiration', 0.9908725619316101)]"
300056,"This is wonderful. It's so airy and bright, and I just love how the girl's clothes are the same color and shape  as the flowers; making them the same size from our perspective was a great touch, particularly the one that bends down toward the bottom-right. Beautiful work, and particularly amazing that this is actually a photograph.","[('admiration', 0.9988613128662109)]"
300056,"This isn't a photograph. Look at the beams of light coming from the windows. First of all, the woman doesn't seem to cast a shadow on the floor, despite clearly standing in front of the light. Secondly, the shadows from the window panes don't seem to match up. On the floor, the shadows show 2 rows of 6 window panes at the bottom, whereas the actual window only has 1 row of 3. Also it just doesn't look quite right. It looks like a painting, because it probably is a painting.","[('neutral', 0.9834749698638916)]"
300056,Full of life imbued with a fresh connection between plant and human elements. Good composition.,"[('admiration', 0.996976375579834)]"
300056,Are those Lisianthus flowers?,"[('curiosity', 0.9948776960372925)]"
300056,I love this! Her dress looks like the flowers,"[('love', 0.9931102991104126)]"
300056,This is beautiful. This is why I love photography,"[('admiration', 0.9951135516166687), ('love', 0.7679470181465149)]"
300056,If this is a photo its shopped,"[('neutral', 0.9981456995010376)]"
300056,Gametes matching up too lol,"[('amusement', 0.994145393371582)]"
300056,"Usually I say a painting looks like a picture, but this is the opposite.","[('neutral', 0.9958187937736511)]"
300056,Wow! I don't think I've ever seen a photo or painting that I'd be sure about. But this one! I want it so badly! It is amazing!,"[('admiration', 0.9782962799072266), ('surprise', 0.33359289169311523)]"
300056,LOVE IT! It reminds me of that pic from a ehile back of that ballerina with a tulip,"[('love', 0.9911393523216248)]"
300056,"Ooh I thought this was a painting! Absolutely in a good way, of course; it's so gorgeous and everything just.blends in so nicely.","[('admiration', 0.997602641582489)]"
300056,This is a lovely composition. Beautiful use of lighting and color to arrange mood. Nice work!,"[('admiration', 0.9953370094299316)]"
300056,If this is a photograph I’m also a multi billionaire that will hand out plat to everyone on this thread,"[('neutral', 0.7889600992202759)]"
300056,This has to be a painting! I refuse to believe this is a photograph,"[('disapproval', 0.8265615701675415)]"
300056,Her leg is in the light but casts no shadow. Is she a ghost?,"[('confusion', 0.9762800335884094), ('curiosity', 0.7398681640625)]"
300056,The author started photographing from scratch at the age of 34.,"[('neutral', 0.9989125728607178)]"
300056,"Why is your profile just the spamming of IG's top photographers? Haris Nukem, Dubnitsky, etc.","[('confusion', 0.45544952154159546), ('curiosity', 0.8208596110343933), ('neutral', 0.36849886178970337)]"
300056,"Very cool! Artistic, creative, and talented!","[('admiration', 0.9970025420188904)]"
300056,"Wow, I can’t believe this is a photo. Looks too good to be a moment captured. Excellent!","[('admiration', 0.9855002760887146), ('surprise', 0.716918408870697)]"
300056,"Beautiful lisianthus, graceful model, stunning composition.","[('admiration', 0.9967094659805298)]"
300056,Breathtakingly beautiful. Amazing composition.,"[('admiration', 0.9960655570030212)]"
300056,Reminds me of the intro screen from the last of us,"[('neutral', 0.9970607161521912)]"
300056,It looks like the vase is photobombing the dancer.,"[('neutral', 0.9988571405410767)]"
300056,Is that Scarlett Johansson?,"[('confusion', 0.5522488951683044), ('curiosity', 0.8376190066337585)]"
300056,"i want this hanging on my wall, its so relaxing and beautiful.","[('admiration', 0.9955691695213318), ('desire', 0.7571315765380859), ('joy', 0.509691059589386)]"
300056,Really fantastic composition. I will have to look up more of this photographer’s work.,"[('admiration', 0.9957118034362793)]"
300056,1. It’s to say we did dancing,"[('neutral', 0.9961942434310913)]"
300056,I thought it was a painting,"[('neutral', 0.9898239970207214)]"
300056, Looks like a dancing puppet,"[('neutral', 0.9983483552932739)]"
300056,She can put a hole through that window,"[('neutral', 0.9988672733306885)]"
300056,"Great shot, shame about the attitude leg line.","[('admiration', 0.613977313041687), ('disappointment', 0.5074450969696045), ('embarrassment', 0.8876774907112122)]"
300056,The togfather is another photography who takes photos that emulate paintings. He goes with a more fantasy pushed theme. nsfw but some good stuff.,"[('admiration', 0.9666396379470825), ('neutral', 0.7485932111740112)]"
300056,What? This is.a photo? My brain hurts.,"[('sadness', 0.9467487931251526), ('surprise', 0.323698490858078)]"
300056,How much haze did you pump in?,"[('confusion', 0.7674522399902344), ('neutral', 0.7177860140800476)]"
300056,Wow that looks just like a photo!,"[('surprise', 0.9847065806388855)]"
300056,In Germany it’s no dancing bear,"[('neutral', 0.9943175911903381)]"
300056,Nnnoo stay! He’s no dancing bear,"[('neutral', 0.9944478273391724)]"
300056,Unbreakable Kimmy Schmidt New Girl Fresh Off the Boat,"[('neutral', 0.99498450756073)]"
300056,"His work is incredible, like paintings","[('admiration', 0.9962943196296692)]"
300056,This is absolutely gorgeous!,"[('admiration', 0.9889230728149414)]"
300056,This is real artwork. This looks wonderfull,"[('admiration', 0.9959666728973389)]"
300056,"Does anybody agree that her sweater matches the green of the plant leaves, and her dress matches the color of the flowers?","[('curiosity', 0.36306700110435486), ('neutral', 0.8600797653198242)]"
300056,What time would this dress be in? 190s?,"[('confusion', 0.3867655396461487), ('curiosity', 0.7445318698883057)]"
300056,How can you tell they are female flowers?,"[('neutral', 0.981480062007904)]"
300056,David Graff actually played the game at least?,"[('curiosity', 0.8765022158622742), ('neutral', 0.7841431498527527)]"
300056,Well that is terrifying and amazing !,"[('admiration', 0.9206490516662598), ('fear', 0.9328761696815491)]"
300056,Well that is terrifying and amazing !,"[('admiration', 0.9206490516662598), ('fear', 0.9328761696815491)]"
300056,The real flower girl Your art is so blooming. It's amazing!,"[('admiration', 0.9957870841026306)]"
300056,David Otunga is in for the bitchslap,"[('neutral', 0.9987164735794067)]"
300056,That bullet is trying to be Girl Diaz.so,"[('neutral', 0.998869001865387)]"
300056,Reminds me of this picture,"[('realization', 0.9668649435043335), ('neutral', 0.7918223738670349)]"
300056,It's trying to be Girl Diaz.so,"[('neutral', 0.9989069700241089)]"
300056,"Girl, flowers, and dancing","[('neutral', 0.9992091059684753)]"
300056,"Girl, you have radar vision?","[('curiosity', 0.5648226141929626), ('neutral', 0.9050124287605286)]"
300056,It took me a while to realize this is a picture! Wow,"[('realization', 0.9402570724487305), ('surprise', 0.8856674432754517)]"
300056,An SFW Dubnitskiy? Talk about a unicorn.,"[('neutral', 0.8014717698097229)]"
300056,Hit me with a good time frig dancing.,"[('annoyance', 0.6176853179931641), ('neutral', 0.39063191413879395)]"
300056,My pareodelia is going nuts looking at this pic.,"[('optimism', 0.35588178038597107), ('neutral', 0.6203528642654419)]"
300056,Beautiful! I can feel the warmth of the room.,"[('admiration', 0.99503493309021)]"
300056,She looks like the flower,"[('admiration', 0.9112322330474854), ('neutral', 0.4324171543121338)]"
300056,This is beautiful and oddly calming to look at.,"[('admiration', 0.997502863407135)]"
300056,"wow, this is so beautiful! I like this paint. at the first look I thought this is real photo","[('admiration', 0.9983940720558167)]"
300056,"I feel like I know know the exact location where this photo was taken David Dubnitskiy works at bored panda  which is based in Lithuania, and the interior layout of Windows and the ceiling height looks like a place in Vilnius where in Gediminas avenue a Zara clothing store resides, I was there a few days ago. Will probably go there to take a photo for comparison and attach it as an edit. It is a great image but I thought someone may find this interesting too.","[('admiration', 0.9310805201530457), ('approval', 0.40846845507621765), ('realization', 0.30232304334640503)]"
300056,Oh my gosh this is so beautiful,"[('admiration', 0.9835712909698486)]"
300056,"I am not normally a big skirt person, but this one makes me wanna do it more!","[('approval', 0.5889820456504822), ('excitement', 0.7576017379760742)]"
300056,So beautiful how she effortlessly blends with the flowers. This is a masterpiece,"[('admiration', 0.9965745210647583)]"
300056,"absolutely gorgeous, belongs in a museum","[('admiration', 0.9938940405845642)]"
300056,"I need that skirt Does anyone know what kind of fabric that is? Silk or chiffon, or something else?","[('curiosity', 0.9405391812324524), ('desire', 0.5365193486213684)]"
300056,It is super calming and beautiful,"[('admiration', 0.9963272213935852)]"
300056,This makes me realize how boring I am. This is so creative,"[('realization', 0.9922156929969788)]"
300056,I love this guy's photos!  He's the only photographer I follow and he's fantastic!,"[('admiration', 0.9856374859809875), ('love', 0.930467963218689)]"
300056,This is very well done! What beautiful photography!,"[('admiration', 0.9959041476249695)]"
300056,Some of the woman he photographs are out of this world stunningly beautiful.,"[('admiration', 0.9956049919128418)]"
300056,"Looks like a painting. But the fact that it's a photograph is much more impressive. Just imagine, that scene was real such level of beauty does exist on our world.","[('admiration', 0.996977686882019)]"
300056,"This is a perfect example of photography as fine art. Well done, David!","[('admiration', 0.9975072741508484)]"
300056,This looks like a hall from Titanic,"[('neutral', 0.9985357522964478)]"
300056,this has to be edited. bravo. incredible work.,"[('admiration', 0.9935129284858704)]"
300056,Well that is terrifying and amazing !,"[('admiration', 0.9206490516662598), ('fear', 0.9328761696815491)]"
300056,Needd a video of dragon dancing,"[('neutral', 0.9984663724899292)]"
300056,"I believed it to be a painting as well until I read the title. Great photography, imo","[('admiration', 0.997729480266571)]"
300056,Well that is terrifying and amazing !,"[('admiration', 0.9206490516662598), ('fear', 0.9328761696815491)]"
300056,"Ok, Dubnitskiy you did good.","[('admiration', 0.9837071299552917), ('approval', 0.5762392282485962)]"
300056,Girl on the left is Jake Paul. Neat.,"[('neutral', 0.9963927865028381)]"
300056,Not a photo. please label this work correctly next time. It looks like its a digital art work.,"[('approval', 0.4055316150188446), ('neutral', 0.9052361249923706)]"
300056,"i spent a couple of minutes trying to find the brush strokes but realized it was photography LOL. but a very beautiful photograph nonetheless, it gives me early 190s europe vibes","[('admiration', 0.9953807592391968), ('realization', 0.5743662118911743)]"
300056,"I'm not typically a fan of photography as a medium for a finished art object. I tend to think that it should be used as a means to get to an end. But this, this is fantastic!","[('admiration', 0.9978502988815308)]"
300056,How can you tell they are girl flowers and not boy flowers?,"[('neutral', 0.9811873435974121)]"
300056,"ah nice, continuing a long tradition of subsuming women into decorative objects","[('admiration', 0.9025996923446655), ('approval', 0.9644399285316467)]"
300056,WHY SHE NEED TO BE WHITE THO /s,"[('neutral', 0.9971664547920227)]"
300056,Why did you make her dance barefoot on that filthy floor of an abandoned building? She's going to get a flesh eating bacterial infection for crying out loud. Beautiful pic otherwise tho.,"[('admiration', 0.9903855323791504), ('curiosity', 0.48495611548423767)]"
300057,This disturbing visual gave me another disturbing visual. Love it.,"[('admiration', 0.7159879207611084), ('love', 0.9842744469642639)]"
300057,This is your brain on drugs,"[('neutral', 0.9982773065567017)]"
300057,"Oh, this made me remember that kids game where you say “crack an egg on your head, let the yolk drip down” but I can’t remember anything else about it like the objective or rules.","[('neutral', 0.9851165413856506)]"
300057,This is what i fantasize about when i have a migraine. Imagine the relief.,"[('excitement', 0.7367447018623352), ('optimism', 0.39466673135757446), ('realization', 0.524332582950592)]"
300057,Source  Higher-Rez ,"[('neutral', 0.99893718957901)]"
300057,my brain while studying in online class during pandemic,"[('annoyance', 0.4241975247859955), ('neutral', 0.7243655920028687)]"
300057,That left ovary has teeth.,"[('neutral', 0.9991094470024109)]"
300057,"Omg, you have no idea how much I hate this. Thanks for posting.","[('anger', 0.6539629101753235), ('annoyance', 0.7154653072357178), ('gratitude', 0.8671051263809204)]"
300057,"""Brain Yolk""? Not ""Egg Head""? Incredible art","[('admiration', 0.7517979145050049), ('neutral', 0.3111761510372162)]"
300057,I would die if someone did this to me.,"[('fear', 0.391618013381958), ('sadness', 0.7187899351119995)]"
300057,The fact the egg-white around the brain is shaped somewhat like a realistic human heart just makes this even more disturbing. But man the texturing work and rendering here is top quality. Nice translucency on the skull too.,"[('annoyance', 0.9416776895523071)]"
300057,Damnn this is impecable.,"[('neutral', 0.9958764314651489)]"
300057,"This really hits in so many ways, it’s very much how I think of the separation between soul and body, like separating an egg yolk from the whites. Excellent work, thank you for sharing!","[('admiration', 0.983232319355011), ('gratitude', 0.9801291823387146)]"
300057,"More this, less naked girls, please. This is utterly fantastic.","[('admiration', 0.9821296334266663)]"
300057,This is your brain on drugs. Any questions?,"[('curiosity', 0.992427408695221)]"
300057,"Delicious, there goes my appetite","[('approval', 0.9871200323104858)]"
300057,"Oh, they finally got around to restoring the footage of JFK's assassination.","[('neutral', 0.9981800317764282)]"
300057,I want a looping animation of this,"[('desire', 0.9429084658622742)]"
300057,I’m glad I’m not going to your house for Thanksgiving.,"[('joy', 0.8814148306846619)]"
300057,Whelp. I guess I'm having cereal this morning.,"[('neutral', 0.9954311847686768)]"
300057,The scary thing is that this actually looks kinda appetizing.,"[('fear', 0.9811643958091736)]"
300057,Out-Freakin-Standing! That’s gotta be a Neurology Book cover!,"[('excitement', 0.39225974678993225), ('neutral', 0.6846131086349487)]"
300057,"No, people get tired of it since 2016","[('disappointment', 0.6412237286567688), ('disapproval', 0.4044587016105652)]"
300057,sheet.half an hour ago I lost conciousness after taking a bath .seeing this now is very very weird.this could have been my skull,"[('neutral', 0.20953889191150665)]"
300057,This is your drugs on brain.,"[('neutral', 0.9987850785255432)]"
300057,"Love this!  I would hang this on the wall, to have my gf take it down. Then I would take it up again and repeat until I win.","[('love', 0.9954813718795776)]"
300057,"I kept reading this as “Brian Yolk” and I was like, that’s a strange yet ironic name for one of the artists of this design.","[('realization', 0.974934995174408)]"
300057,This makes me incredibly uncomfortable but at the same time I feel like I should taste it. Wow! My first award  of course this is the comment. Thank you kind stranger,"[('gratitude', 0.9957297444343567)]"
300057,Fact there is more cholesterol in brains than egg yolks.,"[('neutral', 0.9983314871788025)]"
