0,1,2
300201,"This was definitely not a work from 2020, I definitely remember seeing it in 2017","[('realization', 0.3292853534221649), ('neutral', 0.9724013805389404)]"
300201,"where's ""nsfw"" tag or do you intend to burn this image into everyone's mind","[('neutral', 0.9906944036483765)]"
300201,"It's like looking directly into the sun, but I can't look away.","[('neutral', 0.9976293444633484)]"
300201,"""Hi I am Mike Rowe and today on dirty jobs we will be diving deep into the process of turning our presidents pale pasty skin into a lively shade of orange. This is a dirty job but someone has to do it.""","[('neutral', 0.9975634813308716)]"
300201,My feet just threw up into my shoes,"[('neutral', 0.9990934133529663)]"
300201,Thats more of Trump than i ever wanna see,"[('neutral', 0.9964285492897034)]"
300201,Art provokes a reaction and I'm going to willingly go stick my finger down my throat now,"[('neutral', 0.9982530474662781)]"
300201,Guess I'll be skipping breakfast. and lunch,"[('optimism', 0.3505794107913971), ('neutral', 0.991159975528717)]"
300201,add this to /,"[('neutral', 0.9973445534706116)]"
300201,I just ripped my eyes off.,"[('neutral', 0.9973620772361755)]"
300201,Hes much fatter than that,"[('neutral', 0.9978036284446716)]"
300201,My eyes.geesus I'm blind!,"[('embarrassment', 0.872994065284729)]"
300201,For the record ,"[('neutral', 0.997787594795227)]"
300201,"I find the most disturbing part of this is that someone was actually visualising this in their head and thought, ""Wow, I should draw this so more people can see this.""","[('annoyance', 0.9415013790130615), ('realization', 0.40122565627098083)]"
300201,Things i wish i never seen for 2 billion alex,"[('desire', 0.9802719950675964)]"
300201,"Thanks. It's not like I need to sleep, anyway.","[('gratitude', 0.9946057200431824)]"
300201,This is disgusting. How are people so infatuated by Trump they take time from their day to make this.  Ewy,"[('disgust', 0.9901317358016968)]"
300201,"""Tan almost everywhere, Jan almost everywhere""","[('neutral', 0.9988151788711548)]"
300201,My eyes! The goggles do nothing!,"[('neutral', 0.8136960864067078)]"
300201,He's much older and fatter than this depiction.,"[('neutral', 0.997779905796051)]"
300201,That's exactly what 215lbs looks like.,"[('approval', 0.6286543011665344), ('neutral', 0.5047256946563721)]"
300201,Fatshaming is only cool when the libs do it,"[('neutral', 0.9900840520858765)]"
300201,Wow that's one tiny. hand.,"[('surprise', 0.9899656772613525)]"
300201,This photo looks absolutely real,"[('admiration', 0.8411605358123779)]"
300201,"Eh, in all his glory I guess.","[('neutral', 0.9989513158798218)]"
300201,i just threw up in my mouth.,"[('neutral', 0.9988303780555725)]"
300201,Too realistic need some /,"[('neutral', 0.997481644153595)]"
300201,Why did she make his body look way better than it is tho. Gotta be flattering for him.,"[('approval', 0.5066272020339966), ('curiosity', 0.42075586318969727), ('neutral', 0.48487919569015503)]"
300201,this picture makes me want to mace myself,"[('fear', 0.6395395994186401)]"
300201,I just threw up in my mouth,"[('neutral', 0.9988937973976135)]"
300201,The people in this thread who don't understand the autistic merit of Dummy THIC Donald getting a Nacho Cheese dusting smdh,"[('neutral', 0.9965227842330933)]"
300201,It's never ocurred to me that someone does Trumps spray tan.,"[('neutral', 0.9875149726867676)]"
300201,That would be frightening if that were someone's real job.,"[('fear', 0.9868819117546082)]"
300201,Has Donny lost weight in this?,"[('curiosity', 0.9098175764083862), ('neutral', 0.3715794086456299)]"
300201,Holy wtf. I was not expecting that. Usually blurred things on my feed are rewarding distractions. My eyes.,"[('surprise', 0.8068392276763916)]"
300201,I think by posting this picture you committed a war crime.,"[('disgust', 0.5699874758720398)]"
300201,I feel like they're being very generous with how his body would actually look.,"[('neutral', 0.9902709722518921)]"
300201,so is this real or not? i’m confused,"[('confusion', 0.9899551868438721)]"
300201,This is a fake photograph. I know that because she isn't spraying him with Fanta D,"[('disapproval', 0.9759451746940613)]"
300201,IF THIS IS REAL I SWESR TO GOSF,"[('neutral', 0.3146273195743561)]"
300201,"MY EYES The Goggles, they do NOTHING.","[('neutral', 0.9955844283103943)]"
300201,He's too old to not have more sag in his gut.,"[('neutral', 0.940521776676178)]"
300201,My eye's,"[('neutral', 0.9992809891700745)]"
300201,"Yep, looks about right. Imagine having the job of spray tanning the bigly 'king'","[('approval', 0.993776798248291)]"
300201,in Latin America  went viral saying that it was anonymous who filtered his pack,"[('neutral', 0.9989319443702698)]"
300201,Does anyone know where I can find a pair of new eyeballs? I've burned these ones out.,"[('neutral', 0.9823836088180542)]"
300201,I like the clarification that “this is not Donald Trump” in the bottom right,"[('neutral', 0.9703254103660583)]"
300201,No way is his gut that small in real life.,"[('disapproval', 0.8944297432899475), ('neutral', 0.8250586986541748)]"
300201,i didn't need to see this,"[('neutral', 0.9755067825317383)]"
300201,"In the words of the wise phoebe buffay ""my eyes! My eyes!""","[('neutral', 0.9977149963378906)]"
300201,"Why, why would you post this. What is the point, its ingrained in my mind now","[('curiosity', 0.4728230834007263), ('neutral', 0.8662842512130737)]"
300201,Was just about to turn off the lights but that image would still be there E Its only been a few seconds and am alternating between laughter and regret,"[('amusement', 0.921388566493988), ('remorse', 0.502155601978302)]"
300201,Oh well I did need an appetite suppressant this morning I thank you for that at least,"[('gratitude', 0.9916037917137146)]"
300201,"The largest, most rotund, most forbidden Cheeto.  Sources says he tastes like bland mixture of smegma and spray tan.","[('neutral', 0.9970362186431885)]"
300201,You can tell it's fake because trump is way thicker than that.,"[('realization', 0.7065154314041138), ('neutral', 0.3519856035709381)]"
300201,Just threw up in my mouth. I can never un-see. Must be art then.,"[('neutral', 0.9993593096733093)]"
300201,Eat lots of fiber. Will help with gut positioning and posture.,"[('approval', 0.7500306963920593), ('caring', 0.4732051491737366), ('optimism', 0.5398353338241577)]"
300201,Me see this Also me Well I guess it’s home lobotomy time for me to forget I ever saw it,"[('realization', 0.9533824324607849), ('neutral', 0.6070985198020935)]"
300201,"How much for that fat slob? i WILL pay big money and put it on my car’s roof top ASAP Edit Im being serious, anyone knows please how to contact them or reach to them. i need to have it and drive all the country.","[('annoyance', 0.7176116704940796), ('curiosity', 0.5340197682380676), ('desire', 0.4854256808757782)]"
300201,"It's a trump look alike. Also featured in Alison Jackson's collection are pictures of the trump look alike making it rain $ while he parties in the oval office, and a photo of him getting intimate with miss Mexico. It is indeed from 2017. Sorry to be a bummer!","[('neutral', 0.9843916893005371)]"
300201,Well another sub I have to leave because of TDS.,"[('neutral', 0.965829610824585)]"
300201,Body shaming elderly people is fun now.,"[('amusement', 0.9925925135612488)]"
300201,"I don’t know art, but I know what I don’t like.","[('disapproval', 0.7082861065864563), ('neutral', 0.76826012134552)]"
300201,"Welp, I'm scarred forever.","[('fear', 0.607327938079834)]"
300201,No way he’s that svelte.,"[('disapproval', 0.6555728316307068), ('neutral', 0.8287628293037415)]"
300201,My day is truly ruined. No amount of eyebleach will fix this.,"[('disappointment', 0.7632986307144165), ('sadness', 0.7429233193397522)]"
300201,Cook looks like the 2020 unemployment graph V,"[('neutral', 0.9988753199577332)]"
300201,"Gonna tell me Melania touches that? Even if this is sorta what he looks like, I feel bad for Mrs. Trump","[('sadness', 0.9749075770378113)]"
300201,"Dear Lord, he makes Mr. Burns look good.","[('admiration', 0.9412705898284912), ('approval', 0.9487214088439941)]"
300201,Spray gun needs 25X scope on it to see his willy. ,"[('neutral', 0.9989668130874634)]"
300201,The image is staged yet we know this actually happens,"[('neutral', 0.9950962662696838)]"
300201,NSFA not safe for America,"[('disapproval', 0.9890238046646118)]"
300201,Welp that’s something you just can’t unsee. At least I got to see one other pic first on here so it wasn’t the very first thing I saw.,"[('neutral', 0.9981512427330017)]"
300201,"Very well made, looks legit","[('admiration', 0.9945336580276489)]"
300201,"Jesus, this should come with a large warning. I almost gouged my eyes out after seeing it. If Melania keeps the lights on, she needs professional help.","[('neutral', 0.931943416595459)]"
300201,"Even if that's not him I can bet money there will be a lot of ppl who will not read that bit of text in the corner. Edit and I forgot, ew, gross.","[('realization', 0.35101211071014404), ('neutral', 0.3427606523036957)]"
300201,"""He is a loathsome, offensive brute. Yet, I cannot look away""","[('annoyance', 0.9486367702484131)]"
300201,"Thanks, now I need ","[('gratitude', 0.9970253109931946)]"
300201,Aarhgg MY EYES MY EYES,"[('neutral', 0.994019627571106)]"
300201,This has been etched in my my brain,"[('neutral', 0.9980344176292419)]"
300201,"May I have some bleach please - for my eyes, you know.","[('neutral', 0.9983389377593994)]"
300201,Good God that's disgusting.,"[('disgust', 0.9797435998916626)]"
300201,"Dude, I'm eating breakfast here.","[('neutral', 0.9951815009117126)]"
300201,Why would I ever want to see this.,"[('neutral', 0.9594861268997192)]"
300201,Chunder thunder.thanks i hate it,"[('anger', 0.759900689125061), ('gratitude', 0.9452025294303894)]"
300201,That’s not NSFW that’s NSFA,"[('neutral', 0.9949656128883362)]"
300201,Yeah there was a job in sports photography,"[('approval', 0.9632159471511841), ('neutral', 0.8762387633323669)]"
300201,What the. what the fu. what? Why?,"[('anger', 0.8795767426490784)]"
300201,Read that as Allen Jackson. Thought I was going to see a hot country man. I was wrong.,"[('disappointment', 0.5446726679801941), ('realization', 0.4637697637081146), ('neutral', 0.5538866519927979)]"
300201,"I'll take, ""Pictures you'll never see on / for $10 Alex.","[('neutral', 0.9986433386802673)]"
300201,Squeezing my hog to this later,"[('neutral', 0.9985685348510742)]"
300201,Oh how I wish this was him and how I wish this was a real foto of him and how I wish it was shown all over the Internet,"[('desire', 0.9568819403648376)]"
300201,It's like the body of Tim Dillon on trump lol,"[('amusement', 0.9566957950592041)]"
300201,Bunker boy has a bunker boy.,"[('neutral', 0.9984411597251892)]"
300201,"Quick, somebody tell Devin Nunes that the Russian pranksters pretending to be Ukrainians finally got those photos we asked for! /s","[('neutral', 0.9991055130958557)]"
300201,This might be helpful snopes on this image,"[('neutral', 0.9870364665985107)]"
300201,"Not so proud to be white after all, huh Mr Trump?","[('confusion', 0.5551894307136536), ('curiosity', 0.6069476008415222), ('disappointment', 0.3046339750289917)]"
300201,"So it was true, he has a micropenis.","[('approval', 0.9896843433380127)]"
300201,Good lord. I've had enough of this year.,"[('admiration', 0.32714903354644775), ('approval', 0.8170278668403625)]"
300201,I think I just went blind.,"[('disappointment', 0.6281698346138), ('sadness', 0.3658718466758728), ('neutral', 0.3086434602737427)]"
300201,"Side question, why do people get, specifically, spray tans?","[('curiosity', 0.8844581842422485), ('neutral', 0.3989664614200592)]"
300201,I blindly clicked and now I need to burn my eyes out. NO.,"[('neutral', 0.007794898469001055)]"
300201,MY EYES! MY FRIGGING EYES! ARRGH!,"[('surprise', 0.4466567039489746)]"
300201,"Is this before or after the ""sexual massage""?","[('confusion', 0.8265897631645203), ('neutral', 0.6592311859130859)]"
300201,"What does everyone think, is he fatter, skinnier or acurately represented in this photo? I expected him to be fatter, but I think this might be acurate.","[('confusion', 0.8542324304580688)]"
300201,"Not my proudest fap, yet here we are.","[('anger', 0.3180244266986847), ('annoyance', 0.32709231972694397), ('disapproval', 0.7047292590141296)]"
300201,God this should be blurred out. My daily regret Reddit.,"[('remorse', 0.8807237148284912)]"
300201,"Oh god, this is probably exactly how he looks naked. how do I unsee this?","[('curiosity', 0.5912382006645203), ('surprise', 0.7402687668800354)]"
300201,Top-tier humor right here.,"[('neutral', 0.9860994219779968)]"
300201,You would be in a wildlife photography contest.,"[('neutral', 0.9974828362464905)]"
300201,ORANGE GRU. I REPEAT. ORANGE GRU,"[('anger', 0.6647212505340576)]"
300201,"I see the words ""This, is, Donald, Trump"" In that order. What am I to believe?","[('confusion', 0.7489818334579468), ('realization', 0.3491194248199463)]"
300201,"Reminds me of when Marge painted Mr. Burns. which makes me rethink Marge's ""positive"" message of humanizing Mr. Burns","[('approval', 0.9936541318893433)]"
300201,My eyes were burning but bleeding helped.,"[('sadness', 0.963155210018158)]"
300201,I am mising 10 min ago when i didnt know this existed,"[('realization', 0.8917838931083679)]"
300201,"Mmm. A savory, buttery, golden brown. I can almost smell the lard sizling.","[('approval', 0.40917080640792847), ('neutral', 0.7315798997879028)]"
300201,Well I'll never get that image out of my head.,"[('disappointment', 0.7212780117988586), ('realization', 0.3918222486972809)]"
300201,"Yesterday I saw a video of his wife won't smile for the camera while being spotted going out with him. Now after this, it's quite reasonable why she didn't","[('approval', 0.7337392568588257), ('neutral', 0.8648475408554077)]"
300201,Put that thing back where it came from or so help me.,"[('annoyance', 0.9912461638450623)]"
300201,How does this look so real. My brain is confused,"[('confusion', 0.9896877408027649)]"
300201,Just gonna bleach my eyes now thanks,"[('gratitude', 0.9945624470710754)]"
300201,Goddammit I should've looked at the comments first.I need to go bleach my brain rn,"[('annoyance', 0.9344599843025208), ('realization', 0.3939579427242279)]"
300201,It is pretty great making fun of fat people. This gets a pass.,"[('admiration', 0.971359133720398)]"
300201,And they say products aren’t used on animals.,"[('neutral', 0.9990206956863403)]"
300201,this is genuinely one of my favorite pictures on the internet,"[('admiration', 0.8593264222145081), ('love', 0.9437335729598999)]"
300201,Ladies and gentlemen I believe we have found the Presidential Portrait.,"[('neutral', 0.9991695880889893)]"
300201,"Remember, you can only body shame if it's a man","[('neutral', 0.9967023730278015)]"
300201,Melania has done terrible things.,"[('fear', 0.9460505843162537)]"
300201,Reminds me of an episode of the Simpsons when Marge had to paint a portrait of Mr. Burns.,"[('realization', 0.9490416646003723), ('neutral', 0.6507349014282227)]"
300201,I could have lived my whole life without seeing this an you ruined that,"[('disappointment', 0.9765164256095886)]"
300201,GAH MY EYES! THE GOGGLES DO NOTHING!,"[('neutral', 0.9648197293281555)]"
300201,Still YOUR President and will be for another 4 years! TRUMP 2020!,"[('approval', 0.8082520365715027), ('neutral', 0.7992480397224426)]"
300201,"Its one thing to disagree with the actions and policies of a president, but to openly shame him like this is completely disrespectful and reprehensible.","[('annoyance', 0.3585174083709717), ('disgust', 0.3565489947795868), ('embarrassment', 0.7956548929214478)]"
300201,Reddit is such an edgy and cool place.,"[('admiration', 0.9894774556159973)]"
300201,What has been seen cannot go unseen,"[('neutral', 0.9988503456115723)]"
300201,"Oh god, I just realised there's actually someone that has to give hime the spray tan.","[('realization', 0.9858535528182983)]"
300201,She should be in a wildlife photography contest.,"[('neutral', 0.9971127510070801)]"
300201,You captyred the mushroom perfectly,"[('admiration', 0.9952568411827087)]"
300201,"Someone pass the gasoline, I need to rinse my eyes.","[('neutral', 0.9968383312225342)]"
300201,"""send in the tremendous Royal Tanner"" ""SEND IN THE ROYAL TANNER""","[('neutral', 0.998637855052948)]"
300201,I don’t know why but I find this to be incredibly fascinating. I just have so many questions,"[('admiration', 0.8290947079658508), ('confusion', 0.9756077527999878)]"
300201,Why did this make me think of Cartman all grown up,"[('confusion', 0.39951765537261963), ('curiosity', 0.7773233652114868)]"
300201,I think the hands are photoshopped to be bigger then they are,"[('neutral', 0.9975869655609131)]"
300201,I just screamed out loud. Christ alive.,"[('anger', 0.6909120678901672), ('grief', 0.3371303677558899), ('sadness', 0.8345738649368286)]"
300201,Lol he got a small peepee,"[('amusement', 0.9935204386711121)]"
300201,"You actually have to be demented to make something like that, can you imagine if someone made something similar of Obama","[('neutral', 0.9975355863571167)]"
300201,"All jokes aside, this is a really good work. I'm more amazed than disgusted","[('admiration', 0.9970533847808838), ('disgust', 0.6500986814498901)]"
300201,"I see nothing wrong here. Just a very handsome, very attractive man  getting ready for the day. Look at the admiration on her face, folks. It's a an amazing thing to stand in the presence of such beauty.","[('admiration', 0.9977672100067139)]"
300201,"Haha Trunpht not only orange and bad, FAT too hahahaha. He got destroyed ahahahahahah, and this is not body shaming because orange man bad.","[('amusement', 0.9717864394187927)]"
300201,"Wait, what do you mean with photo? Isn't this""thing"" a photoshop?","[('confusion', 0.8748275637626648), ('curiosity', 0.3819398581981659)]"
300201,Why? Why would anyone go through the effort of drawing naked Trump? Now I gotta go to  to clean my memory,"[('curiosity', 0.41874751448631287), ('neutral', 0.6713545918464661)]"
300201,I did not need to see that. Probably should've put a NSFW tag on this.,"[('neutral', 0.9976108074188232)]"
300201,He is definitely much fatter than that.,"[('neutral', 0.998091995716095)]"
300201,Surely this unflattering photo spells the end for Donald Trump.,"[('annoyance', 0.6535202860832214), ('approval', 0.4733324646949768)]"
300201,The big don living rent free,"[('neutral', 0.9982056617736816)]"
300201,Trumps living rent free in your heads,"[('neutral', 0.9989915490150452)]"
300201,This sub really went downhill lately.,"[('disappointment', 0.3649541437625885), ('neutral', 0.9504246115684509)]"
300201,Nah it's cool I was already planning on pouring bleach into my eyes today anyways.,"[('approval', 0.8263905048370361), ('realization', 0.7181147933006287)]"
300201,He should be glad he has small hands,"[('joy', 0.8674893975257874)]"
300201,"Welp, that's enough internet for me today. or maybe this week.","[('realization', 0.6346920728683472), ('neutral', 0.515201210975647)]"
300201,Disgusting for multiple reasons,"[('disgust', 0.9821900129318237)]"
300201,"I know art is subjective, to me it's very ugly, but it's very true. There is ugliness in truth a lot of times.","[('approval', 0.9002944827079773), ('disapproval', 0.6368250846862793)]"
300201,I was eating when this showed up. You owe me lunch op ;_;,"[('neutral', 0.9485796093940735)]"
300201,He is getting revenge on all Americans for making fun of him. He hates us all,"[('anger', 0.9453496932983398), ('neutral', 0.8125040531158447)]"
300201,"I don't think I've ever seen him stand with his hands on his hips like that. He always stands with his arms at his sides, slightly away from his body.","[('surprise', 0.3374882638454437), ('neutral', 0.8643643856048584)]"
300201,The amorphous blob that is his genitalia is . deeply disturbing,"[('annoyance', 0.435208797454834), ('disappointment', 0.9673831462860107)]"
300201,"That is definitely too flattering for him, but it would diminish the impact if you couldnt see his genitalia.","[('approval', 0.5105269551277161), ('disapproval', 0.8989669680595398)]"
300201,This is both disgusting and hilarious at the same time. Not many things have that combo,"[('disgust', 0.9858286380767822)]"
300201,"Bold, Courageous, Powerful","[('admiration', 0.9959385395050049)]"
300201,"Oooh, he's gonna hate this.","[('anger', 0.6791282296180725), ('disgust', 0.7328675985336304)]"
300201,This is just hateful vulgarity. A pretty lazy medium if you ask me.,"[('annoyance', 0.9842761754989624)]"
300201,"No one else notice where it says ""THIS IS NOT DONALD TRUMP""?","[('neutral', 0.9905487895011902)]"
300202,Beautiful use of colors! Well done,"[('admiration', 0.9945436716079712)]"
300202,That's so nice. Love the colours,"[('admiration', 0.9954386353492737), ('love', 0.5548627376556396)]"
300202,¡Que bonito! Me gusta mucho. I love the vibrant colors and design,"[('admiration', 0.5208835005760193), ('love', 0.9276859760284424)]"
300202,This looks absolutely beautiful. But I’m having neck pain just thinking about wearing that headdress lol.,"[('admiration', 0.9887993931770325), ('amusement', 0.9156948328018188)]"
300202,That thigh gap is off the charts,"[('neutral', 0.9985226988792419)]"
300202,You are immensely talented. Keep it up!,"[('admiration', 0.9960116147994995)]"
300202,What cultures/civilizations were your inspiration? Also I think this would be great on ,"[('admiration', 0.747641384601593), ('curiosity', 0.976520836353302)]"
300202,"The colors are fantastic, but I think there's a bit of  going on here with the proportions of the lower and upper halves. That may be a style decision, but I just can't help imagining that without the skirt, she wouldn't look right at all.","[('admiration', 0.997159481048584)]"
300202,This is absolutely magnificent,"[('admiration', 0.9880778193473816)]"
300202,This is amazing ! You should post it in ,"[('admiration', 0.9820045828819275)]"
300202,"Build more characters in this world. Something about this feels so right, I’d watch movies, read books etc. keep going this amazing","[('admiration', 0.9743684530258179), ('optimism', 0.9268573522567749)]"
300202,I love the colors. But for me it would feel stronger with a more realistic body type. It looks a bit Disney-comic like.,"[('love', 0.991731584072113)]"
300202,So beautiful reminds me of a personified Quetzalcoatl,"[('admiration', 0.9982579350471497)]"
300202,The color! The lighting! The length of the feathers on the headdress! I love everything about this.,"[('love', 0.987877607345581)]"
300202,Such bold colors! Love it!,"[('admiration', 0.7713489532470703), ('love', 0.9780887961387634)]"
300202,"Incredible colors, I love it!","[('admiration', 0.8943830132484436), ('love', 0.9578566551208496)]"
300202,"This is absolutely beautiful. Wonderful representation of colors. You gave the foreground the same overall theme as the character, and gave the background the same theme as the character. It's exceptionally well executed. I also love the composition and the lighting is wonderful! Thank you for posting. I had to save this piece into my folder of art that inspires me.","[('admiration', 0.9985742568969727), ('gratitude', 0.6480332612991333)]"
300202,I love this! The details are astounding; the obsidian spear is perfect!,"[('admiration', 0.9924231767654419), ('love', 0.9404746890068054)]"
300202,"If digital art isn’t real art, then who wants real art anyways. This is amazing","[('admiration', 0.9860639572143555)]"
300202,I absolutely love the color and details of the outfit. Wow. Thank you for gracing my eyes with this beautiful piece of art.,"[('admiration', 0.9927493333816528), ('gratitude', 0.9909573793411255), ('love', 0.3971167206764221)]"
300202,"Great piece. Love the saturation Edit Checked it in BW. Sick values, absolutely stunning","[('admiration', 0.9984039664268494)]"
300202,Do you take art comissions?,"[('curiosity', 0.9768564105033875)]"
300202,oo you're the dragon lady. Your work is very impressive imo and you have come a really long way since starting.,"[('admiration', 0.9956335425376892)]"
300202,Awesome. My favorite part is the translucency of the cloak! Super nice.,"[('admiration', 0.9973018169403076)]"
300202,This looks exactly like “Princess 'Kida' Kidagakash” from Atlantis the lost empire by Disney…,"[('realization', 0.7441595196723938), ('neutral', 0.7930940985679626)]"
300202,Give this guy a job at Overwatch's character design department.,"[('neutral', 0.9935909509658813)]"
300202,"I think there is a problem with the proportions of the height of the pelvis, you should sketch the naked body before adding the clothes.","[('neutral', 0.9990643858909607)]"
300202,"I love everything about it, however, I feel like her waist is a bit too small haha","[('love', 0.9935572743415833)]"
300202,This is magnificent. Have you considered creating VR art? I would pay fantastic money to walk through a world of your own creation.  ,"[('admiration', 0.9764214754104614), ('curiosity', 0.7860069274902344)]"
300202,Looks like people from Atlantis,"[('approval', 0.37498509883880615), ('neutral', 0.9117879867553711)]"
300202,It's 2 am and I am witnessing pure Perfection! O,"[('pride', 0.3356989026069641), ('neutral', 0.812467634677887)]"
300202,This is freaking stunning and belongs in a magazine and on my wall. And I have seen plenty of CG art.,"[('admiration', 0.9963609576225281)]"
300202,I don't have enough words to compliment this,"[('disapproval', 0.9697747826576233)]"
300202,Architectural art? I'm this piece speaks to me.,"[('curiosity', 0.7567002773284912)]"
300202,como que perdida yo soy Azteca no de sangre pura pero soy Azteca,"[('neutral', 0.9965147972106934)]"
