0,1,2
300132,God I miss when I was young and assassins creed had art like this,"[('disappointment', 0.9146893620491028), ('realization', 0.4093555510044098)]"
300132,One of the few watercolors with cars in it that I like. Has an old fashioned feel in a modern world,"[('admiration', 0.8815470933914185), ('love', 0.7502729892730713)]"
300132,I think this just became my favorite painting. It's so beautiful.,"[('admiration', 0.9959891438484192)]"
300132,"Wow thought that was a photo at first, beautiful","[('admiration', 0.992852509021759), ('surprise', 0.47510823607444763)]"
300132,So comforting and bittersweet,"[('admiration', 0.8449307084083557), ('joy', 0.7619984745979309)]"
300132,This is spectacularly beautiful. Well done!,"[('admiration', 0.9947072267532349)]"
300132,Oh my god this is amazing,"[('admiration', 0.9161138534545898), ('surprise', 0.5705199241638184)]"
300132,Caillebotte vibes ,"[('neutral', 0.9987586736679077)]"
300132,Feels rude to even blink in front of this.,"[('annoyance', 0.9774929285049438)]"
300132,That is so lovely. Thank you.,"[('admiration', 0.84474778175354), ('gratitude', 0.9943037629127502), ('love', 0.9272626042366028)]"
300132,"Just incredible artistry, incredible work!","[('admiration', 0.9964209794998169)]"
300132,I always wanted to go to Paris Texas!,"[('desire', 0.9891197681427002)]"
300132,I can see an assassin on roof.,"[('neutral', 0.9990272521972656)]"
300132,Reminds me of Jeremy Mann's paintings,"[('neutral', 0.9936601519584656)]"
300132,"absolutely beautiful .  and may be an hommage to the paint ""Paris sous la pluie"" by Caillebotte, this one is obviously more contemporary.","[('admiration', 0.997832715511322)]"
300132,Modern take on Paris Street; Rainy Day?,"[('neutral', 0.8455542922019958)]"
300132,goddamn this is beautiful,"[('admiration', 0.9902216196060181)]"
300132,This looks weirdly realistic,"[('disapproval', 0.5202082395553589), ('optimism', 0.4228894114494324)]"
300132,"Beautiful but the first thought that came to my mind was, “woah this is how I see the world without my glasses”","[('admiration', 0.9426335096359253), ('surprise', 0.9259549975395203)]"
300132,"Referencing one of my favorite paintings - “Paris, Rainy Day” by Caillebotte","[('admiration', 0.7356229424476624), ('love', 0.7910346388816833)]"
300132,Love this. It’s more compelling than any sci-fi concept art,"[('admiration', 0.994491457939148), ('love', 0.6815102100372314)]"
300132,This is really good. Fantastic skill. Im jealous!,"[('admiration', 0.9977411031723022)]"
300132,It's a wonderful painting!,"[('admiration', 0.9912834167480469)]"
300132,Looks like the old Biltmore building if you're standing in Kennedy Plaza.,"[('neutral', 0.9982890486717224)]"
300132,this guy needs to learn how to take a decent photograph,"[('caring', 0.49580511450767517), ('neutral', 0.8263357281684875)]"
300132,Looks like the hotel from the John Wick movie.,"[('approval', 0.35528045892715454), ('realization', 0.5608885884284973), ('neutral', 0.5578210353851318)]"
300132,Great job on the reflections. Feels like I'm there.,"[('admiration', 0.9959794282913208)]"
300132,Gotta thank Hitchcock for making flocks of birds automatically ominous in my eyes,"[('gratitude', 0.9903513789176941)]"
300132,Reminds me of A Moveable Feast,"[('realization', 0.3477356433868408), ('neutral', 0.9873908162117004)]"
300132,"Impressive work, I’d hang it","[('admiration', 0.995322048664093)]"
300132,"OK, umm, this is way too amazing.","[('admiration', 0.9801788926124573)]"
300132,"Looks like oil paint, wow","[('admiration', 0.6922767758369446), ('surprise', 0.9659382700920105)]"
300132,Like…how…what…huh? This is excellent!,"[('admiration', 0.9812842011451721)]"
300132,This is absolutely mind blowing. Can't wrap my head around how you've achieved this effect.,"[('admiration', 0.9842761754989624)]"
300132,I love this art style. Does anyone know if it has a name?,"[('curiosity', 0.3829869329929352), ('love', 0.9601852893829346)]"
300132,Stunning. Should be in a museum.,"[('surprise', 0.988462507724762)]"
300132,"Brain ""I'm pretty sure this ain't water color""","[('approval', 0.9831367135047913)]"
300132,I would like to know what the weather is like for this?,"[('curiosity', 0.9936104416847229)]"
300132,I didn't know you could do this with watercolor,"[('surprise', 0.9803982377052307)]"
300132,Epic. Looks kinda real ngl.,"[('neutral', 0.9978704452514648)]"
300132,My brain refuses to believe that this is watercolor.,"[('neutral', 0.5047957301139832)]"
300132,Looks like it’s at Jardin du luxembourg,"[('neutral', 0.9963855743408203)]"
300132,The artist with the glass eyes painted this?,"[('curiosity', 0.3536630868911743), ('neutral', 0.9319427609443665)]"
300132,Thank you for the awesome wallpaper!,"[('admiration', 0.8806461095809937), ('gratitude', 0.9935060739517212)]"
300132,Isn't Paris always rainy? Or at least gloomy?,"[('confusion', 0.9228543043136597), ('curiosity', 0.9041576981544495)]"
300132,Does anyone know if this is a real intersection? It reminds me of a street I was on when I visited Paris.,"[('curiosity', 0.8761093616485596), ('realization', 0.8655425310134888)]"
300132,I love this artist's work. First saw some his paintings online many years ago. What a pleasant surprise to see one of them here!,"[('admiration', 0.3770785331726074), ('love', 0.9349113702774048), ('surprise', 0.8734555840492249)]"
300132,Bruh I thought it was real,"[('neutral', 0.9972123503684998)]"
300132,"This is incredible. I stayed in Paris in late September of 2019 for a few days and it rained in a way that looked just like this. I always think of that trip as my last hurrah before the world ended. This immediately took me back and I could hear the opening chords of Lauv's ""Paris in the Rain"" chime in my head. I think there's hope I'll get another chance here soon.","[('admiration', 0.9906547665596008), ('optimism', 0.36989861726760864)]"
300132,Holy shieet. This is mind blowing. I can feel this picture,"[('admiration', 0.3593709468841553), ('excitement', 0.9598787426948547)]"
300132,You can feel the cold breeze through the image.,"[('neutral', 0.998623251914978)]"
300132,Paris in the rain am I right?,"[('confusion', 0.8567665219306946), ('curiosity', 0.8983845114707947)]"
300132,"missing about 10,0 scooters tho","[('neutral', 0.9989811778068542)]"
300132,Maravillosa vista de París y su cielo de nubes!,"[('neutral', 0.9986883997917175)]"
300132,Nothing turns me on more than a rainy day watercolor,"[('neutral', 0.9976823329925537)]"
300132,I could hang this in my home,"[('neutral', 0.9975388050079346)]"
300132,Thought this was a photo from a car window. Beautiful,"[('admiration', 0.9903857707977295)]"
300132,I taught it was real until I read the title,"[('approval', 0.855804443359375), ('neutral', 0.8505589365959167)]"
300132,Absolutely amazing I could look at this all day,"[('admiration', 0.9815249443054199)]"
300132,"This gives me an emotional reaction. I can feel myself there. But it reminds of Dublin, walking to work 20 years ago. Makes me think about time lost, makes me feel sorry for myself back then. There's more but I can't put my finger on it","[('remorse', 0.3128319978713989), ('sadness', 0.8743587136268616)]"
300132,I love this piece. Amazing work! it reminds me of the Flatiron District in NYC.,"[('admiration', 0.9986147880554199), ('love', 0.5214325785636902)]"
300132,"This view, 150 years agoParis Street, Rainy Day - Gustave Caillebotte","[('neutral', 0.9976738095283508)]"
300132,"I'm not in Paris, but in Wroclaw, can still confirm this is how European cities look when it's raining in the Fall","[('realization', 0.3144204020500183), ('neutral', 0.9907799363136292)]"
300132,Wow. This might be the finest watercolor I've ever seen.,"[('admiration', 0.9956617951393127)]"
300132,I thought it was a picture,"[('realization', 0.6377058029174805), ('neutral', 0.7629340887069702)]"
300132,Thanks for the new Lock Screen wallpaper!,"[('gratitude', 0.9950593709945679)]"
300132,No way! Thats actual freaking fantastic work!,"[('admiration', 0.9779006838798523)]"
300132,"I've been to Paris and the painter has captured the dirty, hopeless, greyness of the city, that no one told me about before I went.","[('disgust', 0.723700761795044), ('realization', 0.7315713763237)]"
300132,Amazing this looks so good and the reflections are wow,"[('admiration', 0.9968691468238831)]"
300132,meanwhile I can't make 2 strokes without the colors mingling. This is impressive,"[('admiration', 0.9919028878211975)]"
300132,This is considered impressionism right?,"[('curiosity', 0.98770672082901)]"
300132,How on earth you did this with watercolours to boot is beyond me - but it looks absolutely amazing!,"[('admiration', 0.9643120169639587), ('surprise', 0.317592591047287)]"
300132,I thought this was a photograph!,"[('realization', 0.8627585172653198), ('neutral', 0.6504873037338257)]"
300132,Beautiful place for horrible people,"[('admiration', 0.9959685802459717)]"
300132,Amazing! The building in the back thou look a little bit too tall,"[('admiration', 0.995722770690918)]"
300132,"WOW! The detail, the lighting, the atmosphere, the mood.what a beautiful painting","[('admiration', 0.9927657842636108)]"
300132,I could look at this for three days without blinking once.,"[('neutral', 0.9979730248451233)]"
300132,It’s like I was looking through a rain soaked windshield. So beautiful.,"[('admiration', 0.9966913461685181)]"
300132,I don't like the two cars from the left. Everything else is amazing.,"[('admiration', 0.6185438632965088), ('disapproval', 0.9800825715065002)]"
300132,"Lool this is A PHOTO, taken through a rainy window","[('amusement', 0.9244206547737122)]"
300133,He must be reading about his 401K stocks.,"[('neutral', 0.9989197254180908)]"
300133,This is too good. The reflection off his glasses and the depth of field are amazing. Excellent colors too.,"[('admiration', 0.9972732663154602)]"
300133,Idk who this is but they fine,"[('approval', 0.6816573143005371), ('confusion', 0.5380990505218506), ('neutral', 0.40944942831993103)]"
300133,ID on the trenchcoat and turtleneck? They're sick,"[('neutral', 0.9865791201591492)]"
300133,"Great work, did you also shoot a video of the process? I imagine the newspaper would burn out very quickly","[('admiration', 0.9943050742149353), ('curiosity', 0.5617746710777283)]"
300133,"Im not normally into photography but im really drawn to this, fantastic work","[('admiration', 0.9925509691238403)]"
300133,That fit is way too nice to get ash on,"[('admiration', 0.9945892095565796)]"
300133,Coolest thing i see today,"[('joy', 0.8369867205619812)]"
300133,"Nice art. The guy must be thinking ""shoulda keep calm and hope wind won't change and blow these burning scraps of paper in my face. you finished?"" or maybe ""This is fine""","[('admiration', 0.9914727210998535), ('optimism', 0.7818261384963989)]"
300133,Very cool picture and well taken. Quality is amazing and the colours are nice.,"[('admiration', 0.9975897073745728)]"
300133,"Awesome, got some sci fi vibes in a way","[('admiration', 0.9944550395011902)]"
300133,"Great idea.  ""Some men just want to watch the world burn""","[('admiration', 0.9940468072891235)]"
300133,Newspapers are so hot right now!,"[('neutral', 0.9862848520278931)]"
300133,"This guy looks like he probably smells nice, like all the time.","[('admiration', 0.996330201625824)]"
300133,Didn’t someone else do a shoot just like this and blow up on Twitter last year?,"[('neutral', 0.9970906972885132)]"
300133,The newspaper is not the only thing looking hot in this photo.,"[('neutral', 0.9828357100486755)]"
300133,Looks like a 90’s r & b album cover lol. Great pic.,"[('admiration', 0.9948075413703918), ('amusement', 0.33445295691490173)]"
300133,"YOO I wasn’t expecting all this love and support. I really appreciate it x10. This is one of my favorite pieces I ever shot and was literally an off the cuff decision I had with a friend literally the night before we shot. I had a follow up, up if you wanted more information again thank you.","[('admiration', 0.9846556186676025), ('gratitude', 0.9800198078155518), ('love', 0.3282923102378845)]"
300133,Did it have a copy of your mixtape inside?,"[('curiosity', 0.7764587998390198), ('neutral', 0.7873417735099792)]"
300133,Extra! Extra! Man reads burning newspaper! Read all about it!,"[('neutral', 0.9921022057533264)]"
300133,The color palette of this photo is lovely.,"[('admiration', 0.9944204688072205)]"
300133,Really represents how reading the news feels in 2020,"[('neutral', 0.9951028823852539)]"
300133,The meme potential here is legendary,"[('admiration', 0.971810519695282)]"
300133,“That cool black guy anime character”,"[('approval', 0.6536523103713989), ('neutral', 0.8983145952224731)]"
300133,"This photo is so on point that I had to save it. I have no use for this photo. Thanks, I guess.","[('gratitude', 0.9967337846755981)]"
300133,"Yo this is dope af , loving the rose gold , matchs perfectly with it","[('admiration', 0.6485756039619446), ('approval', 0.6094284057617188), ('love', 0.8876907229423523)]"
300133,"Sir?.? Ah, um, Excuse me Sir!. I don't want you to be alarmed at all, but. ah. well.","[('surprise', 0.6764211058616638)]"
300133,"Okay so. whilst I think this is awesome, I have several questions","[('admiration', 0.9936347007751465)]"
300133, come out with your hands up,"[('neutral', 0.9975009560585022)]"
300133,Seems a little ego-centric to me.,"[('neutral', 0.9922435879707336)]"
300133,Great photo! I love the colours and the reflection in glasses,"[('admiration', 0.9981890320777893)]"
300133,"Great idea, excellent execution","[('admiration', 0.9955586194992065)]"
300133,Love the glasses reflection. Excellent work dude.,"[('admiration', 0.9981639981269836)]"
300133,"""We didn't start the fire. but it's always burnin since the worlds been turnin. ""","[('realization', 0.38573697209358215), ('neutral', 0.9888414740562439)]"
300133,I would like to see the second picture in this photo shoot please. The one where you frantically stomp out the fire.,"[('desire', 0.9754437804222107)]"
300133,Add this guy to the list of Bizarre yet powerful super heroes,"[('neutral', 0.9957420229911804)]"
300133,This has got some matrix vibes to it.,"[('neutral', 0.9986975193023682)]"
300133,OH you're talking about the newspaper. I thought you were referring to the guy.,"[('realization', 0.45845991373062134), ('surprise', 0.6890954375267029), ('neutral', 0.3316674828529358)]"
300133,That guy is the definition of swagger.,"[('admiration', 0.34055206179618835), ('neutral', 0.9046517610549927)]"
300133,i am a rebel just for kicks now,"[('neutral', 0.960640549659729)]"
300133,This. News. Is on firree,"[('neutral', 0.9982172846794128)]"
300133,This is absolutely fantastic. You've an amazing talent.,"[('admiration', 0.9970383644104004)]"
300133,yoo this photo explains me in just one blink. but i’m white. like paste.,"[('neutral', 0.9907033443450928)]"
300133,Wow! I love this! Speaks volumes.,"[('love', 0.9750277996063232), ('surprise', 0.7284824252128601)]"
300133,"When is the fire Mixtape dropping, bro?!","[('neutral', 0.9821865558624268)]"
300133,A little heavy handed imo,"[('neutral', 0.9982178807258606)]"
300133,I think your newspaper is on fire,"[('anger', 0.48982879519462585), ('annoyance', 0.6782564520835876)]"
300133,"You look like DMX at the end of Belly, when he met up Nas.","[('approval', 0.6998949646949768), ('neutral', 0.8643036484718323)]"
300133,I'm getting major Stringer Bell vibes here. This is awesome.,"[('admiration', 0.9875076413154602)]"
300133,You can't be both very cool and very warm at the same time. Guy in pic hold me beer.,"[('neutral', 0.8510397672653198)]"
300133,"It took me a while to realize the newspaper was on fire, and not just a trick of the light.","[('realization', 0.9914320707321167)]"
300133,Point of order What is a press?,"[('neutral', 0.9970300197601318)]"
300133,"""World News Corona Virus Update Edition""","[('neutral', 0.9980095028877258)]"
300133,"Great job, really like this","[('admiration', 0.9950050711631775)]"
300133,I love the context. I'm in no place and this is strictly my opinion. But I would've chosen a less flashy look for the guy. Have him look like your average Joe on a park bench.,"[('approval', 0.36927300691604614), ('love', 0.9157878160476685)]"
300133,He got the ‘playtime is over’ anime reflection on his glasses,"[('neutral', 0.9991012811660767)]"
300133,"Excuse me, sir! yeah, you can stop reading now. We got the-yeah, we got the photo. unh hunh,.so that's a live fire","[('approval', 0.3332624137401581), ('neutral', 0.8643890619277954)]"
300133,Why do i know this photographer?,"[('curiosity', 0.9894928932189941)]"
300133,This must be one of those flaming liberal rags I heard so much about in college. I wouldn't read anyone's paper unless it had a comics page though.,"[('annoyance', 0.9935625791549683)]"
300133,Now I want to see more phrases interpreted literally,"[('desire', 0.6954180598258972)]"
300133,"Hey, could I use this as a base for an animated art piece?","[('curiosity', 0.9845300912857056)]"
300133,“The comics today are on fire!”,"[('anger', 0.9190917015075684)]"
300133,I hope you do music too this would be an amazing album cover!,"[('admiration', 0.8284177780151367), ('optimism', 0.9862875938415527)]"
300133,Then after burn that cloths your wearing. God awful.,"[('disgust', 0.9579974412918091)]"
300133,"I really like it, very cool concept and elegant execution. You may want to know that it took me a bit to realize that the paper was on fire though because of the desaturation, first glance I though the film had been purposely damaged to create the orange fleck effect. Without the title, might have missed it entirely.","[('admiration', 0.9459736943244934)]"
300133,I saw in one of the portugal the man videos.,"[('neutral', 0.9973204731941223)]"
300133,Love how the light  makes the newspaper look aflame. Also love this dude's fashion style. Nice shot!,"[('admiration', 0.99661785364151), ('love', 0.8758917450904846)]"
300133,Can white Ppl even look cool like that?,"[('curiosity', 0.8943055868148804)]"
300133,Man out here looking like an anime villain finding out the protagonist is foiling their plans,"[('neutral', 0.9987438321113586)]"
300133,This looks like a good meme template in the making.,"[('admiration', 0.9950580596923828)]"
300133,Literally me reading about how the world’s on fire and we’re all gonna die,"[('fear', 0.30071505904197693), ('sadness', 0.7387719750404358)]"
300133,"If this picture was taken in 2020, how has this picture been posted about 4 months ago by you?","[('curiosity', 0.9849084615707397)]"
300133,OP this is an awesome picture but I'm pretty sure it's from 2019. I've seen it before a few times. You sure that's yours?,"[('admiration', 0.9758989810943604), ('curiosity', 0.6484341025352478)]"
300133,The rose gold colors go really well with his skin tone. Really beautiful contrast!,"[('admiration', 0.9976686835289001)]"
300133,When I'm reading Eminem's Godzilla lyrics on rap genius.,"[('admiration', 0.9892414212226868)]"
300133,"I love the color coordination, beautifully composed!","[('admiration', 0.9984220266342163), ('love', 0.47293707728385925)]"
300133,I really like how there is a flame in the picture but it's not the primary focus. I was looking at the face before I noticed the flame.,"[('realization', 0.9446014761924744)]"
300133,Y'all got this in a less lossy format?,"[('curiosity', 0.959378719329834)]"
300133,Reading fbi crime statistics,"[('neutral', 0.9986634254455566)]"
300133, right now,"[('neutral', 0.9910399317741394)]"
300133,"I love this. The colors, the composition, the reflection of flame in his glasses. It’s a beautiful picture.","[('admiration', 0.9931150078773499), ('love', 0.875185489654541)]"
300133,Great shot! Interesting composition and that bokeh is buttery smooth man.,"[('admiration', 0.9964602589607239)]"
300133,This can have so many narratives to it. Great job on making a piece that can have multiple valid motives behind it. I really like this photo!,"[('admiration', 0.9961835741996765)]"
300133,This subject must have a lot of trust in the photographer to be quick,"[('approval', 0.9488056302070618)]"
300133,Where can i donate 10 coins?,"[('confusion', 0.7255986332893372), ('curiosity', 0.7899476289749146)]"
300133,Everytime I read my dissertation.,"[('neutral', 0.9984425902366638)]"
300133,Some of Europe did. It took me out,"[('neutral', 0.9984530210494995)]"
300133,"If I had coins, I would give you an award","[('desire', 0.43626683950424194), ('neutral', 0.3155367970466614)]"
300133,"This is an amazing picture. My question is though, how long did you have to take this lol","[('admiration', 0.9730484485626221), ('amusement', 0.5673927664756775)]"
300133,"Absolutely incredible lighting, set design, oh, and an incredible model and photographer!","[('admiration', 0.9965601563453674)]"
300133,"I've been writing down ideas for drawings I'd like to create based on abstract concepts of novels I've recently read. A clown reading a flaming newspaper was one of them . That being said, I like this a lot.","[('love', 0.3568091094493866)]"
300133,AMAZING! Profound!,"[('admiration', 0.9717128872871399)]"
300133,Are you on IG? I’d like to make this a meme and tag you as the original creator!,"[('approval', 0.511058509349823), ('curiosity', 0.8683651685714722)]"
300133,"Oh boy, someone is going steal this Photo for their bootleg clothing store.","[('neutral', 0.8405469655990601)]"
300133,"Take the picture quick, dammit!","[('annoyance', 0.9935656189918518)]"
300133,"Eh. Meh. So, what, are we gonna pretend he can read?","[('curiosity', 0.9015856385231018)]"
300133,A fine addition to the “I’m fine” memes?,"[('confusion', 0.9430485367774963), ('curiosity', 0.9492171406745911)]"
300133,Wow it really makes you thinnk.,"[('surprise', 0.9747685790061951)]"
300133,"Take the picture quick dude, its getting close to my hands.","[('caring', 0.9888555407524109)]"
300133,"This is one of the coolest pictures I have ever seen on this site. MAJOR props for posting to  instead of  . This is awesome, keep up the good work.","[('admiration', 0.9953612685203552)]"
300133,Should have used a real paper and not a flyer.,"[('neutral', 0.9990471005439758)]"
300133,WHO - “This is the Way ,"[('neutral', 0.9987887740135193)]"
300133,If CDPR pulls off Cyberpunk it’s black.,"[('neutral', 0.998472273349762)]"
300133,That looks like a real person,"[('admiration', 0.4250723123550415), ('approval', 0.9664840698242188)]"
300133,I love the color and style of this! Fantastic work!,"[('admiration', 0.9972919821739197)]"
300133,This guy seems omnipotent ngl,"[('surprise', 0.7152295708656311), ('neutral', 0.7159052491188049)]"
300133,Puff Daddy can read?!? That’s news to me!,"[('curiosity', 0.9307831525802612)]"
300133,Me reading my dad's old slam poetry,"[('neutral', 0.997179388999939)]"
300133,Royce 5'9 wore the same outfit  Is this a new style or something?,"[('curiosity', 0.707732081413269)]"
300133,This is great and that dude is handsome af,"[('admiration', 0.9954181909561157)]"
300133,Needs to be cover art for a fire rap album,"[('neutral', 0.9970186948776245)]"
300133,Fake news Hot off the press,"[('neutral', 0.998547375202179)]"
300133,This reads like one of those stock photos.,"[('neutral', 0.9910587668418884)]"
300133,This is the image I never knew I associated the word “aesthetic” with.,"[('realization', 0.9913671612739563)]"
300133,Becoming a speed reader requires motivation.,"[('realization', 0.7649275660514832), ('neutral', 0.6359010338783264)]"
300133,This is a future meme with potential. Mark my words.,"[('approval', 0.5631290674209595), ('optimism', 0.985451340675354)]"
300133,Love the composition and concept! Very clever. 10/10,"[('admiration', 0.9971218705177307), ('love', 0.5133902430534363)]"
300133,The Cartier eyeglasses are fake,"[('disapproval', 0.933158814907074), ('neutral', 0.48321428894996643)]"
300133,This is fine.,"[('approval', 0.9935638308525085)]"
300133,Awesome capture! Styled perfectly.,"[('admiration', 0.9942903518676758)]"
300133,i thought this was a real pic until i saw the sub,"[('realization', 0.786896824836731), ('neutral', 0.4822773039340973)]"
300133,"Ok boomer, so we're going back to news papers now eh?","[('curiosity', 0.987126886844635)]"
300133,Anyone have a photoshop tutorial for this?,"[('curiosity', 0.9716145396232605)]"
300133,Mixtape so hot it made the news.,"[('neutral', 0.9978243112564087)]"
300133,You got some balls to try that,"[('neutral', 0.9976949095726013)]"
300133,Anime characters Where could the villain possibly be?!? Anime Villain,"[('curiosity', 0.9922789335250854)]"
300133,I expect to see this in  in 30 years,"[('desire', 0.7630975842475891), ('neutral', 0.8579965829849243)]"
300133,this is probably the best thing ive seen yet ngl<3,"[('admiration', 0.995968222618103)]"
300133,"BEAUTIFUL. Thanks for this masterpiece. Worth more than a lot of other ""art.""","[('admiration', 0.4368497431278229), ('gratitude', 0.9989370703697205)]"
300133,"the colours are so pretty though, amazing","[('admiration', 0.9958819150924683)]"
300133,what this dude reading fre,"[('curiosity', 0.5286588668823242), ('neutral', 0.4360278844833374)]"
300133,Beautiful shot. Love the outfit also.,"[('admiration', 0.9978154897689819)]"
300133,Mysteries are fire. Truth burns.,"[('neutral', 0.9624887108802795)]"
300133,god this is an amazing aesthetic,"[('admiration', 0.9940193891525269)]"
300133,"looks like any picture of a random person, but it does looks like an expensive camera was used. photography is the joke of the art world.","[('amusement', 0.9588621854782104)]"
300133,Unoriginal. Ride your own wave bro,"[('approval', 0.47206127643585205), ('neutral', 0.7483486533164978)]"
300133,You could say that's a hot topic,"[('admiration', 0.5651727914810181), ('neutral', 0.8083264827728271)]"
