0,1,2
300220,"the bottom foot is really well done. i feel there's an issue with depth on the raised foot's heel, it looks to me kind of like it is hollow rather than extending out like a heel should be","[('admiration', 0.9939579963684082)]"
300220,I've always had fun sketching feet - they're so curvy,"[('amusement', 0.9771843552589417)]"
300220,Someones got a foot fetish.,"[('neutral', 0.9985060691833496)]"
300220,Beautiful! Would you consider selling it or prints of it?,"[('admiration', 0.905131459236145), ('curiosity', 0.9512433409690857)]"
300220,I always wondered what is the scientific reason of hands and feet being so hard to draw right .,"[('curiosity', 0.8414802551269531), ('surprise', 0.38927701115608215)]"
300220, send their regards.,"[('neutral', 0.9964048862457275)]"
300220,"Aw, that's really beautiful, great job!","[('admiration', 0.9937673807144165)]"
300220,This is so satisfying to look at.,"[('admiration', 0.9845728278160095), ('approval', 0.6585333347320557)]"
300220,Best foot fetish artwork I've ever seen,"[('admiration', 0.9944553971290588)]"
300220,Omg it's feet! You're so talented!,"[('admiration', 0.9954957962036133)]"
300220,"Great looking. Nice job, next go further up!","[('admiration', 0.9922654032707214)]"
300220,Reminds me of one on my favorite artists Derek Hess,"[('love', 0.707693874835968), ('neutral', 0.477024644613266)]"
300220,"This drawling shows the importance of erasers. It's the duality of drawing, providing the suggestion of lines and completing them with highlights to provide context to the shadows.","[('neutral', 0.9785299897193909)]"
300220,Seeing the stark contrast in the arch of this foot and my flat feet makes me a little sad.,"[('sadness', 0.9869927167892456)]"
300220,Rob Liefeld needs to see this.,"[('neutral', 0.9989087581634521)]"
300220,Quentin Tarantino would love this drawing.,"[('love', 0.98615962266922)]"
300220,Quentin Tarantino learns to draw.,"[('neutral', 0.9941636919975281)]"
300220,"I showed this to my toddler, and he said ""alligator"". I didn't see it at first, but now I can't not see it, with the top heel as an eye and the toes as teeth. More like a chameleon than an alligator, but he doesn't know what a chameleon is.  I pointed out that it was a foot and showed him the toes, and he took my phone away from me to stare at it for a minute.","[('neutral', 0.9987550973892212)]"
300220,You nailed those feet! It's like you are a descendent of Pontius Pilate.,"[('admiration', 0.9892680048942566), ('neutral', 0.8232715725898743)]"
300220,Now do one of a fat diabetic missing 3 toes.,"[('neutral', 0.9984980821609497)]"
300220,"Focus on getting the contour exactly how you see it, regardless of if you think it looks ""wrong"". A good contour can help guide the direction your shading and form takes. As it is now it's a bit too consistently gestural. It's good to have a gestural contour in areas where movement is more apparent like legs and hips, but you don't need a gestural toe, for example. Ends up sucking the personality out of the parts of the image that should be the most unique like fingers, toes, and distinct facial features. Hope this helps","[('optimism', 0.9659708738327026), ('realization', 0.3090161085128784)]"
300220,"I hate feet. But those are some very nicely drawn feet. For once, I did not cringe at the sight of feet!","[('anger', 0.9903880953788757)]"
300220,I dont want to hate or something. But the right foot is not the right way,"[('disapproval', 0.4491322338581085), ('neutral', 0.9548201560974121)]"
300220,I would literally buy this,"[('approval', 0.9943410158157349)]"
300220,Hate feet but this is wonderful,"[('admiration', 0.9921252131462097)]"
300220,"Neat. But I got to say that I find your shadow on the left ankle not as good as everything else. To get it straight, the sharp edge line that it makes produce a confusing tangent with the central ""groove"". In a next one, you should try to wonder about other figurative nature to interpret shadow.  You got many drawing in this one. Good work!","[('admiration', 0.9960066676139832)]"
300220,Watch out for that spike coming out the ground. Don't want to hurt your perfect feet.,"[('caring', 0.986369252204895)]"
300220,Really it's awesome art. Love it.,"[('admiration', 0.9960018992424011), ('love', 0.6363062858581543)]"
300220,Thats awesome. You can feel the weight placement and the arches. Am amazed its a line drawing.,"[('admiration', 0.9937015771865845)]"
300220,This is beautiful! Great job!,"[('admiration', 0.9918918609619141)]"
300220,Wow wow wow I'm legit so impressed! I love it.,"[('admiration', 0.9810583591461182), ('love', 0.907945454120636)]"
300220,Amazing. When did you start working on it?,"[('admiration', 0.7905313372612), ('curiosity', 0.8933588862419128)]"
300220,You are amazing! Great job!,"[('admiration', 0.9886645078659058)]"
300220,"Very nice detail on the form on how feet should look, too bad I'm flat-footed and I would probably be a bad reference if I to draw feet.","[('admiration', 0.9926958084106445)]"
300220,The lighter markings on the back half of the right foot which show the end of the top side and beginning of the sole. amazing.,"[('admiration', 0.9952961802482605)]"
300220,Amazing! True inspiration!,"[('admiration', 0.9960917830467224)]"
300220,"I'm not a feet person. Not at all. They give me the willies. This though, this looks natural and almost comforting. Very well done.","[('admiration', 0.999093770980835)]"
300220,You should design electronics that mimic the human curve,"[('caring', 0.5029259324073792), ('neutral', 0.8112391829490662)]"
300220,"Honestly, very impressive work.","[('admiration', 0.9951242804527283)]"
300220,"I'm trying to figure it out, does she sit here? I have to study this drawing in detail. It's really hypnotizing!","[('curiosity', 0.994053065776825)]"
300220,Either dancing or just post-stepping on a lego,"[('neutral', 0.9987473487854004)]"
300220,Would sucking on those toes give you lead poisoning?,"[('curiosity', 0.9694599509239197)]"
300220,Are the legs crossed with big toes on the outside of the feet rather than the inside?,"[('neutral', 0.9724898338317871)]"
300220,Where do I start if I want to draw like this?,"[('confusion', 0.9657462239265442)]"
300220,For some reason this makes me think of Attack on Titan.,"[('neutral', 0.9977370500564575)]"
300220,Why right foot then left foot it pains me great art tho,"[('admiration', 0.30294373631477356), ('sadness', 0.713058352470398)]"
300220,This suddenly reminds me of my plantar fascitis,"[('realization', 0.962074875831604), ('surprise', 0.5044376850128174)]"
300220,This better not awaken anything in me.,"[('disapproval', 0.6028132438659668), ('neutral', 0.9594367742538452)]"
300220,rob liefeld probably looking at this with such resentment,"[('anger', 0.8287043571472168)]"
300220,"Wow, very beautiful. This is very cool","[('admiration', 0.994329035282135)]"
300220,I usually don't care about art at all. This made me comment. well done.,"[('admiration', 0.9931889772415161)]"
300220,"I hate feet, and this so brilliantly captures the feet that I have to hate this too, but only because it's really good","[('admiration', 0.9667705297470093), ('anger', 0.9193233847618103)]"
300220,"This is incredible, the lines are so smooth and light, and yet they reveal so much about the anatomy.  But it bothers me that the right foot looks like another left foot . If you were just drawing two left feet, go right ahead and ignore my dumb observation. ","[('admiration', 0.993812084197998), ('disappointment', 0.5963192582130432)]"
300220,That is a wierd looking pencil,"[('neutral', 0.9987301230430603)]"
300220,"This is so beautiful and sensitive, good job!","[('admiration', 0.997080385684967)]"
300220,Really love how you handled the contour of the feet. Keep it up ,"[('admiration', 0.9607767462730408), ('caring', 0.46562883257865906), ('love', 0.9645418524742126)]"
300220,"I've never said this to anyone, ever Those feet are beautiful.","[('admiration', 0.9980567097663879)]"
300220,The flow is nuts! It's so beautiful!,"[('admiration', 0.9945310950279236)]"
300220,Art finishing is very well,"[('admiration', 0.9856060147285461), ('approval', 0.8461202383041382)]"
300220,You've got it so perfect. Killed it -,"[('admiration', 0.9939034581184387)]"
300220,"It looks so effortless, a beauty.","[('admiration', 0.9974291920661926)]"
300220,"Nice work, but I don't understand the position of the feet. Is the model sitting cross-legged?","[('admiration', 0.9802458882331848), ('confusion', 0.9048553109169006), ('curiosity', 0.8030605912208557)]"
300220,Reminds me H. R. Giger in some way.,"[('realization', 0.8909612894058228), ('neutral', 0.9155758023262024)]"
300220,Took me a minute to realize the model's legs are crossed. I was wondering why the feet were backwards.,"[('surprise', 0.9777830243110657)]"
300220,Why it reminds me a skull of horse?,"[('confusion', 0.9567437767982483)]"
300220,Draw me nakey nakey nakey,"[('neutral', 0.9985315799713135)]"
300220,"We new that we were to only draw her feet, but we still insisted she pose in the nude.","[('neutral', 0.9986461997032166)]"
300220,This wonderful work! Great job!,"[('admiration', 0.9926153421401978)]"
300220,Why is the left foot on the right side and vice versa?,"[('curiosity', 0.3109503388404846), ('neutral', 0.9232893586158752)]"
300220,"That's really amazing, loved your style!","[('admiration', 0.9929617047309875), ('love', 0.656766414642334)]"
300220,You should do a video on how you draw these. I would watch every single one of them. ,"[('neutral', 0.8488600254058838)]"
300220,"This is beautiful, I love it!","[('admiration', 0.8721296787261963), ('love', 0.975225031375885)]"
300220,I want a footjob from those feet,"[('desire', 0.9692001938819885), ('neutral', 0.5973737835884094)]"
300220,"So smooth and fine, a treat to watch","[('neutral', 0.9967781901359558)]"
300220,Lol. That's ok. Not interested in erotica. I got a couple resources. Ill try them again.,"[('amusement', 0.9910139441490173)]"
300220,I'd love a print of this if you'd be willing to share high res,"[('love', 0.9903410077095032)]"
300220,Is it the footwork of a tennis player about to serve?,"[('curiosity', 0.9689338803291321)]"
300220,Is no one going to mention how the feet are on the wrong sides? Look at the toes,"[('neutral', 0.9971187114715576)]"
300220,"At first I was just like meh. But as I kept looking at it, it just felt more and more like a piece of art. Now as I'm setting this, I feel like it's a masterpiece. Congrats op.","[('admiration', 0.7551954388618469), ('gratitude', 0.7485373020172119)]"
300220,too much praise in here for someone who cant draw ankles,"[('admiration', 0.9653815031051636)]"
300220,It's gonna hurt when he steps on that pointy A,"[('disappointment', 0.8735759854316711), ('sadness', 0.8032723069190979)]"
300220,I imagine that this is how foot fetish people see feet.,"[('neutral', 0.9709814786911011)]"
300220,Is the left foot meant to be to the right of the right foot? I'm struggling to envisage exactly what the person is doing with their legs,"[('neutral', 0.9973777532577515)]"
300220,"The best part to me is the fact that there isnt really any lines out of place. As an average joe i might be able to  eventually get the curve correct  but it would be messy and not nearly as clean or skilled. On this, every line looks purposeful and perfectly where it needs to be and where it needs to go. Well done.","[('admiration', 0.998497486114502)]"
300220,Always avoid drawing the hands and feet,"[('approval', 0.5921841859817505), ('caring', 0.8668085932731628)]"
300220,Foot fetish on a whole new level.,"[('neutral', 0.8544791340827942)]"
300220,What is going on with the leg on the left right around the heel from the other foot? Is that just like a cut out to help show the curve of the other foot or is there something weird going on there?,"[('confusion', 0.7290459275245667), ('curiosity', 0.9827285408973694)]"
300220,Sure looks like feet to me,"[('neutral', 0.9989640712738037)]"
300220,i like how it somewhat reminds me of gesture drawing.,"[('love', 0.9485852718353271)]"
300220,how do you know I've a feet fetish. seriously though. amazing work. your pencil work is super. and so is your eraser work. the white fades at strategic places. again. amazing,"[('admiration', 0.9968559741973877)]"
300220,This is so good! Is there anywhere you recommend to learn how to draw like this? Or draw people in general?,"[('admiration', 0.9892430305480957), ('curiosity', 0.41526609659194946)]"
300220,People like you are making things like this and I'm over here abbreviating my signature so it looks slightly less like a deformed stick figure.,"[('neutral', 0.9923187494277954)]"
300220,feet are hard! this is awesome =,"[('admiration', 0.8982817530632019), ('excitement', 0.7979207038879395)]"
300220,"Love this. I wish I could draw like this, I used to draw all the time in junior high and through highschool but couldn't improve as I liked so I just gave up.","[('desire', 0.9386072754859924), ('love', 0.9858106374740601)]"
300220,There's something really soft and beautiful about this. Really well done.,"[('admiration', 0.9973074197769165)]"
300220,"The heel on the right foot looks too flat, almost inverted","[('neutral', 0.9989930987358093)]"
300220,"Love this! I looked at your username and thought ""Well I should have known!"" I follow you on Instagram and you are very talented. Awesome work!","[('admiration', 0.9987385869026184), ('love', 0.8387049436569214)]"
300220,Feet are gross but so pretty to draw.,"[('disgust', 0.9790630340576172)]"
300220,superb.excellent work.,"[('admiration', 0.9952408075332642)]"
300220,Looks a lot like the things Dave Malan posts on his IG.,"[('neutral', 0.9988549947738647)]"
300220,Beautiful drawing. Realistic and sensual.,"[('admiration', 0.9960193037986755)]"
300220,"Stunning - I actually whispered ""wow"" out loud","[('surprise', 0.9923518300056458)]"
300220,That is very well drawn! Feet are notoriously hard to draw. kudos,"[('neutral', 0.9921202659606934)]"
300220,Where can I learn this kind of drawing technique? Online somewhere maybe?,"[('curiosity', 0.9891447424888611)]"
300220,"Amazing.  Do you learn by yourself or study at school? And if by yourself, what books/tutorials do you follow? Thanks!","[('admiration', 0.5365952253341675), ('confusion', 0.40452420711517334), ('curiosity', 0.8706459999084473), ('gratitude', 0.9805194735527039)]"
300220,The way you sign A3 is brilliant.,"[('admiration', 0.99561607837677)]"
300220,i wish my feet looked like that. having flat feet is a curse.,"[('desire', 0.959056556224823)]"
300220,"This is awesome. It is a somewhat obscure field, but you could probably do anatomical art. Pick up a Netter atlas of anatomy. if you aren't disgusted you will be amazed by the artwork.","[('admiration', 0.9972246885299683)]"
300220,something is wrong with that left foot,"[('confusion', 0.5075013637542725), ('realization', 0.7390429377555847), ('neutral', 0.5955814719200134)]"
300220,I'd frame that! I love this.,"[('love', 0.9957748055458069)]"
300220,"""that'll be 50 dollars please""","[('neutral', 0.9886132478713989)]"
300220,What did you use for reference?,"[('curiosity', 0.9026574492454529), ('neutral', 0.38224297761917114)]"
300220,It frustrates how much it looks like it's tip toeing cross legged. It makes me uncomfortable,"[('annoyance', 0.9949814677238464)]"
300220,Where can i find more like this? Its gorgeous,"[('admiration', 0.9770264029502869)]"
300220,I'm so entranced by the flow of the lines in this drawing. Literally can not staring at it!,"[('neutral', 0.9786410927772522)]"
300221,This Czech artist does some impressive works on the apocalypse of pop culture. Here's an album,"[('admiration', 0.9712085723876953)]"
300221,I'm getting a nier automata vibe with the colour of the buildings and the flora,"[('neutral', 0.9978601336479187)]"
300221,I feel like homes can be made like this,"[('neutral', 0.8375772833824158)]"
300221,The plural of Lego is Lego.,"[('neutral', 0.9986217021942139)]"
300221,"For anyone wondering, this style of architecture is called brutalism","[('neutral', 0.9410515427589417)]"
300221,The plural of Lego is Lego.,"[('neutral', 0.9986217021942139)]"
300221,My dream retirement location,"[('neutral', 0.9986328482627869)]"
300221,"I want to upvite this so bad but you wrote ""legos""","[('desire', 0.37098410725593567), ('disappointment', 0.3394041359424591), ('neutral', 0.8239791393280029)]"
300221,Gives me Ark Extinction vibes,"[('neutral', 0.9991365075111389)]"
300221,They look like some kinda bunkers,"[('neutral', 0.9989150762557983)]"
300221,I bet they still hurt to step on,"[('sadness', 0.9584580659866333)]"
300221,Hey look its halo infinite,"[('neutral', 0.9982969164848328)]"
300221,I love the clear brick. Its so nostalgic for some odd reason.,"[('love', 0.9842394590377808)]"
300221,This is got to be the best picture I saw on internet today,"[('admiration', 0.9955978989601135)]"
300221,It's not legos it's lego. If there is one lego then it is a yellow and if there are multiple lego then it's lego. Lego,"[('disapproval', 0.9676578044891357), ('neutral', 0.35745859146118164)]"
300221,"Jeez, come on guys. It says LEGO on the box. It does not say Legos anywhere.  If you really must pluralize then say ""LEGO bricks"".","[('neutral', 0.9988805651664734)]"
300221,"Lego. By corporate decree, the company has forbidden the use of ""Legos"". You will not find that word on their web site.","[('neutral', 0.9913962483406067)]"
300221,THIS IS SO COOL PLEASE DO MORE! Sorry for yelling.,"[('anger', 0.5296779870986938), ('remorse', 0.7631171941757202)]"
300221,"Whoever calls Lego bricks and pieces ""legos"" is just. No.","[('disapproval', 0.9901554584503174)]"
300221,"I love the implication here! Really cool, thanks for posting.","[('admiration', 0.8999990820884705), ('gratitude', 0.9769302606582642), ('love', 0.9437099099159241)]"
300221,I think this is extraordinary!,"[('admiration', 0.9774817824363708)]"
300221,Lego house?,"[('neutral', 0.9916161894798279)]"
300221,"Great work! I love it, especially the textures! Question how big are the legos you're depicting? Are they regular legos and this is just small moss/plants? Or are these colossal legos that perhaps lead to the downfall of man? ;","[('admiration', 0.9794521331787109), ('confusion', 0.7992334961891174), ('curiosity', 0.7248005270957947)]"
300221,"This makes me really happy I don't know why, thank you","[('gratitude', 0.989136815071106), ('joy', 0.7794733047485352)]"
300221,Funny how post apocalypse anything is always good for nature.,"[('amusement', 0.9821916222572327)]"
300221,This has Grounded vibes all over it! It would be amazing to see this as an area in the backyard!,"[('admiration', 0.9468693137168884)]"
300221,I’m getting massive Maze Runner vibes,"[('neutral', 0.9988670349121094)]"
300221,This image gives me really strong feelings of nostalgia,"[('approval', 0.3424777686595917)]"
300221,It’s the forest moon of Endor,"[('neutral', 0.9985440969467163)]"
300221,"I love the fogged up ""glass""","[('love', 0.9908885955810547)]"
300221,At least they left us good building blocks.,"[('realization', 0.5023232102394104)]"
300221,This reminds me of the Shattered Sea Chronicles by Joe Abercrombie,"[('realization', 0.8629037737846375)]"
300221,My feet feel this drawing,"[('neutral', 0.9990554451942444)]"
300221,This is what the Lego movie should have looked like.,"[('realization', 0.9507694244384766), ('neutral', 0.5869913101196289)]"
300221,This is a great rendering of what I imagined when playing with legos as a kid. I would put those transparent bricks in a build and pretend like little people were in there looking out on my cityscape.,"[('admiration', 0.9978901743888855)]"
300221,The Last of Us Lego Edition,"[('neutral', 0.9989097118377686)]"
300221,I feel like the folks over in  might also like this.,"[('neutral', 0.9986066222190857)]"
300221,Horizon Zero Dawn. Minecraft edition,"[('neutral', 0.9982308745384216)]"
300221,This reminds me I need to get back into Disco Elysium.,"[('desire', 0.3488198518753052), ('realization', 0.9377977848052979)]"
300221,It looks like something that would be in a Maze Runner movie.,"[('realization', 0.7978905439376831)]"
300221,I don't see a Flipped Honda anywhere.,"[('disapproval', 0.6520566940307617)]"
300221,I can imagine there's just this senile old man that is a master stoneworker and lives down in those forests and does this kind of thing for fun,"[('admiration', 0.9932559728622437)]"
300221,The buildings are designed this way to prevent giants from stepping on them and killing the inhabitants inside.,"[('neutral', 0.998456597328186)]"
300221,This looks like that Black Ops 3 map,"[('neutral', 0.9988817572593689)]"
300221,Can we get post apocalyptic house of doggy?,"[('curiosity', 0.9767505526542664)]"
300221,Genuine question why do people give awards to posts that aren't OC,"[('confusion', 0.8438613414764404), ('curiosity', 0.8188238739967346)]"
300221,"Digital art, 3D model, or a mix? I have a feeling the legos are part 3D model.","[('confusion', 0.9823038578033447)]"
300221,"Looks like that Halo 3 mission, Hornets Nest?","[('confusion', 0.9817020893096924)]"
300221,imagine godzilla trying to destroy a city and he step on one of those,"[('neutral', 0.9283658266067505)]"
300221,Everything is not awesome.,"[('disapproval', 0.9920201897621155)]"
300221,On what did you do this? Blender?,"[('curiosity', 0.7229123115539551), ('neutral', 0.7481733560562134)]"
300221,Reminds me of how Terry Gilliam used giant legos in Time Bandits ,"[('realization', 0.9415452480316162), ('neutral', 0.7393168210983276)]"
300221,is there a highres version of this?,"[('confusion', 0.9832581877708435)]"
300221,"Hey Alexa, play “Everything is Awesome” in minor","[('admiration', 0.9825847744941711)]"
300221,Great piece man! Is it C4D?,"[('admiration', 0.9937559366226196)]"
300221,"Oh man, I used to trap ants in those clear legos as a kid.","[('neutral', 0.9966185092926025)]"
300221,Some species from a future civilization is going to step on one of those in their bare feet,"[('neutral', 0.9990702271461487)]"
300221,This was many years after the last human stepped on a Lego ending the human race.,"[('realization', 0.4043840765953064), ('neutral', 0.9791313409805298)]"
300221,Ohayo sekai GOOD MORNING WOORLD,"[('admiration', 0.962221086025238)]"
300221,A Muslim voting for Trump in 2016?,"[('neutral', 0.9497786164283752)]"
300221,Giants won't dare step on it,"[('neutral', 0.9985041618347168)]"
300221,Seems like the sloped brick is portal-able,"[('neutral', 0.9988077878952026)]"
300221,Those skew roof blocks are not standard Lego. never seen those before. Looks like a 1x1 blown up to 2x2.  Roof tiles have 2 studs.,"[('disapproval', 0.4073653817176819), ('neutral', 0.8208728432655334)]"
300221,I thought this was beeple for a sec,"[('neutral', 0.9965152740478516)]"
300221,I had a plugin called Ivy which could do that. Awesome tool. ,"[('admiration', 0.9923895001411438)]"
300221,No! What about the gods' feet when they walk down the stairs to visit?,"[('curiosity', 0.8538669347763062), ('neutral', 0.4023303687572479)]"
300221,Those motherfuckers are still standing though.,"[('anger', 0.9897213578224182)]"
300221,"Probably someone said this but I didn't see it scrolling through comments,  would love this.","[('confusion', 0.37609654664993286), ('love', 0.9641954302787781)]"
300221,Rooftop water collection and purification tanks.,"[('neutral', 0.9985716342926025)]"
300221,I know this is a super random reference but this reminds of one of the first missions in Black Ops 3. Really strange considering I played that campaign half a time.,"[('realization', 0.7410467267036438), ('surprise', 0.9266527891159058)]"
300221,its the clear piece that does it for me,"[('neutral', 0.9957114458084106)]"
300221,My LEGO set that I can’t use because I just turned 10 /s,"[('neutral', 0.7574252486228943)]"
300221,Is like the game The Light on Steam,"[('neutral', 0.989418089389801)]"
300221,What program was used to make this?,"[('curiosity', 0.5275573134422302), ('neutral', 0.7329308986663818)]"
300221,This is awesome! A really amazing idea really beautiful done,"[('admiration', 0.9807260632514954)]"
300221,"These were created in the late 2040's, originally from Denmark, these were some of the most effective methods to defeat the Kaijus.  While effective, they also didn't discriminate, many good Jaegers and their pilots were also lost. This is one of the few remaining defenses from the great war.","[('admiration', 0.8984715342521667), ('realization', 0.40606147050857544)]"
300221,Wait it's all Lego !? Always has been,"[('realization', 0.4326018691062927), ('neutral', 0.9027261734008789)]"
300221,When you use LEGOS to build some architecture masterpieces,"[('neutral', 0.9985105395317078)]"
300221,It's for hurting giant feet,"[('caring', 0.6685660481452942), ('sadness', 0.9353910088539124)]"
300221,Why is everyone arguing about how to pronounce LEGO,"[('annoyance', 0.5935677289962769), ('confusion', 0.6038328409194946), ('curiosity', 0.6850566864013672)]"
300221,The plural of a Lego is Lego,"[('neutral', 0.9990697503089905)]"
300221,"Downvoting for ""Legos"".  Incredible artwork though, love how they used the clear brick to simulate glass in a building apartment/room.","[('admiration', 0.9715158343315125), ('love', 0.6087103486061096)]"
300221,I told you if I stepped on another Lego you left out I would hide them somewhere you would never find them.,"[('neutral', 0.9982910752296448)]"
300221,This is how we imagined lego as kids,"[('neutral', 0.9615234136581421)]"
300221,What my lego pieces look like lost under the sofa,"[('neutral', 0.943708598613739)]"
300221,That’s the LEGO I found under my kids bed in an old bowl of cereal,"[('neutral', 0.09987448900938034)]"
