0,1,2
300057,"I wish I didn't see it, but again I like that I saw it. It's.a different view. Really creative. You gotta use dem brains to do it.","[('admiration', 0.7528684139251709), ('desire', 0.9639840126037598)]"
300057,It's so beautiful but so gross lol,"[('admiration', 0.982541024684906), ('amusement', 0.7996882200241089)]"
300057,how to become a flat-earther.,"[('confusion', 0.9856007695198059)]"
300057,I can hear the Westworld theme starting.,"[('approval', 0.4950774312019348), ('excitement', 0.37282225489616394), ('neutral', 0.6125028133392334)]"
300057,I hate it and love it.its cursed,"[('anger', 0.9199890494346619), ('love', 0.7322725653648376)]"
300057,"This is really beautiful. I'd love to see it with the ""whites"" the colour of cerebrospinal fluid . Also, fun fact, the brain is the consistency of like raw tofu","[('admiration', 0.9935706853866577), ('amusement', 0.42227160930633545), ('love', 0.7943026423454285)]"
300057,Oh lawd what a terrible day to have eyes.,"[('fear', 0.9869866967201233)]"
300057,"I just had a dream about this last night! It’s so weird seeing it here, especially since I’ve never seen anything like it before!","[('fear', 0.5164526104927063)]"
300057,"This is amazing! Can't figure out why, but it is very inspiring","[('admiration', 0.985757052898407), ('excitement', 0.4017971456050873)]"
300057,yumm. burger patty in yolk,"[('neutral', 0.998367965221405)]"
300057,"That's pretty cool. But thanks, I hate it.","[('admiration', 0.3111914396286011), ('annoyance', 0.33716732263565063), ('gratitude', 0.9952507019042969)]"
300057,"Wow, I have never seen that before. Cool idea!","[('admiration', 0.9559677243232727), ('excitement', 0.3074212074279785), ('surprise', 0.5262719392776489)]"
300057,"omg, I am no Hannibal Lecter, but this is morbidly beautiful!","[('admiration', 0.997433602809906)]"
300057,That is both cool and kinda creepy at the same time,"[('admiration', 0.6753993034362793), ('fear', 0.30210068821907043)]"
300057,I’ll have mind hard boiled.,"[('neutral', 0.9987860321998596)]"
300057,Wanna crack some real ones I have few spare in my basement,"[('neutral', 0.9989863038063049)]"
300057,"I read this as the artist’s name being Brian Yolk, and briefly wondered if he uses egg references in his art because of his last name.  I’m not a smart man. Edit grammar","[('disapproval', 0.5605558156967163), ('surprise', 0.8532617092132568)]"
300057,You think it would taste good on buttered toast?,"[('curiosity', 0.9760246872901917)]"
300057,The brain is the most amazing thing. Well thats what its telling me to type anyway,"[('admiration', 0.99367755651474)]"
300057,So if you inseminate a skull,"[('neutral', 0.9967949986457825)]"
300057,Mmm The best way to start your day,"[('approval', 0.9951560497283936)]"
300057,"I'd like 2 brains cerebellum side up, please.","[('neutral', 0.9964134097099304)]"
300057,oh dude what I like it I but can't honestly believe that,"[('surprise', 0.8369132876396179)]"
300057,It was the best of faps. It was the worst of faps.,"[('annoyance', 0.7972068190574646), ('disgust', 0.5329028367996216)]"
300057,Some people are so open minded that their brains fall out.,"[('neutral', 0.9942901134490967)]"
300057,Anyone else remember that episode of The Grimm Adventures of Billy & Mandy where that alien brain crashes on Earth and it employs Billy to convince people to see the alien so it could eat the brains of the town? Edit Billy was a brain pimp with one customer who only wanted head is what I’m trying to say,"[('neutral', 0.9967443943023682)]"
300057,"My only critique is that if you did crack the brain open, it wouldn't hold it's shape quite like that. It would deform.","[('annoyance', 0.5147510766983032), ('neutral', 0.8963912725448608)]"
300057,This would make a great album cover.,"[('admiration', 0.9963369369506836)]"
300057,"""This is your brain on drugs.""","[('neutral', 0.9986610412597656)]"
300057,"I really wish there was a lan underneath and it was Titled ""This is your brain on drugs"".","[('desire', 0.9857699871063232)]"
300057,This is your brain. this is your brain on drugs. any questions?,"[('curiosity', 0.907776951789856), ('neutral', 0.4270506203174591)]"
300057,That disgusts me.nice work tho!,"[('admiration', 0.8363590240478516), ('disgust', 0.9574246406555176)]"
300057,This is your brain on drugs Edit I might be showing my age here /,"[('neutral', 0.9984157085418701)]"
300057,Needs to be falling into a wok that looks like the earth.,"[('neutral', 0.9981508851051331)]"
300057,I’ll have mine scrambled please,"[('neutral', 0.9984098672866821)]"
300057,This have the potential to be a good meme,"[('admiration', 0.9870686531066895)]"
300057,The longer I stare the more unsettled I find myself.,"[('confusion', 0.9689740538597107)]"
300057,Giant zombie’s breakfast-scrambled free-cage brain,"[('neutral', 0.9981094598770142)]"
300057,That is both interesting and creepy.,"[('admiration', 0.5873828530311584), ('fear', 0.5239025354385376)]"
300057,And last but not least ,"[('neutral', 0.9987573623657227)]"
300057,mm forbidden brain eggs.,"[('annoyance', 0.5631649494171143), ('neutral', 0.9169232249259949)]"
300057,Your brain will break in the pan if you don't crack your skull along its fracture lines.,"[('neutral', 0.9963725805282593)]"
300057,Is this digital art or a sculpture?,"[('confusion', 0.7875623106956482), ('neutral', 0.4720633327960968)]"
300057,Hens on parallel universe -,"[('neutral', 0.9988864064216614)]"
300057,"""And this is what can happen if you are not wearing a helmet""","[('optimism', 0.6272872090339661), ('realization', 0.42544689774513245), ('neutral', 0.812796950340271)]"
300057,From the thumbnail i thought it was just a regular plumbus. well done!,"[('admiration', 0.9984502792358398)]"
300057,Zombie Now you have to seperate the brain from the brain juice to get a nice and fluffy deathday cake,"[('neutral', 0.98921799659729)]"
300057,Why did you go and give aliens ideas. Now we are bfast.,"[('neutral', 0.91731858253479)]"
300057,What you gonna use for a frying pan in this strange alternate universe?,"[('confusion', 0.38369831442832947), ('curiosity', 0.9203522801399231)]"
300057,"We must keep an open mind, but not so open that our brains fall out.","[('neutral', 0.9990334510803223)]"
300057,"This might be at stupid question, but why is this type of image called ""3d""?","[('annoyance', 0.9548509120941162), ('curiosity', 0.35079872608184814)]"
300057,Oh wow actual art on the sub for a change,"[('excitement', 0.39761605858802795), ('surprise', 0.9289002418518066)]"
300057,Woah! I love your creativity!,"[('admiration', 0.7742162942886353), ('love', 0.813147783279419), ('surprise', 0.8688847422599792)]"
300057,This is a great album cover for a dude that raps about metaphysics,"[('admiration', 0.9956849813461304)]"
300057,"Obligatory 'this is your brain on drugs' comment, i do love this image too tho","[('love', 0.993191659450531)]"
300057,This is really well done. Do not like.,"[('admiration', 0.9564937353134155), ('disapproval', 0.4458746314048767)]"
300057,like a walnut how his head cracked,"[('neutral', 0.9986292123794556)]"
300057,Took me a few seconds to get it. I’m ok with this.,"[('approval', 0.9768784046173096)]"
300057,How aliens make breakfast,"[('neutral', 0.9489929676055908)]"
300057,I didn't need breakfast today anyway,"[('realization', 0.3640289902687073), ('neutral', 0.9792618751525879)]"
300057,"I have feet made of fire and ash, but my head is full of water.","[('fear', 0.4876154065132141), ('neutral', 0.394158273935318)]"
300057,"This is beautiful. The colors, the clarity, the composition. Wow","[('admiration', 0.995570957660675)]"
300057,Wow dude! Which program did you use?,"[('curiosity', 0.9822425842285156), ('surprise', 0.46366292238235474)]"
300057,How I imagine I would die if I fell and hit my head,"[('fear', 0.3717123568058014), ('surprise', 0.5898134112358093)]"
300057,Sugar baby is needed to be spoil DM,"[('neutral', 0.9984475374221802)]"
300057,"Gotta scramble that with some cheese. Heat up some tortillas on the side. Boom, breakfast tacos","[('desire', 0.6774532794952393), ('neutral', 0.7409671545028687)]"
300057,Scrambled brain for breakfast.,"[('neutral', 0.9986635446548462)]"
300057,I think this is amazing but it should be on tihi,"[('admiration', 0.9911104440689087)]"
300057,My brain during a math test,"[('neutral', 0.9989894032478333)]"
300057,This is your brain on . oh wait,"[('neutral', 0.9975161552429199)]"
300057,It’s like the brain dump thing,"[('neutral', 0.9966298937797546)]"
300057,Stealing this idea for a tattoo,"[('neutral', 0.9950249791145325)]"
300057,So this is what people mean when they talk about cracking skulls,"[('neutral', 0.9974627494812012)]"
300057,This image made me feel wildly uncomfortable. Great job!,"[('admiration', 0.9697778224945068)]"
300057,Wow. One of the best I've seen so far,"[('admiration', 0.9951523542404175)]"
300057,Great art! I also love hate it.,"[('admiration', 0.9942060708999634), ('love', 0.837145209312439)]"
300057,I love neuroscience but. this is both weird and cool,"[('admiration', 0.6527742743492126), ('love', 0.9854732155799866)]"
300057,I love this! Could you make it for an iPhone X wallpaper?,"[('love', 0.9909501671791077)]"
300057,I love this concept! Thank you for sharing,"[('gratitude', 0.9862738251686096), ('love', 0.9666447639465332)]"
300057,This is beautiful. But ew lol,"[('admiration', 0.9833136200904846), ('amusement', 0.5669613480567932)]"
300057,"This is the strangest thing I've seen, and I've seen the matrix.","[('surprise', 0.9801750779151917)]"
300057,How many eggs were harmed in making this? lol,"[('amusement', 0.9903590083122253)]"
300057,"Absolutely stunning work, but I’m not sure how to feel about the content.","[('admiration', 0.9846038222312927), ('confusion', 0.9038981795310974)]"
300057,I hate it. It looks amazing,"[('admiration', 0.4613457918167114), ('anger', 0.465582013130188), ('disgust', 0.6187207698822021)]"
300057,Best served sunny side up with tongue bacon,"[('approval', 0.9623371362686157)]"
300057,This is your brain on drugs,"[('neutral', 0.9982773065567017)]"
300057,The brain drop/yolk looks kinda looks like a titty.,"[('neutral', 0.9985365867614746)]"
300057,I’ve always wanted to do that,"[('desire', 0.926239550113678)]"
300057,"Cool idea. I think it might be more interesting if it was more egg shaped, styled to look like a skull. That way you could tell right off the bat it’s a strange looking egg being cracked, and then it sets in that it’s a skull and brain.","[('admiration', 0.9896462559700012)]"
300057,This is what a headache feels like.,"[('annoyance', 0.9708130359649658)]"
300057,"My high mind right now says that ""Heart breaks your brain apart""","[('neutral', 0.9991876482963562)]"
300057,"""I'm Max G., this is my Brain Dump of the week and I hope you hate it!""","[('annoyance', 0.9620082378387451)]"
300057,Can’t make an omelet without breaking a few heads,"[('disapproval', 0.8049798607826233), ('neutral', 0.9668393731117249)]"
300057,EW & WOW simultaneously!,"[('neutral', 0.9931300282478333)]"
300057,"I hate you for making it, but my life could be worse without it","[('anger', 0.384865403175354), ('disgust', 0.985527515411377)]"
300057,This is your brain on drugs-Any questions?,"[('curiosity', 0.9843511581420898)]"
300057,This is your brain on drugs,"[('neutral', 0.9982773065567017)]"
300057,I'd love to see this but with a yellow brain.,"[('love', 0.9950540065765381)]"
300057,it's amazing but. ,"[('admiration', 0.9961891770362854)]"
300057,Cqn we get this as a wallpaper,"[('neutral', 0.9988362193107605)]"
300057,I hate it but I love it too,"[('anger', 0.49393752217292786), ('love', 0.9809361696243286)]"
300057,Brain. yolk? So it’s Br-olk,"[('curiosity', 0.9100080728530884)]"
300057,"Which came first, the skull or the brain?","[('neutral', 0.9888910055160522)]"
300057,Can you do a size that will fit a wallpaper this looks like the best goddamn wallpaper for my phone,"[('admiration', 0.9974607229232788)]"
300057,"I am disturbed, amused and amazed","[('annoyance', 0.4356064796447754), ('surprise', 0.5008049011230469)]"
300057,It’s a weird thing to watch this during my breakfast time,"[('disgust', 0.6213141083717346), ('embarrassment', 0.32617005705833435)]"
300057,This had me ew-ing more than I should have.,"[('neutral', 0.9988110065460205)]"
300057,This gives me some unus annus vibes,"[('neutral', 0.9959545135498047)]"
300057,"Wow, im amazed. Imma save because it's so cool.","[('admiration', 0.8752930164337158), ('excitement', 0.3261915147304535), ('surprise', 0.7236847877502441)]"
300057,I feel like my head is experiencing this,"[('realization', 0.5904061794281006), ('neutral', 0.9075998663902283)]"
300057,Jesus christ that's acurate-ish,"[('neutral', 0.9976072311401367)]"
300057, and  indeed,"[('neutral', 0.998482882976532)]"
300057,That’s all the mucus from when you get sick on winter,"[('neutral', 0.9987725615501404)]"
300057,I needed a new Lock Screen wallpaper. Nice bro,"[('admiration', 0.9842061996459961), ('approval', 0.4191887676715851)]"
300057,"So this is what Cannibals eat for breakfast, Anybody have any guess on how they cook their eggs?","[('curiosity', 0.9881019592285156)]"
300057,Is. Is this my brain on drugs?,"[('confusion', 0.8336121439933777), ('curiosity', 0.8852038979530334)]"
300057,This is your brain on eggs.,"[('neutral', 0.9984034895896912)]"
300057,It’s one of those pictures where it’s cool and slightly gross at the same time.,"[('disgust', 0.8902885913848877)]"
300057,Ew but also oo,"[('neutral', 0.9914295077323914)]"
300057,"Great, just give the aliens new ideas!","[('admiration', 0.9906240105628967)]"
300057,Why am I turned on help me,"[('confusion', 0.9365897178649902)]"
300057,Eat that with a slice of life.,"[('neutral', 0.9979503750801086)]"
300057,"Reminded me of those anti drug adds. Holding an egg ""This is your brain. this is your brain on crack"" then they smash the egg with a frying pan.","[('neutral', 0.9991293549537659)]"
300057,Yoo this is cool! I love it I could hang this on my wall,"[('admiration', 0.7422398924827576), ('love', 0.9783625602722168)]"
300057,The brain is terrible thing to waste,"[('fear', 0.9765222072601318)]"
300057,I will consume the brain juice and become the smartest man alive,"[('admiration', 0.9734765291213989), ('approval', 0.8031243085861206)]"
300057,"This is disgusting, you could have put a hot stove underneath so it doesn't go to waste. ;  seriously this is awesome horror","[('disgust', 0.9502363801002502)]"
300057,"If you open your mind too much, your brain will fall out.","[('neutral', 0.9906901121139526)]"
300057,They should put this image in legal textbooks in sections about the eggshell skull rule!,"[('neutral', 0.9990183115005493)]"
300057,I hate the orientation of the brain. I get that this is representational and not realistic but the frontal lobe should be on top and not on the bottom.,"[('anger', 0.32658690214157104), ('annoyance', 0.6605941653251648), ('disapproval', 0.6503220796585083)]"
300057,"This creativity, I love it !","[('love', 0.9904776811599731)]"
300057,This is your brain on art,"[('neutral', 0.9987888932228088)]"
300057,Looks like this mind has been cracked wide open.,"[('neutral', 0.9959176182746887)]"
300057,Bro that is some next level thought u have put in it,"[('neutral', 0.9973560571670532)]"
300057,Annd scrambling my eggs this morning.,"[('neutral', 0.9919482469558716)]"
300057,"Well, pig brains are often scrambled and fried. I suppose this isn't much different.","[('neutral', 0.9948073029518127)]"
300057,This is giving me DROELOE vibes,"[('neutral', 0.9991117119789124)]"
300057,My anatomy teachers probably make autistic screeching looking at this. ,"[('annoyance', 0.6161030530929565), ('neutral', 0.6446557641029358)]"
300057,“This is your brain on drugs”,"[('neutral', 0.9946951270103455)]"
300057,Does anybody else feel like a fried egg?,"[('neutral', 0.8869640827178955)]"
300057,"Glad I've seen this after eating. If it was during, you would have ruined my appetite.","[('joy', 0.9334449172019958)]"
300057,Your extremely talented but something about this gives me anxiety,"[('admiration', 0.9504849910736084), ('fear', 0.7024161219596863), ('nervousness', 0.5074293613433838)]"
300057,I thought this was the skull of a horribly disfigured person,"[('fear', 0.9694883227348328)]"
300057,Oh hey. It's my brain on drugs,"[('neutral', 0.9370336532592773)]"
300057,You have to crack a few skulls to make an omelette.,"[('neutral', 0.9985876083374023)]"
300057,This is your brain on drugs.,"[('neutral', 0.9983962178230286)]"
300057,I wonder what brain omelet would taste like.,"[('surprise', 0.9676194190979004)]"
300057,"The fragility of life, with a side of toast please.","[('neutral', 0.9970786571502686)]"
300057,This is really really good.,"[('admiration', 0.9938679337501526)]"
300057,"You should submit to to the ""Brain on Drugs"" campaign. that would be perfect for them.","[('neutral', 0.9938056468963623)]"
300057,This is your brain on drugs,"[('neutral', 0.9982773065567017)]"
300057,This is your brain on drugs,"[('neutral', 0.9982773065567017)]"
300057,This is your brain on drugs,"[('neutral', 0.9982773065567017)]"
300057,This is your drug on brains.,"[('neutral', 0.9986292123794556)]"
300057,Can’t wait to have some scrambled brains,"[('excitement', 0.8148097991943359)]"
300057,As if the cerebral fluid congealed. Hypnotic. Thought provoking. As art should be.,"[('neutral', 0.9988850951194763)]"
300057,"Looking for a 3d artist for a NFT project, DM me.","[('neutral', 0.9990768432617188)]"
300058,"Link to  comment with album.  The house windows are made of candy glass, police lights are Jolly Ranchers, gutters are cinnamon. The blood spatter leading into the murder shed is delicious red jelly bean shavings.","[('neutral', 0.8986650705337524)]"
300058,~Thought it was fargo inspired~,"[('neutral', 0.9960022568702698)]"
300058,"Some people just havr the coolest ideas, this looks awesome, kudos","[('admiration', 0.9977096319198608)]"
300058,"Awesome, but morbid, but awesome, yet morbid, still awesome","[('admiration', 0.9965981841087341)]"
300058,Getting real Fargo vibes. Beautiful,"[('admiration', 0.9955013394355774)]"
300058,Is there a sub for snacks that don’t look like they would be snacks? Like a reverse ?,"[('confusion', 0.4689333438873291), ('curiosity', 0.6856558918952942), ('neutral', 0.5653712749481201)]"
300058,"Is this inspired by stranger things, reminds me of the first episode where will goes missing","[('realization', 0.38471174240112305), ('neutral', 0.8147916197776794)]"
300058,Looks like a scene from hateful eight,"[('neutral', 0.8415197730064392)]"
300058,"Other than the jeep, I don't see why people are saying Fargo. That house and shed are straight out of Evil Dead 2.","[('confusion', 0.8945102691650391), ('neutral', 0.7939416170120239)]"
300058,I would step gingerly around that,"[('neutral', 0.9987854361534119)]"
300058,"For a second there, I thought this was an addition of 'Nutshell Studies of Unexplained Death.' But as a gingerbread house, that's an amazing creation! Love the blood spatters especially!","[('admiration', 0.999319314956665), ('love', 0.3431554138660431)]"
300058,This reminds me of erased,"[('neutral', 0.9863663911819458)]"
300058,This is baller. Absolutely love it,"[('love', 0.9933977127075195)]"
300058,This gives off mad Hereditary vibes. Great movie with distinct design ideas through miniatures.,"[('admiration', 0.9963105320930481)]"
300058,This is incredibly eerie.and I assume delicious.,"[('admiration', 0.7580415606498718), ('approval', 0.8088601231575012)]"
300058,It would be a crime to eat it.,"[('neutral', 0.9950254559516907)]"
300058,This is BADASS! I've never seen anything like it.,"[('surprise', 0.9003530144691467), ('neutral', 0.41259151697158813)]"
300058,"Your food tells a good story, OP. Thanks for sharing your brilliant work.","[('admiration', 0.9352954626083374), ('gratitude', 0.9952888488769531)]"
300058,New season of Fargo looks great.,"[('admiration', 0.9943990111351013)]"
300058,ah creepy soo good but creepy! you're creepin me out man you did too good a job- your house legit looks like a spooky place where a crime would take place- like I could see this being the beginning of a gingerbread action film . Very clever ,"[('admiration', 0.9924240112304688), ('disgust', 0.6149427890777588)]"
300058,Edible silent hill. I love it.,"[('love', 0.993429958820343)]"
300058,Awesome! This gave me an indigo prophecy vibe.,"[('admiration', 0.9787222743034363)]"
300058,I’d watch this as a stop-motion movie.,"[('neutral', 0.9914923310279846)]"
300058,This is fantastic! If there were a little gingerbread woodchipper this could be the set from Fargo.,"[('admiration', 0.9956182241439819)]"
300058,Exceptionally well done. I love how subtle you kept it.,"[('admiration', 0.9976546764373779)]"
300058,amazing work. kinda reminds me of fargo,"[('admiration', 0.9957417249679565)]"
300058,Murder has never looked so tasty.,"[('neutral', 0.9983384609222412)]"
300058,"That's amazing, and instantly recognizable! Kudos to you, that sort of thing takes skill and a lot of planning and patience!","[('admiration', 0.9975268244743347)]"
300058,Reminds me of Dead Snow with the little side cabin,"[('neutral', 0.9974678754806519)]"
300058,"Looks like the Byers house, with Hopper parked outside.","[('neutral', 0.9989301562309265)]"
300058,WOW this is my favorite piece of artwork I had seen in the past few months u should try doing scenes like this with clay bruh,"[('admiration', 0.9928754568099976)]"
300058,this is amazing! love the creativity.,"[('admiration', 0.9828906655311584)]"
300058,"I saw this exact post wit a different title claiming to be theirs and that it was stranger things inspired, kinda sceptical about its original poster","[('neutral', 0.9895280003547668)]"
300058,I'm getting evil dead vibes. Love it!,"[('love', 0.9945717453956604)]"
300058,"Stranger things vibes. can,. CAN SOMEBODY GIVE HIM A GALLERY ?!?","[('surprise', 0.9611279964447021)]"
300058,Reminds me of hateful 8. Minus the truck lol.,"[('amusement', 0.9946863651275635)]"
300058,The vibe of a fargo episode i swear,"[('neutral', 0.9942150712013245)]"
300058,This is magnificent. And edible only the best art falls under these 2 categories,"[('admiration', 0.9951632022857666)]"
300058,I can't even explain how much I love this!,"[('love', 0.9953497052192688)]"
300058,The atmosphere you created is fantastic! And out of gingerbread!,"[('admiration', 0.992324709892273)]"
300058,Gives me Hinterkaifeck vibes,"[('neutral', 0.9990216493606567)]"
300058,"No Gingerbread for Old Men. I just want you to know, as amazing as this is, I'd still eat it.","[('admiration', 0.33744969964027405)]"
300058,"I prefer to think mom or dad were in the outbuilding assembling a surprise IKEA bookcase and got stabbed when they were hitting the supports in frustration because the directions were confusing them. Luckily, they could still limp and crawl to the main house where they collapsed and were found, still alive, the next morning near the Christmas tree. Gently pushed to the side, they watched as the kids unwrapped their presents, and slowly bled out to the sound of laughter and joy and calls to come to breakfast.","[('surprise', 0.9526282548904419)]"
300058,That’s a lot of wasted cocaine,"[('neutral', 0.9985511898994446)]"
300058,Looks like the Byers residence,"[('neutral', 0.998684823513031)]"
300058,Nothing says Christmas to me like a gingerbread crime scene.,"[('neutral', 0.9666587114334106)]"
300058,Heard about this case on My Favorite Murder. Tragic. An entire family shot while sleeping peacefully in bread.,"[('admiration', 0.8977962732315063)]"
300058,I just. I love this. I am now rethinking every stupid gingerbread house I've ever made. my God why haven't I thought outside the box!,"[('love', 0.9901672601699829)]"
300058,This reminds me of a scene from Fargo.,"[('realization', 0.8799182176589966), ('neutral', 0.48352932929992676)]"
300058,I thought it looked like the car from Stranger Things. Such a good job!,"[('admiration', 0.9953511953353882)]"
300058,Very realistic! Amazing details. I love the snowy theme.,"[('admiration', 0.9988111257553101)]"
300058,Cause of death Diabetes. Awesome job!,"[('admiration', 0.9865859746932983)]"
300058,This looks like it could make for a cool-novelty-indie-game-setting. Also think you could gone with a bit more blood!,"[('approval', 0.4539041519165039), ('optimism', 0.5294668078422546), ('neutral', 0.8771780133247375)]"
300058,"So what exactly happened here? Whats the backstory, op?","[('curiosity', 0.9975624084472656)]"
300058,Looks like a scène from stranger things.  Really awesome!,"[('admiration', 0.9951318502426147)]"
300058,Reminded me of the video game the long dark,"[('realization', 0.3642553389072418), ('neutral', 0.9904708862304688)]"
300058,There was a serial killer in csi Las Vegas that was doing same thing,"[('neutral', 0.9985941052436829)]"
300058,Better call CSI Gingertown,"[('neutral', 0.9958833456039429)]"
300058,This reminds me of a black mirror episode,"[('neutral', 0.9966636300086975)]"
300058,It would be hilarious if the artist just creatively constructed there own murder scene,"[('amusement', 0.978884220123291)]"
300058,"Groovy, Ash would be proud","[('admiration', 0.9233254194259644), ('neutral', 0.4994546175003052)]"
300058,Where is woodchipper with Leg?,"[('curiosity', 0.989970862865448)]"
300058,im getting stranger things vibes.,"[('neutral', 0.9989519119262695)]"
300058,"Goin crazy out there at the lake, yanno.","[('joy', 0.9706889986991882)]"
300058,"OMG, I love everything about this.","[('love', 0.9278952479362488), ('surprise', 0.5268726348876953)]"
300058,"The first thing that popped into my head was ""we interior this program to bring you, Courage the Cowardly dog"".","[('neutral', 0.9990684390068054)]"
