0,1,2
300121,More please! Those are so awesome. I like the can opener spaceship,"[('admiration', 0.9686588644981384)]"
300121,ok so i am not the only one to see space ships everywhere.,"[('realization', 0.8959320187568665)]"
300121,"Love all of these! Fantastically creative and fantastic artist! Wnvious to say the least, bravo!","[('admiration', 0.9984404444694519), ('love', 0.8002922534942627)]"
300121,Or this binderclip  - LAT from starwars,"[('neutral', 0.998548686504364)]"
300121,What utensil is that in the middle bottom image?,"[('curiosity', 0.979663074016571)]"
300121,The Peeler is probably the most practical,"[('admiration', 0.3442886471748352), ('approval', 0.9604124426841736)]"
300121,Reminds me of the game Homeworld,"[('neutral', 0.9886437058448792)]"
300121,The KSP player in me just really wants a strut between the two engines on the tongs.,"[('desire', 0.9725636839866638), ('neutral', 0.34033167362213135)]"
300121,This! I can remember using the tv remote as a spaceship ' Good times,"[('joy', 0.9668652415275574)]"
300121, might like this.,"[('neutral', 0.9950909614562988)]"
300121,The one top left looks like a pod racer from Episode 1,"[('neutral', 0.999083399772644)]"
300121,Hardware Wars,"[('neutral', 0.99860018491745)]"
300121,"The reason these work so well is because they're composed of clear, readable, distinctive shapes. So many sci-fi artists these days seem to think that the way to design a cool-looking spaceship is to either make it a flying brick, or a lump of messy, unfocused detail. This despite so much of classic sci-fi being built around spaceships with extremely clear and memorable shapes.","[('admiration', 0.9973706007003784)]"
300121,Those vegetable steamer baskets were always my favorite kitchen spaceships.,"[('admiration', 0.9969156980514526)]"
300121,"Dude these are awesome. I mean I know we all have picked household items as a kid and imagined a plane or ship etc, but this is like next level. I could look at these all day.","[('admiration', 0.9957558512687683)]"
300121,"When I was a kid, I would take that little white piece of plastic with the three prongs that always came in the middle of the Dominos pizas that my parents would order and fly it through the air as if it were a space ship","[('neutral', 0.9985373020172119)]"
300121,Hey OP if you'd like you can crosspost these to the sub   the people there would appreciate the submission.,"[('admiration', 0.8159300684928894), ('gratitude', 0.5634506344795227)]"
300121,I swear one of the Destiny 2 space ships is just a USB drive,"[('amusement', 0.31039732694625854)]"
300121,These feel very Star Wars-ish to me. Love them!,"[('love', 0.9928022027015686)]"
300121,This is like my childhood imagination coming to life. I really appreciate this. Great work,"[('admiration', 0.9959774613380432)]"
300121,"Wow, a p38. He must be ex-mil.","[('surprise', 0.9900013208389282)]"
300121,That where eve had its inspiration from.,"[('neutral', 0.9969105124473572)]"
300121,"I still zoom the tv remote around, tied in its constant battle against the cable remote. It's smaller and lesser armed, with only A rated antimatter torpedoes versus larger A rated quantum torpedoes, but it's more stealthy with advanced single impulse IR engines","[('neutral', 0.9962632060050964)]"
300121,"Most of these look like they would fit right in with Eve Online. Left ship looks Minmatar, top middle Gallente and the right one Amarr.","[('neutral', 0.9990052580833435)]"
300121,I see where the WipeOut spaceship designers got their inspiration from!,"[('admiration', 0.45972347259521484), ('realization', 0.9432702660560608)]"
300121,This is exactly how I seen them in my head as a kid when I'd play with them and pretend they was spa e ships and fly them around the house battling stuff.,"[('neutral', 0.9792055487632751)]"
300121,I just see pod racers for the tongs haha.,"[('amusement', 0.9610278010368347)]"
300121,But can they complete the same task on an interstellar level?,"[('confusion', 0.9078534841537476), ('curiosity', 0.7917346954345703)]"
300121,They call it the BioMimicry Biomimicry,"[('neutral', 0.9961816072463989)]"
300121,"Meanwhile, Elon Musk's ""BFR"" actually seems to be modeled on a vibrator for ""facial massage.""","[('neutral', 0.9988019466400146)]"
300121,If you flip the engines on the left one it becomes a podracer.,"[('neutral', 0.9979560375213623)]"
300121,"I wouldn’t necessarily cal a P-38 a “common kitchen utensil”., but go with it anyways. Cool art","[('approval', 0.8684003949165344), ('neutral', 0.374347060918808)]"
300121,"I thought I was the only one. I literally see spaceships EVERYWHERE. TV remotes, large space freighters. Console Controllers, fast and nimble fighters. Pens most of the time look like personal speeders.","[('annoyance', 0.34362825751304626)]"
300121,I like to think the artist was inspired to create these after watching a kid use kitchen utensils as spaceships.,"[('admiration', 0.46414804458618164), ('love', 0.9512597322463989), ('realization', 0.6267608404159546)]"
300121,I thought this was / for a moment.,"[('neutral', 0.9987332224845886)]"
300121,"I love this. When I was a kid I would always imagine the Cable TV remote as this giant super carrier and it would making banking turns and slowly ""land"" on the coffee table.","[('love', 0.995402455329895)]"
300121,I want to see him do a classic egg beater. Those things always looked like twin jets to me.,"[('desire', 0.9712218046188354)]"
300121,I've always wanted to do this. Great.,"[('admiration', 0.9932505488395691)]"
300121,"I used to take common household items with distinct geometric shapes as vessels when I was little, since I didn't have that many toys and I loved miniature vehicles. This idea really reminded me of the past.","[('admiration', 0.32859161496162415), ('love', 0.9940746426582336)]"
300121,More creative than any design ive seen in EliteDangerous or Star Citizen,"[('admiration', 0.3815534710884094), ('disapproval', 0.5582939386367798), ('neutral', 0.6213936805725098)]"
300121,Still better than No Man's Sky ships,"[('admiration', 0.9972355961799622)]"
300121,I find the last one very apealing,"[('admiration', 0.9937499165534973)]"
300121,That tongs one is actually pretty good and practical in universe.,"[('admiration', 0.9967083930969238)]"
300121,Every pen and pencil was a grand Capital ship when I was young. Many a mock space battle played out at my desk when I was supposed to be paying attention.,"[('neutral', 0.9987008571624756)]"
300121,They look fantastic! Would love to see more!,"[('admiration', 0.3572119474411011), ('excitement', 0.9382628202438354), ('love', 0.8008798956871033)]"
300121,"Coolest thing I've seen all day, and I just watched this.","[('admiration', 0.7540210485458374), ('excitement', 0.38189709186553955)]"
300121,". well I guess where I'm going to look for when making my game. Honey, I'm going to work from the kitchen now.","[('neutral', 0.9908841252326965)]"
300121,I am speechless. Fantastic designs!,"[('admiration', 0.978186309337616)]"
300121,But what about the killer kitchen utensils?,"[('curiosity', 0.9968363046646118)]"
300121,These are cool. I take it you've played homeworld 2,"[('admiration', 0.9794648289680481), ('approval', 0.4056006371974945)]"
300121,Awesome! Now an automatic version using machine learning!,"[('admiration', 0.974947452545166)]"
300121,"This is awesome - so happy someone did this. I thought I wa the only once who picked up my remote controls while sitting at the TV, and pretended they were space ships. . in my 30s.","[('admiration', 0.9910280108451843), ('joy', 0.8357340693473816)]"
300121,I'd love to see more of these.,"[('love', 0.9943574070930481)]"
300121,I really love all of these,"[('love', 0.9843212366104126)]"
300121,This is really awesome. Kudos!,"[('admiration', 0.9924336671829224)]"
300121,"These are awesome, man! Reminds of me the artists for Star Wars & how they used to do the same thing hundreds of times, repeatedly, to build a grand arsenal of random ships/objects.","[('admiration', 0.9967393279075623)]"
300121,"I got it from one an interviews with John Michael Godier I think, but almost all our science fiction is basically fantasy, with not much science. Of course i don't mean that means it is bad, or all has the same quality, or that it doesn't inspire people to go into science. For instance with star trek the science is .not very solid. but the attitudes towards it are frequently expressed.","[('realization', 0.739221453666687), ('neutral', 0.8974903225898743)]"
300121,I swear I’ve seen these before. Are they really 2017?,"[('confusion', 0.6094597578048706), ('curiosity', 0.9801689982414246)]"
300121,Never knew how much i needed these do more! do more!,"[('neutral', 0.8137553930282593)]"
300121,This is the greatest thing I’ve seen in a long time,"[('admiration', 0.9928131699562073)]"
300121,This is basically star wars,"[('neutral', 0.998324453830719)]"
300121,It’s crazy the imagination some people have.,"[('amusement', 0.7353063821792603), ('excitement', 0.5199378132820129)]"
300121,not usually a fan of this sub even though i like to draw but these are awesome!,"[('admiration', 0.9977335929870605)]"
300121,I have that peeler. It's amazing. Might as well be a spaceship.,"[('admiration', 0.9880819320678711)]"
300121,"This is fantastic! Really takes me back to the imagination of childhood, when anything could be transformed into something fantastical. But usually a spaceship.","[('admiration', 0.9959685802459717)]"
300121,"The Kitchen tongs ship looks like something out of Titan A.E. The black can opener ship looks like something out of Star Wars, like a heavy bomber of some sort. The potatoe peeler ship also looks like something from Star Wars. Like a medium sized intra system transport cruiser. But with space for limited cargo transport. Like a Boeing 737-80 narrow body. Not sure what that last one is. Looks like a Star Wars kitbash some outer rim planet can't afford a full fledged ship so they had to put one together from parts of other ships. An ugly  All in all every one of these designs are fantastic. When I was a kid I used to look at the tv remotes the same way. Lots of those things look like they could be starships as well.","[('confusion', 0.9525200724601746), ('neutral', 0.5046194791793823)]"
300121,These concept arts make me think about all those torturing equipment based enemy designs in a game I'm recently playing.,"[('neutral', 0.9977310299873352)]"
300121,This is every child dream,"[('neutral', 0.9982460737228394)]"
300121,Oh man I would pick up everything and imaging it was a space ship when I was younger and this is like exactly what I imagined,"[('realization', 0.7849887013435364), ('neutral', 0.7577468752861023)]"
300121,I no joke do this all the time. It's so fun. My favorite object to use would be Piza Cutters.,"[('amusement', 0.8158648610115051), ('joy', 0.8283213376998901)]"
300121,anybody happen to know what program these drawings are made on?,"[('curiosity', 0.9840661287307739)]"
300121,"When I was a kid and didn’t have any nice toys to play, I would play with utensils similar to this and pretend they were spaceships and the like.","[('joy', 0.47733962535858154)]"
300121,I remember watching this on the last day of school once or twice.,"[('neutral', 0.9985835552215576)]"
300121,The vegetable peeler one is just so pleasing to look at!,"[('annoyance', 0.635257363319397)]"
300121,Do an electric turkey carver,"[('neutral', 0.998760461807251)]"
300121,I want to fly the peeler freighter!,"[('desire', 0.9830656051635742)]"
300121,This is awesome. I'd love to see more like this!,"[('admiration', 0.9739113450050354), ('love', 0.9359451532363892)]"
300121,"Oh cool! I know this guy. Great dude, talented artist.","[('admiration', 0.9958730340003967)]"
300121,Glad I'm not the only one who constantly imagines ordinary objects as spaceships,"[('joy', 0.6397334337234497)]"
300121,Those look like ships from the homeworld universe. What a great old game,"[('admiration', 0.9845277667045593)]"
300121,The U.S.S. Enterprise was allegedly inspired by an electric coil for a stove.,"[('neutral', 0.9991644620895386)]"
300121,"That’s awesome, which software did you make these in? I’m good at drawing but pen and pencil type. I’m trying to learn which software is great for Macs and iPad Pro.","[('admiration', 0.98225337266922), ('curiosity', 0.8962550163269043)]"
300121,These remind me of the old game Homeworld,"[('realization', 0.3902742564678192), ('neutral', 0.9845061898231506)]"
300121,"Which Software and Hardware are required for such art , for a guy with good Pencil Drawing Skills.","[('admiration', 0.7547996640205383), ('neutral', 0.931812047958374)]"
300121,Reminds me of the artwork for 'Homeworld'. That manual was gold. They don't make 'em like that any more.,"[('neutral', 0.9958823919296265)]"
300121,ITT no one who knows what the Enterprise was modeled. =O,"[('neutral', 0.9976237416267395)]"
300121,"This is why i couldn't stop playing with ""toys"" until i was about 14!","[('realization', 0.6546671986579895), ('neutral', 0.6289613246917725)]"
300121,I would definitely partake in intergalactic travel in that vegetable peeler spacecraft !,"[('approval', 0.984820544719696)]"
300121,Where is the flying saucer,"[('curiosity', 0.8287188410758972), ('neutral', 0.4526154398918152)]"
300121,I wish I could draw. I would draw stuff like this all day. I spent all my creative talent points on computers and now I can't even draw a straight line.,"[('desire', 0.9685801267623901)]"
300121,"Nobody can say that they didn't pretend that utensils were spaceships when they were kids, I love it.","[('love', 0.9710139632225037)]"
300121,Next four Star Citizen concept sales confirmed.,"[('neutral', 0.9486348032951355)]"
300121,Was the Enterprise inspired by an overhead view of a bathroom sink?,"[('confusion', 0.6291732788085938), ('curiosity', 0.9854404330253601)]"
300121,I always imagined this kind of stuff,"[('neutral', 0.9658898115158081)]"
300121,"This, I want more of this. I want all of this. I need more of this. I need all of this.","[('desire', 0.9846982359886169)]"
300121,A dream come true. Thanks so much!,"[('gratitude', 0.9968543648719788)]"
300121,A blessed gift for every five year old.,"[('gratitude', 0.32817110419273376)]"
300121,I would have loved these when I was a kid! I used to pretend my TV and VCR remote controls were massive spaceships.,"[('love', 0.9963147044181824)]"
300121,See the world woth the eyes of a child,"[('neutral', 0.9981228709220886)]"
300121,That's how I would see them as a kid,"[('realization', 0.8259716033935547), ('neutral', 0.7915233969688416)]"
300121,Introducinng. TONGS!,"[('neutral', 0.9976440072059631)]"
300121,"Might have already been said, but upside down TV remotes look like great spaceships with the battery compartment as a cargo bay . or is that just me?","[('curiosity', 0.9498584270477295), ('surprise', 0.40758270025253296)]"
300121,You'll laugh! You'll cry! You'll kiss three bucks goodbye!,"[('joy', 0.9446981549263)]"
300121,Dude I do this all time but with sketches. None of them are as good as this I also like thinking up random names for fictional factions.,"[('disapproval', 0.5984319448471069), ('neutral', 0.9277219176292419)]"
300121,"When I was in 6th grade, I went through a Star Wars phase and when I was at school, I would pretend office supplies were ships and stuff like scissors was a flying aircraft carrier  where the engines were the finger holes and the runways were the blades, a stapler was a railgun base, and the the clips on 3-ring binders were/was like an underground base with closing doors","[('neutral', 0.99875807762146)]"
300121,"Welp, now I can't look at my kitchen items the same way anymore.","[('annoyance', 0.5911199450492859), ('neutral', 0.6342598795890808)]"
300121,"My favorite household spaceship is the nail clipper. It has a fold-out rotating solar sail, it can lock itself into attack position, it's called a Clipper. We've had many adventures over the years while I'm sitting in the bathroom.","[('love', 0.42343953251838684)]"
300121,This satisfies the little boy inside me. EDIT whoops,"[('disappointment', 0.5292500257492065)]"
300121,When i was a kid a British Sci-Fi show called Blake 7 use to make space ships out of household items such as Hairdryers. ,"[('neutral', 0.9951208233833313)]"
300121,I'm assuming these will be showing up in The Last Jedi?,"[('curiosity', 0.9067670702934265), ('optimism', 0.8394960761070251)]"
300121,I used to do this as a kid! Minus the artwork.,"[('neutral', 0.9955456256866455)]"
300121,I havent been more inspired to draw all year than I am rn.,"[('disapproval', 0.4789963662624359)]"
300121,I am so relieved that I'm not the only one who sees spaceships in my kitchen utensils.,"[('relief', 0.9131250977516174)]"
300121,This is what I imagine when I look at things like VGA ports and power strips and stuff. Very cool!,"[('admiration', 0.9972422122955322)]"
300121,2016 actually,"[('neutral', 0.998230516910553)]"
300121,"Today, I feel a lot less alone. I really thought I was the only one who had this kind of inspiration . Still, thank you.","[('gratitude', 0.9965937733650208)]"
300121,"Reminds me of kids imagination, using common things as toys","[('neutral', 0.9893708229064941)]"
300121,NOW THATS WHAT I CALL PODRACING,"[('neutral', 0.9638578295707703)]"
300121,"""Sir! Rolling pin class heavy cruiser to port has engaged a fleet of denubian Mellon baller transports and a type I garlic press fuel scow, shall we engage?"" ""Very well, lock salad tongs in attack position and move to energy range!""","[('neutral', 0.9698659181594849)]"
300121,I love me some clever spaceships!,"[('love', 0.9922326803207397)]"
300121,Oh man. I remember industrial design classes doing just this. I was terrible at it.,"[('fear', 0.6739032864570618)]"
300121,This is wonderful. Takes me back to being a kid and playing with shampoo bottles and other random boring objects and just imagining them as something else and exciting. Cool to see someone able to keep that into adulthood,"[('admiration', 0.9965429902076721)]"
300121,Quikly to Kerbal Space Program,"[('neutral', 0.9989528656005859)]"
300121,This is the coolest art exercise ever! Please do more!,"[('admiration', 0.9939939379692078)]"
300121,Thank god I'm not the only one who see's spaceships in things.,"[('gratitude', 0.7394622564315796)]"
300121,Now build them in kerbal space program.,"[('neutral', 0.9978208541870117)]"
300121,How did you not pick a nail clipper? I still pretend my nail clippers are a space truck.,"[('curiosity', 0.8891345858573914)]"
300121,Haha I use to do the same thing,"[('amusement', 0.9819566011428833)]"
300121,Haha one of those is a FRED,"[('amusement', 0.9645572900772095)]"
300121,"I would't exactly call a P-38 can opener a ""common"" kitchen item. p","[('neutral', 0.8900490999221802)]"
300121,The U Wing from star wars looks a lot like a corkscrew,"[('neutral', 0.9989056587219238)]"
300121,It seems this artist has a thing for symmetry. I like that.,"[('admiration', 0.9295814633369446), ('love', 0.8462626934051514)]"
300121,Reminds me of when I use to pretend my mechanical pencil was the spaceship from Outlaw Star.,"[('neutral', 0.9982165694236755)]"
300121,"That P38 is a military / survival tool, not a kitchen utensils.","[('neutral', 0.9964973330497742)]"
300121,The top left one made me think of the racers in star wars episode one,"[('neutral', 0.9944770932197571)]"
300121,These are all soo great! wish I still had my childhood imagination like you clearly do,"[('admiration', 0.9923906922340393)]"
300121,Hardware Wars.,"[('neutral', 0.9979935884475708)]"
300121,Man I wish I could do art like that but looks awesome.,"[('admiration', 0.9859102964401245), ('desire', 0.6410062909126282)]"
300121,I literally thought I was the only one who did this.,"[('realization', 0.5057181715965271), ('neutral', 0.932070255279541)]"
300121,"Hey, I basically did the same in mind everytime I went to the toilet, picked whatever was close and imagined it as a spaceship, then they invented the smartphones and it was over, lol.","[('amusement', 0.9888268709182739)]"
300121,The one an the right is appealing.,"[('admiration', 0.6144084930419922), ('approval', 0.884749174118042)]"
300121,I wonder what can a chopstick become? A ship that splits into 2?,"[('curiosity', 0.9502025842666626), ('surprise', 0.7857809662818909)]"
300122,"That's dark, but also very well done. Be well.","[('admiration', 0.8942498564720154), ('caring', 0.6335147619247437), ('optimism', 0.6442381143569946)]"
300122,"Very striking. I lost someone this way, bullet through the head by their own hand. And we did indeed stare fixated at the act, figuratively, for a very long time before we were ready to turn to the actual person lost to us.  The act is so intense and overwhelming. Totally shattering. And you fixate hard on the act, initially. I’m glad to say that now after many years the person is much more centered in my mind than his final act. This speaks to a lot of that process, to me. I appreciate this piece.","[('admiration', 0.9981997013092041)]"
300122,"I lost my dad to suicide via shotgun. One of the hardest things for me to think about is the image of the aftermath. This piece is very well done. Hope you stay well, also.","[('optimism', 0.9667381048202515)]"
300122,Obligatory - 98 if you're in the US and need someone to talk to.,"[('neutral', 0.9532893896102905)]"
300122,I love it! But why looks the gun so cursed lol,"[('amusement', 0.9371501207351685), ('love', 0.9695796370506287)]"
300122,Do you wanna talk about something?,"[('curiosity', 0.9197993874549866), ('neutral', 0.31402072310447693)]"
300122,"Wow, this is powerful art","[('admiration', 0.9962685108184814)]"
300122,"Reminds me of Hey Man Nice Shot by Filter, which is about something similar to this.","[('admiration', 0.9810158014297485)]"
300122,I know it’s cliche. This is hauntingly beautiful.,"[('admiration', 0.9974439144134521)]"
300122,Have you seen “The Menu”?  You would enjoy it.,"[('curiosity', 0.7537643909454346), ('joy', 0.967652440071106)]"
300122,"Bruh, in all seriousness would you like a hug? Idk where you are but I’ll find you and we can hug it out.","[('caring', 0.6219409108161926), ('curiosity', 0.9551229476928711)]"
300122,How many hours on  did it take to get the shotgun suicide head explosion correct?,"[('curiosity', 0.512143611907959), ('neutral', 0.9148949980735779)]"
300122,He put his everything into that painting .,"[('neutral', 0.9974894523620605)]"
300122,Holy moly. Dark but well well done!,"[('admiration', 0.9968480467796326)]"
300122,The author is clearly the child in the white shirt and brown pants. Wonderful,"[('admiration', 0.9978087544441223)]"
300122,"Please get some help. I am very unsettled that this is a ""self portrait "" and labeled with a ""spoiler "" tag.  I just recently lost a friend to suicide, I would have much rather listened to his problems, rather than read his eulogy.","[('caring', 0.6248162388801575), ('sadness', 0.883378267288208)]"
300122,"Great work u/stinkygorillanuts, it really captures a vibe I've been feeling lately.  Looks like you've been feeling it too. Hang in there.","[('admiration', 0.9965130686759949)]"
300122,Everyone ITT assuming OP is suicidal and not just metal af,"[('neutral', 0.9960793852806091)]"
300122,"When I was really depressed I tried writing some poetry or just lose thoughts. This reminded me of the one passage that I actually felt like it conveyed my emotions. From memory and roughly translated it goes something like ""I'll paint a self portrait in the style of Jackson Pollock, but with myself instead of paint"". I'm thankful that I managed to get better, even if it's been a long journey and even more to go.","[('gratitude', 0.8946132063865662)]"
