0,1,2
300059,"Not only you're creative to think of it, you had an amazing execution too!","[('admiration', 0.9962190985679626)]"
300059,I need to make a DnD homebrew of this,"[('desire', 0.8661307692527771), ('neutral', 0.6378882527351379)]"
300059,Eye contact turns you into duck corn,"[('neutral', 0.9988911747932434)]"
300059,This is brilliant and I am so happy I saw it.,"[('admiration', 0.9961101412773132), ('joy', 0.7704148888587952)]"
300059,Is this a creation of Honk Honk the Destroyer?,"[('curiosity', 0.9725740551948547)]"
300059,You are a brilliant genius and i love this so much,"[('admiration', 0.9973083734512329), ('love', 0.5757765173912048)]"
300059,Didn’t Teal Sather do this like years ago?,"[('neutral', 0.9955540299415588)]"
300059,"This is ten times more horrifying than a hair made of snakes. You can count on a snake to be a snake but, a bird. you have no idea what to expect.","[('disapproval', 0.6092474460601807), ('fear', 0.4978759288787842)]"
300059,"When you look at it, it will replace your inner peace with war!","[('neutral', 0.9987439513206482)]"
300059,Megusta,"[('neutral', 0.9989218711853027)]"
300059,Untitled Megoosa Game pls,"[('neutral', 0.9980302453041077)]"
300059,"Somehow, this is more terrifying than snakes. It feels like she wouldn't turn you to stone, so you have to keep looking at her until she  chooses to let you go.","[('fear', 0.9887933135032654)]"
300059,ducks peace was never an option,"[('neutral', 0.926382839679718)]"
300059,Wonder what her pubes look like,"[('surprise', 0.9767565727233887)]"
300059,"That would actually be pretty scary, geese are mean!","[('fear', 0.9882149696350098)]"
300059,"Ok, Please draw Memoosa next","[('neutral', 0.9988877177238464)]"
300059,If snakes turn you to stone what would geese turn you into?,"[('confusion', 0.9564613699913025), ('curiosity', 0.5099711418151855)]"
300059,Geese are much more terrifying than snakes imo… lol love it!,"[('amusement', 0.6826865673065186), ('love', 0.7489482164382935)]"
300059,As a Canadian shes actually scary now,"[('fear', 0.9896736145019531)]"
300059,I now desire to witness every variation of Medusa possible.,"[('desire', 0.9625702500343323), ('neutral', 0.49873197078704834)]"
300059,This reminds me of a children’s book I read as a kid that gave me nightmares. I’m reminded of it every couple of years but can’t ever recall the title.  It was about a princess  with a bunch of older brothers that turned into geese. Or maybe the princess turned into a goose. Child me remembers the themes being pretty dark for a kids book. Maybe it was just the way it was illustrated that makes me think that. Lots of dark colors.,"[('realization', 0.7957984209060669)]"
300059,Unfortunate men who look at her turn to scone.,"[('neutral', 0.9990233182907104)]"
300059,A weapon to surpass Metal Gear,"[('neutral', 0.999134361743927)]"
300059,This is amazing. It makes me wonder what a Canadian Goose Megoosa would look like.,"[('admiration', 0.9592248201370239), ('surprise', 0.35776111483573914)]"
300059,Just as terrifying if not more than actual medusa,"[('fear', 0.9898346066474915)]"
300059,Your shadowing is exceptional,"[('admiration', 0.9967132806777954)]"
300059,Woow this is amazing I love how you called megoosa,"[('admiration', 0.9640218615531921), ('love', 0.8134680986404419)]"
300059,Amazing. You deserve to sleep well tonight,"[('admiration', 0.8570870757102966), ('approval', 0.33188003301620483), ('caring', 0.7385354042053223)]"
300059,"Can you do Mongoosa next? Any combination of mongoose, goose and / or person will suffice. Thank you.","[('curiosity', 0.9245473146438599), ('gratitude', 0.9288553595542908)]"
300059,I love this a lot. Your sense of line and flow is just lovely.,"[('admiration', 0.3077154755592346), ('love', 0.9917508959770203)]"
300059,"I am totally going to use this for an upcoming d&d campaign. She goes by Meg, wears a pink beanie and most people ignore her or are rude to her. The players go up to her thinking she can't be that bad. She takes them back to her hut outside the city limits, that's when the players see her hat start to move, once they are inside she let's her ""hair"" down, CONSTITUTION SAVING THROW TO NOT GO DEAF AT THE CACOPHONY OF GEESE SHRIEKS","[('neutral', 0.9959787130355835)]"
300059,Is it rude to guess they can't draw mouths lol Awesome pic,"[('admiration', 0.9848403334617615), ('annoyance', 0.44613611698150635)]"
300059,Over on  someone made a megoosa hat. It’s awesome,"[('admiration', 0.9578468203544617), ('excitement', 0.3080853223800659)]"
300059,You are truly one of a kind,"[('admiration', 0.9967948794364929)]"
300059,Pfft. This is hilarious. Thank you for sharing.,"[('amusement', 0.7636881470680237), ('gratitude', 0.986638069152832)]"
300059,Amazon commercials are getting weird,"[('annoyance', 0.5501343607902527), ('disgust', 0.7751144766807556)]"
300059,this pic made my day. keep it up!,"[('admiration', 0.9778720736503601), ('joy', 0.3922934830188751)]"
300059,"i fricking love her nose and her eyes, it’s a great compliment yet somehow also contrast to the geese LOL great job OP! c","[('admiration', 0.9928963780403137), ('amusement', 0.6842209696769714), ('love', 0.6855100989341736)]"
300059,"Same idea, but a Jamaican dude, Mongoose.","[('approval', 0.5711236000061035), ('neutral', 0.9404345154762268)]"
300059,"Woop, Woop - that's the sound of the police Honk, Honk - that's the sound of some geese.","[('excitement', 0.4533785581588745), ('neutral', 0.934412956237793)]"
300059,Peace was never an option,"[('realization', 0.8106406927108765), ('neutral', 0.542586624622345)]"
300059,Thank you kindly this just became home screen on my phone. Perfect mix of serious and goofy. I love it.,"[('gratitude', 0.9972892999649048), ('love', 0.9167831540107727)]"
300059,Supremely low effort. Nice.,"[('admiration', 0.9916285276412964)]"
300059,"Wait a minute, snakes poison’s you when they bite you, goose pek you, you made Medusa weaker but at least it’s funnyer","[('amusement', 0.9893072247505188)]"
300059,Ah a new monster or possible nice for my dnd campaign! She won't turn the PCs to stone but instead they become geese over time.,"[('neutral', 0.9197044968605042)]"
300059,I kind of want to turn this into a secret boss for my next DND campaign.,"[('desire', 0.9545313119888306)]"
300059,Look her in the eyes and she turns you into bread,"[('neutral', 0.9861899018287659)]"
300059,"You'll get turned into someone who will perpetually run, but never gets away.","[('neutral', 0.9982230067253113)]"
300059,Look her in the eyes and she turns you into bread,"[('neutral', 0.9861899018287659)]"
300059,Shes on her way to a bread bakery.,"[('neutral', 0.9960122108459473)]"
300059,I can imagine untitled goose game dlc like this,"[('neutral', 0.9959698915481567)]"
300059,Haha I love this. Well done!,"[('admiration', 0.9825663566589355), ('love', 0.9368878602981567)]"
300059,Terrifying yet totally awesome,"[('admiration', 0.9886694550514221)]"
300059,God of the Freedumb Convoy.,"[('neutral', 0.9983381032943726)]"
300059,"I love it! Cartoons make geese look cute and gentle, but they are aggressive!","[('love', 0.9964271187782288)]"
300059,"I still don't understand why you flipped it, though.","[('confusion', 0.981322169303894)]"
300059,Instead of turning to stone you turn into bread,"[('neutral', 0.9987521171569824)]"
300059,A bunch of untitled geese lol,"[('amusement', 0.994850218296051)]"
300059,being megoosa is suffering,"[('neutral', 0.9943740367889404)]"
300059,"One look and you will become a large, human shaped loaf of bread","[('neutral', 0.9931595325469971)]"
300059,Thank you for this amazing creation hail the goose,"[('admiration', 0.32459381222724915), ('excitement', 0.41445136070251465), ('gratitude', 0.9864612221717834)]"
300059,A far more terrifying opponent considering how most Canadian geese are anyways well done,"[('admiration', 0.9921093583106995), ('fear', 0.5540713667869568)]"
300059,I cannot get over how much I love this,"[('love', 0.9855990409851074)]"
300059,If it were Jamaican it would be Megoosta,"[('neutral', 0.9975895881652832)]"
300059,"If you could make a version of this with Canada geese, preferably with some with beaks open and hissing. There's a bunch of wildlife bilogists out there that would hang this in their office. And I'd be sending a copy to all my bio friends. It's absolutely lovely. The play on words, the form and sinuosity. Beautifully done, and thank you so much for sharing. I love it.","[('admiration', 0.9987083673477173), ('gratitude', 0.9267961382865906), ('love', 0.5809218287467957)]"
300059,Need me some of that megussy,"[('annoyance', 0.90547114610672), ('desire', 0.47115376591682434)]"
300059,"Dear God, that is way more terrifying than Medusa. Geese are the Devil's own terror squad. Nevertheless, the artwork is beautiful.","[('admiration', 0.9966325163841248)]"
300059,Bro imagine not being able to eat toast because your hair ate it before it touched your mouth,"[('neutral', 0.9885037541389465)]"
300059,Have you been playing clusterduck,"[('curiosity', 0.9112318158149719), ('neutral', 0.5193254351615906)]"
300059,Where can I follow your art?,"[('curiosity', 0.9894691705703735)]"
300059,"Instead of turning to stone, when you stare her in the eyes you turn into bread","[('neutral', 0.9989776611328125)]"
300059,My friend said they need this as their D&D character concept,"[('neutral', 0.9984122514724731)]"
300059,"Omfg, yes. I was thinking of having the immortal goose make an appearance in my campaign, but now that spot goes to the Megoosa. Now I need to think up a stat block for her, complete with the most annoying but on theme ability I can think of to give her to her gaze. Edit OH man. it's so simple but I love it. her gaze polymorphs the target into a goose minion. Forced to obey the Megoosa, but will still drop the polymorph if the goose takes enough damage.","[('love', 0.9902167320251465)]"
300059,"Does it have a throat button? In the throat? In place of a belly button? In its belly? My, what strange evolutionary path ever led to this? Nice goose btw.","[('curiosity', 0.9853873252868652), ('surprise', 0.49667614698410034)]"
300059,This may be the best thing I've ever seen,"[('admiration', 0.9900482892990112)]"
300059,"Looks like you maybe can’t draw mouths. I would suggest referencing how a human silhouette looks in profile, should come naturally after that!","[('neutral', 0.9991793036460876)]"
300059,Honestly. Probably more terrifying,"[('fear', 0.9916073083877563)]"
300059,"This so cool, but you should make an angry version with Canadian Geese. They are the 4Loko guzling gym rat frat boys of the bird world.","[('annoyance', 0.8797924518585205)]"
300059,"I laughed, very creative and good job.","[('admiration', 0.9895811080932617), ('amusement', 0.6974091529846191)]"
300059,Nearly did a spit take with my drink seeing this. Well done!,"[('admiration', 0.9972214698791504)]"
300059,Words cannot express how much I love this,"[('love', 0.9876925349235535)]"
300059,If you made them Canadian geese it would truly be a horrifying sight,"[('fear', 0.8504886031150818)]"
300059,“Me gusta Megoosa” - my brain upon seeing this image,"[('neutral', 0.9989340901374817)]"
300059,I do not like the cobra chicken lady.,"[('disapproval', 0.9953953623771667)]"
300059,Isn't this cute nicely done,"[('confusion', 0.9313313961029053)]"
300059,A head full of cobra chicken is far more dangerous than a head full of snakes!,"[('annoyance', 0.8225861191749573)]"
300060,The cats are so cute! Big fan of your art in general. This is fantastic,"[('admiration', 0.9973195195198059)]"
