0,1,2
300231,"I can't art, I am the art.","[('neutral', 0.9966551065444946)]"
300231,Literally me trying to write anything. I spend half of the time writing just sitting there freaking out. What I find helps keep me grounded is having really short cable headphones and chill music with a big soundscape,"[('annoyance', 0.9597157835960388)]"
300231,"A very nice, related piece by Ira Glass of NPR about this effect. ""The Gap"" ","[('admiration', 0.9435558915138245), ('neutral', 0.7603453993797302)]"
300231,I feel this. I look at a blank page and think about drawing and chicken out. Cue me in a meeting/class/whatever doodling and sketching all over the margins,"[('neutral', 0.9990633130073547)]"
300231,"This truly is an excellent example of picture worth a thousand words! Self-doubt, not knowing where to start, self-critical, fear of failure, will it even be worth it after all the effort? And the ensuing frustration.  At the same time, the immense knowledge hidden inside, the skill built over the years – so much so that it is part of his existence at this point. All portrayed without even showing the face of the subject. This is not just the painter in the art - this is a lot of us everyday in our own little ways! One of the better pieces of art I’ve seen in recent times.","[('admiration', 0.9929319620132446), ('confusion', 0.344816654920578)]"
300231,I just like the name Aarti for an artist,"[('approval', 0.9955459833145142)]"
300231,"Aarti Shinde means she's a Hindu, Marathi, Indian. Marvellous drawing fellow Marathi lady","[('admiration', 0.9373033046722412), ('neutral', 0.7582328915596008)]"
300231,I can't tell if this is a really skillful painting or a sort of shallow photo.,"[('confusion', 0.9839449524879456)]"
300231,Love it. It also made me smile because it reminds me of the time I introduced my 2 year old to finger painting. More on her and the room than on the canvas.,"[('love', 0.9961789846420288)]"
300231,.IiIi can't chalk. Only thing about me is my kickass smock.,"[('annoyance', 0.7869830131530762), ('neutral', 0.5066654682159424)]"
300231,"As someone riddled with anxiety, for me this painting captures the creativity and effort I'm able to contribute to overthinking and pessimism versus towards something meaningful and productive .","[('approval', 0.9644626975059509)]"
300231,This hit me like a ton of bricks,"[('neutral', 0.9608610272407532)]"
300231,This is exactly how I feel about expressing myself through art,"[('approval', 0.9770841002464294)]"
300231,I think this is a piece that people who struggle with creativity and creation understand. This is a fantastic piece of artwork.,"[('admiration', 0.9935469031333923)]"
300231,"We don't make mistakes, we have happy little aci- dear God what have you done?","[('joy', 0.9744287729263306)]"
300231,"I've never really been a huge fan of paintings, I always feel that the historical value gets me more than the painting itself so I don't usually care much about paintings from nowdays. That being said. This moved me in such a way that I can't describe. I'm not sure how to feel but it sure touched me in some way. A good way. Thank you for this, I'll definitely check out more of this artist's work.","[('admiration', 0.6014224290847778), ('gratitude', 0.9982070922851562)]"
300231,"""Well Mr. Shinde, if you stopped dropping so much acid, you might be able to one day."" Jokes aside, the symbolic meaning is quite interesting.","[('admiration', 0.6366461515426636), ('amusement', 0.9746143221855164)]"
300231,"It's more like ""I Don't Know What To Paint"" really.","[('confusion', 0.9451146721839905)]"
300231,"On the bright side, they've got a great potential for becoming a Stormtrooper.","[('admiration', 0.4369752109050751), ('approval', 0.9620958566665649), ('optimism', 0.38033798336982727)]"
300231,Perfectly describes how I used to feel in Art class.,"[('neutral', 0.9936570525169373)]"
300231,"I like the colors, and I like the posture. This painting resonates with me, and it feels like a very genuine expression of the artists emotions. I really like this painting. But it might help if the artist took a shower and got dressed.","[('admiration', 0.8974689245223999), ('love', 0.9347552061080933)]"
300231,"Hello Aarti, we have met. Love your Tumblr  I have reblogged it too ","[('love', 0.9917759895324707)]"
300231,"I see it as a painter struggling to create art when in fact it is all around him, right in front of his eyes.  Or maybe it's just a cool painting with no underlying meaning","[('neutral', 0.9851176738739014)]"
300231,I think it's because you dropped your paint bucket.,"[('realization', 0.8164278268814087)]"
300231,"This first piece of art that I have ever said ""wow, I'd buy that for sure"" too.","[('approval', 0.9332435727119446)]"
300231,"This got me to feel and appreciate the art around me. The design, architecture and nature. I find this piece very inspiring!","[('admiration', 0.996020495891571)]"
300231,Clever and original. I like this a lot.  Well done.   G.,"[('admiration', 0.9972297549247742)]"
300231,"I thought this as an answer to the critics of abstract or impressionist painters. These critics assume that the painters have no talent for representational art. This artist has covered the canvas with seemingly a mess of colors yet has executed the human figure objectively, emotionally and beautifully.","[('admiration', 0.972942590713501)]"
300231,Hmm. Reminds me of a Rin Tezuka.,"[('realization', 0.667820394039154), ('neutral', 0.913150429725647)]"
300231,So many possible things this shows all that I relate to.,"[('neutral', 0.9960833787918091)]"
300231,"""Now you're just somebody that I used to know.""","[('approval', 0.5069233179092407), ('neutral', 0.9565281867980957)]"
300231,Heh. He makes art and his name is Aarti. Heh heh.,"[('neutral', 0.9991441965103149)]"
300231,"I really enjoy this. Thank you for sharing it with us.  The way I view it, if I may, is a bit about my life-or life in general. Often times in our minds and bodies we are full of ideas and we have a wanting to show the world what our potential is, but as time goes along, the less we're able to paint ourselves, our picture, on the canvas which is the world.  I hope that made sense. I'm not the best at conveying what my thoughts are into writing.","[('desire', 0.32204771041870117), ('gratitude', 0.998809814453125), ('joy', 0.9032137989997864), ('optimism', 0.7625397443771362)]"
300231,Seems like just a painter that I used to know,"[('realization', 0.912006676197052)]"
300231,Reminds me of somebody that I used to know.,"[('realization', 0.9300560355186462), ('neutral', 0.7355669736862183)]"
300231,"""Hey man, how's it going with the.""  Scene in the painting. Man looks up  ""I can't paint""  ""How do. but. how do you get paint all over the place except on the canvas?""  ""I'm. not a smart man""  ALSO      ""You're having artist block? Well man, don't over complicate it, it doesn't need to be a deep subject. Paint something you know, something you're familiar with. Paint the room. Paint yourself. You just need to start."" Hours later, scene in the painting  ""This doesn't help.""","[('neutral', 0.23049303889274597)]"
300231,"looks like what happens when the kids want to paint and you turn your back for a second, paint everywhere except for where it's supposed to be. lol","[('amusement', 0.995358407497406)]"
300231,Its a pineapple behind the display case Edit ,"[('neutral', 0.9987435936927795)]"
300231,Maybe if he cried he could wet the paint on his body and paint with that.,"[('neutral', 0.9990812540054321)]"
300231,I like this piece. Paint everywhere but on the canvas. Nice impressionist look.,"[('admiration', 0.9970439076423645), ('love', 0.3695749044418335)]"
300231,"Painting cha mahiti nahi, pan meaning khup chan ahe.","[('neutral', 0.9990116357803345)]"
300231,"Painting cha mahiti nahi, pan meaning khup chan ahe.","[('neutral', 0.9990116357803345)]"
300231,So many thoughts running through my head. Thank you so much for posting. I really like this piece a LOT,"[('gratitude', 0.9967451095581055), ('love', 0.5655981302261353)]"
300231,Just came here to say this is amazing!,"[('admiration', 0.8856976628303528), ('excitement', 0.5325818061828613)]"
300231,Is there a reason why the brush is not facing up? Nice piece of work here.,"[('admiration', 0.9901040196418762), ('curiosity', 0.30988335609436035)]"
300231,Where can I get a print of this!,"[('neutral', 0.7429242730140686)]"
300231,"This speaks so much to me. As a dancer, you feel like an artist when you perform but when it comes to create-you draw a blank. When you are staring at your dancers and music like it's an equation you have no idea what to do. You know you can create something but as soon as you come time to create something-it all floods away.","[('neutral', 0.9973253011703491)]"
300231,ooh.this one hits right in the soft spot,"[('neutral', 0.9984456896781921)]"
300231,"I like this. To me it represents how anxiety and worry put your energy anywhere but the place you intended it to be , and that life is a messy thing.","[('love', 0.8265575170516968), ('nervousness', 0.5778533220291138)]"
300231,Anyone wondering where that small passage on the left leads?,"[('curiosity', 0.9938965439796448)]"
300231,I like this a lot. It strikes me as someone that has built a beautiful life and worked hard to shape themselves into an interesting person but doesn't possess artistic talent which the world recognizes more than personal development or living a good life.,"[('admiration', 0.9845897555351257), ('love', 0.9082927107810974)]"
300231,"I cannot paint I keep try to find a fitting colors, or even try a color scheme created by popular artists like from riot game or blizard. In the end I ended up with a mess. But love my line art though and the gray-scale value I paint","[('disapproval', 0.4330148696899414), ('love', 0.9469350576400757)]"
300231,Aah I love this. I relate to this and it moves me on an artistic level. Seriously need a print of this painting,"[('admiration', 0.7164741158485413), ('love', 0.9511756300926208)]"
300231,can someone please turn that into a desktop wallpaper?,"[('curiosity', 0.5388783812522888), ('neutral', 0.5538777112960815)]"
300231,Love this with all my love.,"[('love', 0.9891464710235596)]"
300231,"This speaks to me.what's in my mind, I find it hard to put it on canvas.","[('neutral', 0.9988269209861755)]"
300231,That's why Gotye hasn't released a song.,"[('neutral', 0.9957219362258911)]"
300231,Same But I don't fail to the point of getting paint on everything but the canvas,"[('neutral', 0.998272180557251)]"
300231,"Brilliant, loved it.so perfect","[('admiration', 0.9950887560844421), ('love', 0.718768298625946)]"
300231,he might've missed a spot,"[('neutral', 0.903265655040741)]"
300231,I can't paint  I can't draw  Only thing about me  Is the way that I scrawl,"[('neutral', 0.9953168630599976)]"
300231,This hits home as someone who hasn't painted anything in years.,"[('neutral', 0.997731626033783)]"
300231,I smell a new Gotye music video,"[('neutral', 0.9802025556564331)]"
300231,"This so reminds me of a book we read to my son when he was younger, I Ain't Gunna Paint No More. They parallel each other nicely as the story is about the creative freedom of a child. This seems to be him all grown up and struggling with the high expectations for the blank page.","[('admiration', 0.9922283291816711)]"
300231,"wow he really does suck, couldnt even manage to land a single drop on the canvas","[('surprise', 0.9754341840744019)]"
300231,"This was powerful, never thought a painting would give me goosebumps. hits home with this one.","[('admiration', 0.9527912735939026)]"
300231,Are there prints for sale?,"[('curiosity', 0.9675430655479431)]"
300231,"I feel like a lot is being said about the intended message, so I'm just going to say how I relate to it  Sometimes I feel like the messiest painter ever. I feel like I get paint on everything. Myself, my clothes, the floor, the walls. Sometimes I even spill paint before I even get any on the canvas/wall/stage-scenery. This guy embodies how I feel after a day of painting a total mess with little to show for it.","[('realization', 0.9070236086845398)]"
300231,I love this and I don't even get art.,"[('love', 0.9898350834846497)]"
300231,"Fitting title, because it's true.","[('approval', 0.9922969937324524)]"
300231,"Powerful. Be it negative and/or positive, it's heavy. I dig.","[('approval', 0.947851836681366), ('neutral', 0.5941591858863831)]"
300231,"I am art. I don't think of what to create. It just comes out. It's not good, but it's art and I love it. It's what I feel.","[('love', 0.995790958404541)]"
300231,"I think the body proportions may be a tiny bit off, but the eye for colour is outstanding.","[('admiration', 0.9681910872459412), ('approval', 0.7009409070014954)]"
300231,Not to take away from this piece but it would be hilarious if they put the painting from Not Another Teen Movie on the canvas.,"[('amusement', 0.9337635040283203)]"
300231,"Of course you can Art,Arti!","[('approval', 0.9924995303153992)]"
300231,didn't know there's a painting that express exactly myself,"[('realization', 0.5959821343421936), ('surprise', 0.44402697682380676)]"
300231,Yeah that's pretty easy to say for someone who obviously can paint.,"[('approval', 0.985306978225708)]"
300231,"Reminds me of a lot of Alexa Meade's art. She's been doing it for awhile and was the first person I saw do ""paintings"" like this.","[('neutral', 0.9950025677680969)]"
300231,"I have a question. When does art become something anyone can do? If your answer is ""anyone CAN do/make art, then please explain. Thanks!","[('confusion', 0.4931848645210266), ('curiosity', 0.41340872645378113), ('gratitude', 0.9683448672294617)]"
300231,"Wow, really like this one!","[('admiration', 0.913593590259552), ('love', 0.47772878408432007)]"
300231,"""But you didn't have to cut me off.""","[('neutral', 0.9975480437278748)]"
300231,It can be hard to express,"[('neutral', 0.9986448884010315)]"
300231,I really really love this,"[('love', 0.9904676079750061)]"
300231,I think I have been watching youtube for too long. The first thing that came to my mind is . you are doing it wrong.,"[('disapproval', 0.9851517081260681)]"
300231,This is what being a dancer feels like. Nothing is permanent in our profession - nothing to hang on the wall,"[('realization', 0.9784942865371704)]"
300231,"""Now you're just somebody that I used to know""","[('approval', 0.40809547901153564), ('neutral', 0.9306357502937317)]"
300231,"I'm not at all sure what I'm supposed to take from this picture, but it's so awesome.","[('admiration', 0.9962635636329651), ('confusion', 0.6638136506080627)]"
300231,"I'm usually not a fan of art like this, but I really like how it's like a frustrated/defeated looking person surrounded by beauty is incapable of portraying it on a canvas. A very relatable situation for non artists with aspirations","[('approval', 0.39410853385925293), ('disapproval', 0.8199440240859985)]"
300231,He's the real work of view,"[('approval', 0.7021693587303162), ('neutral', 0.980937659740448)]"
300231,Ironically i always hated this kind of painting.,"[('anger', 0.9374313354492188)]"
300231,Is that a photograph or a painting?,"[('confusion', 0.7067843079566956), ('curiosity', 0.9222943186759949)]"
300231,Anyone know where I can get a print of this?,"[('neutral', 0.9863449335098267)]"
300231,"I adore this, thanks for posting!","[('gratitude', 0.993676483631134), ('love', 0.7698855996131897)]"
300231,"Whoah this piece is a lot to take in, my brain is still trying to process the scene as a whole! =D","[('neutral', 0.6948245167732239)]"
300231,"It irks me how true this is. I mainly draw , but even at 30 years old and drawing since a kid I only have spurts of good stuff , this is because I've often become frustrated with my myself for getting something ""wrong"" or my inability to do it instantly. Something recently has given me a bit more drive and and when that little voice says ""I Can't"" it is met with ""Keep trying"". My failure is due to my fear of failure and this has stifled my learning process, but with daily practice and my new drive I hope to finally conquer this self defeat.","[('annoyance', 0.7532233595848083), ('optimism', 0.5496268272399902)]"
300231,I can turn that into a desktop wallpaper,"[('neutral', 0.9983208775520325)]"
300231,"This is the first piece of visual art that made me shed tears. Kudos to the creator, and thank you for sharing.","[('gratitude', 0.9986672401428223)]"
300231,Brilliant. It just fits so many feelings!,"[('admiration', 0.9938371777534485)]"
300231,Instructions unclear. I literally painted the studio space.,"[('neutral', 0.9952151775360107)]"
300231,I wonder what the phone number is to this dude's drug dealer.,"[('curiosity', 0.41966474056243896), ('surprise', 0.8889286518096924)]"
300231,"I find this extremely touching and beautiful, and while I can explain why, I simply feel no need to.","[('admiration', 0.9967607855796814)]"
300231,"Yeah, He can't paint. And look at the mess he made all over the room! No wonder his parents kicked him out!","[('annoyance', 0.8905704617500305), ('disgust', 0.3555767834186554)]"
300231,"""Snapped this quick pic, im soo ugly ""","[('disgust', 0.9310792684555054)]"
300231,"Obviously, he can paint - and very well, but fears that he can't. For those who need hand holding to make sense of what they're looking at.","[('admiration', 0.9792572855949402)]"
300231,nice painting.,"[('admiration', 0.9933694005012512)]"
300232,"Did a Google search, found nothing on the artist. OP, we need more!","[('realization', 0.869723379611969)]"
300232,I want to see more in this style,"[('desire', 0.9767703413963318)]"
300232,"In case anyone is curious, the painted figures come from the works of John William Godward. I used his works myself for a similar use a few years back. They're fantastic for these sort of pictures! The woman on the left is from ""An Amateur"". The woman in the middle is from ""The Belvedere"". I can't remember where the woman on the right is from.  I highly recommend to check the rest of his work out. Artnet and the Athenaeum have great libraries.  Edit Found the woman on right; she's from Alexandre Cabanel's painting ""Phèdre/Phaedra"". And the hand is God's from the ""Creation of Adam"" in case anybody wanted to know as well. D  Edit 2 credit to u/boramalper for mentioning the location of the background photo.","[('admiration', 0.7977408766746521), ('neutral', 0.6835138201713562)]"
300232,I'm curious why it's called Armenia,"[('curiosity', 0.9929268956184387)]"
300232,"""I thought 'proficient in Word' just meant talking""","[('realization', 0.9422811269760132)]"
300232,I love this. Plz more. Pls.,"[('love', 0.9885972142219543)]"
300232,"Does the ""creation of adam"" hand feel incredibly out of place to anyone else?","[('confusion', 0.507242739200592), ('disappointment', 0.9671497344970703)]"
300232,This is AMAZING. Does the artist have any other works like this?,"[('admiration', 0.9729971289634705), ('curiosity', 0.4074840545654297)]"
300232,I thought I was on  lol,"[('amusement', 0.9937794804573059)]"
300232,School setting would be cool for this,"[('admiration', 0.4166758954524994), ('approval', 0.985818088054657)]"
300232,"Barry Kite does similar mashups, and has a wicked and hilarious sense of humour. I stumbled upon his book decades ago and became an instant fan. Unfortunately, his site doesn't have the fun explanations that go with each piece in the books, but most times the titles and images speak for themselves. Original Sin Girl With a Pearl Earring and Extra Foam Flea Market of the Gods Catch of the Day ","[('amusement', 0.9573289155960083), ('disapproval', 0.3716720938682556)]"
300232,I definitely had to look at this for a sec. I like this style.,"[('admiration', 0.7672701478004456), ('approval', 0.516424298286438), ('love', 0.4644336402416229)]"
300232,"But, my Lord, I am the supervisor.","[('neutral', 0.9979003667831421)]"
300232,The lack of reflection in the computer screen rankles.,"[('annoyance', 0.8455759286880493), ('neutral', 0.8875109553337097)]"
300232,Looks like a photograph that’s been painted over.,"[('neutral', 0.9835265278816223)]"
300232,Haha that hand on the right xD,"[('amusement', 0.9710960984230042)]"
300232,"The ladies are from John William Godward, right? I can't go through his body of work now, but I'm 10 percent sure on background left and front.","[('neutral', 0.8775627017021179)]"
300232,I relate a lot to whatever the mood the woman lying across the desk with her tiddies out is portraying,"[('neutral', 0.9917530417442322)]"
300232,throw a purple color filter over this and it becomes prime / material.,"[('neutral', 0.997848391532898)]"
300232,I used to work in this kind of environment; I've made all those poses but I am far from fine art.,"[('neutral', 0.7268791794776917)]"
300232,thought this was / for a second,"[('neutral', 0.9986345171928406)]"
300232,What's this have to do with Armenia?,"[('neutral', 0.9614233374595642)]"
300232,This is freaking awesome? Who made this and where can I find more stuff in this style?,"[('admiration', 0.8973758220672607), ('curiosity', 0.8094381093978882)]"
300232,Durs galis e vor NOY djurn dsnelu e,"[('neutral', 0.9985601305961609)]"
300232,"Things like this are always a plus, yeah","[('approval', 0.9960089921951294)]"
300232,"This is so much fun, I love it","[('love', 0.9917783141136169)]"
300232,If  happened in a parallel universe,"[('neutral', 0.9982606768608093)]"
300232,Strange dress code at that office!,"[('neutral', 0.9984921216964722)]"
300232,"BuzFeed Employees struggling to think of that perfect click-bait title for this month's fiftieth period-related video, BuzFeed headquarters, NYC, NY, circa 2015-2018 colourized.","[('neutral', 0.9962247610092163)]"
300232,This could be a design studio at my old uni but it needs more post its.,"[('neutral', 0.9989056587219238)]"
300232,I relate to this on so many levels.,"[('approval', 0.9718108177185059), ('neutral', 0.3817472457885742)]"
300232,Whats the opposite of  ?,"[('neutral', 0.9965202808380127)]"
300232,"I imagine that if it were the correct era, this is what the cast of The Handmaid’s Tale would look like between takes","[('neutral', 0.9886045455932617)]"
300232,"Very sucessful artwork, congrats dude, idea and composition perfect","[('admiration', 0.9635792970657349), ('gratitude', 0.9797404408454895)]"
300232,Identity theft is not a joke jim,"[('realization', 0.6816675662994385), ('neutral', 0.6175468564033508)]"
300232,I want one of those ancient hair wraps. 3,"[('desire', 0.9196624159812927), ('neutral', 0.5907812118530273)]"
300232,"I don't care where you work, that girl in the back is definitely braking dress code.","[('annoyance', 0.9686775207519531), ('neutral', 0.3755984306335449)]"
300232,It's amazing how well they actually fit into the setting! People haven't really changed that much!,"[('admiration', 0.9961376786231995)]"
300232,A girl in my photography class did something very similar to this,"[('realization', 0.608762264251709), ('neutral', 0.9287548065185547)]"
300232,Would Godward have liked this?,"[('curiosity', 0.9307881593704224), ('neutral', 0.309540331363678)]"
300232,"That power strip is a huge, ugly waste of space. Why do so many countries use plugs that look like they should be dangling from a clock tower in a lightning storm?","[('annoyance', 0.9325888752937317), ('disgust', 0.8422452807426453)]"
300232,I keep seeing this as I browse Reddit and I love it. It seems unique.,"[('love', 0.9899811148643494)]"
300232,r/intentionalrennaissance,"[('neutral', 0.997021496295929)]"
300232,This is stunning on so many levels!,"[('admiration', 0.957850992679596)]"
300232,This is absolutely brilliant!,"[('admiration', 0.9942737221717834)]"
300232,Tuesdays at the office. because i love Mondays and Wednesdays,"[('love', 0.9902700185775757)]"
300232,I don't get it. It's just a collage,"[('confusion', 0.9861422181129456)]"
300232,Soo. why is this NSFW?,"[('curiosity', 0.9136334657669067), ('neutral', 0.32042109966278076)]"
300232,they look like my colleges at work,"[('neutral', 0.9976315498352051)]"
300232,Love love love love love love,"[('love', 0.9931347370147705)]"
300232,"Oh my dear Lord, I LOVE THIS! My parents owned an antique business all my life, so I appreciate the old paintings, but the way you incorporated them into a modern scene is transfixing as your brain tries to make sense of the two because it's something we've never seen before. Two radically different time periods merged. I love how casual the two women sitting down are, and you could have stopped there but you added the two on the right as well . LOVE IT 10/10 edit Theres a sub for this!? Ha!","[('admiration', 0.9915550351142883), ('love', 0.9017616510391235)]"
300232,this is just incredible just show how good modern art can be,"[('admiration', 0.9909244179725647)]"
300232,Would be cool if they actually painted the people. Pretty lazy photoshop otherwise. Lack of reflections and bounce light make everything look way out of place. Highschool art at its finest.,"[('admiration', 0.996369481086731)]"
300232,More realistic should be on cell phone taking a selfy,"[('neutral', 0.9952425956726074)]"
300232,Three hours ago? how did i see this twice yesterday and once today. Jfc people try making content for once rather than stealing it.,"[('curiosity', 0.6541764736175537), ('neutral', 0.8579704761505127)]"
300233,"Now with more what? Serotonin? Seriously, I have to know!","[('curiosity', 0.959681510925293)]"
300233,This is so adorable! Keep up the good work ,"[('admiration', 0.9922562837600708)]"
300233,What happens if you drink it?,"[('neutral', 0.9613831043243408)]"
300233,Nobody? Ok then   ,"[('neutral', 0.9987223744392395)]"
