0,1,2
300145,This looks like the culmination of a great high-school or college story. Beautifully done!,"[('admiration', 0.9940045475959778)]"
300145,"At first I thought they were zombies and this was that scene where they pile up to go over the wall, just with zombies that love each other","[('neutral', 0.9853448271751404)]"
300145,"This is adorably wholesome and fun to look at. You just feel the movement and energy in this piece, great job ","[('admiration', 0.9957751631736755)]"
300145,"She looks like she's eating his face and he looks way into it, so, everyone's first kiss.","[('neutral', 0.9944648146629333)]"
300145,This is a endearing painting. You are really talented at painting faces! I love it,"[('admiration', 0.969977080821991), ('love', 0.9726320505142212)]"
300145,"The guy in bottom right, he must be a unit. having someone on you back while they are outside the window And you are behind someone. That core strength. impossible i tell you","[('neutral', 0.9988835453987122)]"
300145,"Anyone else 'shipping the boy in green and redheaded girl, the two with their arms raised in victory?","[('curiosity', 0.9727050065994263)]"
300145,"Amazing how everyone noticed goth girl. Me included. What is it about her that captures the eye? also, she's my waifu stay back weebs","[('admiration', 0.9901072978973389)]"
300145,"We all desire the same thing, and if work together we can achieve it.","[('approval', 0.428305059671402), ('desire', 0.9607118368148804)]"
300145,Harry Potter behind the scenes.,"[('approval', 0.9814755916595459)]"
300145,Good drawing. However there's a lot of Incredibly famous sculpture with the same name.,"[('admiration', 0.9957234859466553)]"
300145,This is awesome and cute! Great craftsmanship btw,"[('admiration', 0.995622456073761)]"
300145,"This looks like a lot of fun. It reminds me of my first kiss. It was during a wrestling match. I needed a ladder to get the belt, but we forgot to put one under the ring. So instead we got everyone in the audience to climb on each other's shoulders. I was at the top and my opponent was still building his human ladder. I grabbed that golden pants securing trophy like it was my lover.","[('love', 0.3341463804244995)]"
300145,Isn't there a famous W2 photo that depicts this as well?,"[('curiosity', 0.9809346795082092)]"
300145,"The composition and concept are awesome, I love this piece! Nice use muted colors, too.","[('admiration', 0.9976043105125427)]"
300145,im so saving this picture and making it my phones wallpaper edit any chance for a widescreen version for pc's and a tallscreen version for smartphones ?,"[('confusion', 0.49931809306144714), ('neutral', 0.7235655784606934)]"
300145,"""Feeling stiff on my neck"" said friend number 1","[('annoyance', 0.614825427532196), ('neutral', 0.8571498990058899)]"
300145,You did an amazing job! I would love to read the comic version of the story which leads to this. ,"[('admiration', 0.9968047142028809), ('love', 0.6542789936065674)]"
300145,The red haired chick on the right looks unsettlingly like my sister,"[('neutral', 0.9725996851921082)]"
300145,I swear ive seen a picture or a painting thats really old just like this.,"[('realization', 0.9163419008255005)]"
300145,the guy in the top left tho,"[('neutral', 0.9986369013786316)]"
300145,That mail girl is freaking me out,"[('anger', 0.46922650933265686), ('annoyance', 0.9577649235725403)]"
300145,This would probs go down well in /,"[('neutral', 0.9978792667388916)]"
300145,it looks like he's holding a severed head,"[('neutral', 0.9987149238586426)]"
300145,"So, I got misty eyed over this beautiful piece.","[('admiration', 0.8621238470077515), ('surprise', 0.8240921497344971)]"
300145,The girl is eating that dude's face,"[('neutral', 0.9988971948623657)]"
300145,"I'm pretty sure I've seen a photo like this before, in a stadium or something.","[('approval', 0.9344445466995239), ('realization', 0.9682640433311462)]"
300145,The amount of -wheels is endless,"[('neutral', 0.9985017776489258)]"
300145,reminds me of a famous w2 photo of an actress kissing a soldier coming home.,"[('realization', 0.3782960772514343)]"
300145,Girl leaning far out in the top left window is adding this to her spank bank,"[('neutral', 0.9987597465515137)]"
300145,"At first glance I thought he was about to kiss a severed head, took me a second to see the rest of her.","[('neutral', 0.9985901713371277)]"
300145,I’m trying to make this the cover for my album,"[('desire', 0.7346544861793518), ('neutral', 0.8060173392295837)]"
300145,The girl holding the kissing girl looks like she's a pupil of rock lee about to hidden lotus her.,"[('neutral', 0.998950719833374)]"
300145,"This should be part of a series. Next up ""the drop"".","[('neutral', 0.9985764026641846)]"
300145,I thought he was kissing a floating or detached head D!,"[('neutral', 0.9980886578559875)]"
300145,A2 is just having a good time holding his bros.,"[('neutral', 0.9964796900749207)]"
300145,Why do they all have red noses? cold or alcoholism?,"[('curiosity', 0.9712525010108948)]"
300145,This looks really great. Definitely feels ghibli inspired. But does everyone have a cold? Tumbler nose is awful.,"[('admiration', 0.9981095790863037)]"
300145,Thought this was /,"[('neutral', 0.9972865581512451)]"
300145,"So I haven’t dated in 7 years for personal reasons and as of late there’s been this love interest that’s come to me and this art reminds me a bit of us, so I think if I’m seeing art like this, I might start to be in love?","[('love', 0.9342250823974609), ('realization', 0.5877816677093506)]"
300145,For some reason this reminds of Junji Ito’s Uzumaki,"[('neutral', 0.9912506341934204)]"
300145,"OMG! She's eating his face! Why are you all cheering? Oh. This is some type of weird cult, isn't it? Nevermind, carry on.","[('annoyance', 0.3081509470939636), ('curiosity', 0.8284079432487488), ('surprise', 0.7379841208457947)]"
300145,Every person in that painting looking thirsty,"[('neutral', 0.9756301045417786)]"
300146,Realistic painting of Peyton Manning.,"[('neutral', 0.9989204406738281)]"
300146,I love when talented people do things like this just for s&gs.,"[('admiration', 0.7949254512786865), ('love', 0.9735391139984131)]"
300146,I can't tell if I hate it or love it.,"[('confusion', 0.984348714351654)]"
300146,T. Hank you everyone for your responses!,"[('neutral', 0.9665676951408386)]"
300146,Why you must do this to us,"[('neutral', 0.8998121619224548)]"
300146,It’s. honestly. the greatest thing i’ve seen in 17 days.,"[('admiration', 0.9787468314170837), ('approval', 0.6098400950431824)]"
300146,This is 10% not a joke. How much you want for it. DM me,"[('annoyance', 0.3271934390068054), ('neutral', 0.4686942994594574)]"
300146,Little bits from Rick & Morty!,"[('neutral', 0.9979559183120728)]"
300146,Please please please do this for Charlie Kirk  would greatly appreciate it,"[('admiration', 0.9625474810600281)]"
300146,I enjoy this. Glad you spent many hours creating it,"[('joy', 0.9946349859237671)]"
300146,People who use their legitimate art skills to shitpost are gods amongst mortals,"[('annoyance', 0.642372727394104), ('neutral', 0.7159813642501831)]"
300146, shitposts very nice,"[('admiration', 0.9570879340171814), ('approval', 0.3550495505332947)]"
300146,"Excuse me! That's ""Tam Honk""","[('neutral', 0.8904163241386414)]"
300146,"We've got tiny lasagna, tiny piza, tiny pie. Mmm! Little tiny fried eggs!","[('neutral', 0.9983968138694763)]"
300146,"Such a powerful piece, had me rethinking my whole life for a few weeks now. Brought me to tears upon sight, truly an artistic piece of art.","[('admiration', 0.991051971912384)]"
300146,This makes me extremely uneasy in the best way possible,"[('nervousness', 0.920198917388916)]"
300146,I attempted to resize the face ,"[('neutral', 0.99909508228302)]"
300146,Charlie Kirk would love to have a face that big.,"[('love', 0.9865447878837585)]"
300146,this is the content i wanna see on this sub,"[('neutral', 0.9976171851158142)]"
300146,This is honestly the best / post I've seen in a very long time. I love this creation.,"[('admiration', 0.9940661191940308), ('love', 0.8520377278327942)]"
300146,"That's not Tom Hank, that's Tim Honk.","[('disapproval', 0.8945752382278442), ('neutral', 0.8000796437263489)]"
300146,"Have a grate day im Tom Hank EDIT Thanks for the silver, stranger!","[('gratitude', 0.9916491508483887)]"
300146,[https://i.imgur.com/IjHJnop.mp4](https://i.imgur.com/IjHJnop.mp4),"[('neutral', 0.9975317716598511)]"
300146,Mol Gobson,"[('neutral', 0.9982113838195801)]"
300146,This is just.interesting,"[('admiration', 0.8808361887931824)]"
300146,Art that I relate to. Finally. Thank you.,"[('gratitude', 0.9980872273445129)]"
300146,"I read the title as ""Tom Honk"" and it only made the picture more funny.","[('amusement', 0.9944444298744202)]"
300146,this is the first thing I saw when I opened Reddit. I’m snorting,"[('amusement', 0.606182873249054)]"
300146,There are starving artists all over the world and you go and waste expensive oil paints of this nonsense. Keep it up.,"[('annoyance', 0.8383596539497375)]"
300146,Thought it was Charlie Kirk,"[('neutral', 0.9988344311714172)]"
300146,Imagine if he looked like this all through saving Private Ryan.,"[('neutral', 0.9982789754867554)]"
300146,I really want Tom Hanks to see this and to read his response.,"[('desire', 0.9317672252655029), ('neutral', 0.5330859422683716)]"
300146,Can't stop laughing either! Just one glance and I'm silly. I hope Tom likes it. He always did have a great sence of humor so probably laughing with the rest of us!,"[('amusement', 0.8946364521980286), ('optimism', 0.5713016390800476)]"
300146,Oh my god this is fantastic. Please tell me this is part of a series.,"[('admiration', 0.9825330972671509), ('excitement', 0.3735170066356659)]"
300146,I cannot believe you used actual paint and actual canvas to paint this.,"[('surprise', 0.3239631652832031), ('neutral', 0.4018648862838745)]"
300146,So much for sleeping tonight,"[('neutral', 0.9896547794342041)]"
300146,Im uncomfortable but in a good way,"[('annoyance', 0.48932334780693054), ('approval', 0.724319338798523)]"
300146,Thank you for sharing this with the world. Amazing.,"[('admiration', 0.7334306836128235), ('gratitude', 0.9967886209487915)]"
300146,Is this in any way based on the paperback cover of Forrest Gump from the late 80's?,"[('neutral', 0.9855934977531433)]"
300146,Reminds me of the Gushers commercials. Edit Gushers Commercial ,"[('realization', 0.6674086451530457), ('neutral', 0.8536108732223511)]"
300146,Art we all wanted but never expected to be this amazing,"[('admiration', 0.7722180485725403), ('surprise', 0.5214403867721558)]"
300146,The lesser known Garden Gump,"[('neutral', 0.9954127669334412)]"
300146,Why am i laughing so hard. Good job.,"[('admiration', 0.974790096282959), ('amusement', 0.7828484773635864)]"
300146,"Serious question, how long does it take to get past laughing at the idea? I can't stop laughing at all, so I imagine that must be overcome at some point to actually paint it, which looks amazing!","[('admiration', 0.958694338798523), ('amusement', 0.7221009135246277)]"
300146,"Amazing. I love highly detailed, high effort paintings of meme-style images","[('admiration', 0.9982724189758301)]"
300146,Memes are considered art now? Hmm. This opens a few doors,"[('curiosity', 0.44885972142219543), ('neutral', 0.8589181900024414)]"
300146,This is next level shitposting,"[('annoyance', 0.7719624638557434)]"
300146,I love it when people use their talent for funny things lol,"[('amusement', 0.9714995622634888), ('love', 0.8619297742843628)]"
300146,It’s is ONE IN THE MORNING AND I WAKE UP TO SEE THIS  I LOVE IT,"[('love', 0.9855608344078064)]"
300146,is this a commercial for Lil' bits? Just showing off that Tom Hanks eats there.,"[('curiosity', 0.8149800300598145), ('neutral', 0.5206088423728943)]"
300146,Just in case anyone wants a ridiculous mobile wallpaper. Here are two options. My wife is freaked out by both. ,"[('neutral', 0.9925611615180969)]"
300146,"We've got tiny lasagna, tiny piza, tiny pie. Mmm! Little tiny fried eggs!","[('neutral', 0.9983968138694763)]"
300146,This is my new phone background and i regret nothing,"[('remorse', 0.9206608533859253)]"
300146, Little bits,"[('neutral', 0.9987366795539856)]"
300146,Imagine if people actually looked like this. Imagine kissing that goodnight.,"[('neutral', 0.9874496459960938)]"
300146,Tom Thanks for making this,"[('gratitude', 0.9959264993667603)]"
300146,Lol reminds of littlefacemitt,"[('amusement', 0.9854562878608704)]"
300146,"Thanks for the upcoming nightmares, OP.","[('gratitude', 0.9936187267303467)]"
300146,"The scale is a little off for some parts, but overall great job!","[('admiration', 0.9977067708969116)]"
300146,"You mean ""Tttom Hankss""","[('neutral', 0.9984920024871826)]"
300146,I just don’t understand this.,"[('confusion', 0.916714608669281)]"
300146,Did someone already do ?,"[('confusion', 0.8611289858818054), ('neutral', 0.581097424030304)]"
300146,Is this a scene from 'big' I haven't seen it,"[('curiosity', 0.6771670579910278), ('surprise', 0.7861090898513794)]"
300146,I follow this guy on IG. @Rexhuman,"[('approval', 0.7124723196029663), ('neutral', 0.9826383590698242)]"
300146,This needs to be x-posted to ,"[('neutral', 0.998499870300293)]"
300146,"I would do this and gift it to my parents for Christmas, no explanation.","[('neutral', 0.9971056580543518)]"
300146,"Wow, great detail on the eyes!","[('admiration', 0.9938779473304749)]"
300146,In 10 years art students will have to analyze this and find a meaning.,"[('neutral', 0.9858223795890808)]"
300146,Drunk me is giggling. Drunk me likes it.,"[('amusement', 0.9856942296028137)]"
300146,Is there a name for this genre of art? Because I need more of it in my life,"[('curiosity', 0.981624186038971), ('desire', 0.41313454508781433)]"
300146,The proportions are a bit off.,"[('neutral', 0.9990503191947937)]"
300146,You got the wrong Tom.,"[('disappointment', 0.8083362579345703), ('disapproval', 0.7906159162521362)]"
300146,I feel like there could be more detail in the blurry areas around the face to match the detail of the tiny baby face itself.,"[('approval', 0.7982285022735596), ('neutral', 0.9412447810173035)]"
300146,I’m not sure that I hate it because it makes me uncomfortable or if I like it because it’s subjectively humorous.,"[('confusion', 0.9587266445159912), ('disapproval', 0.30883121490478516)]"
300146,I do this to all my contact pics LMAO!,"[('amusement', 0.9765163064002991)]"
300146,I hope you get the job of your dreams,"[('optimism', 0.9898922443389893)]"
300146,I thought this was charlie kirk for a second.,"[('realization', 0.6013805270195007), ('neutral', 0.955373227596283)]"
300146,The true majesty of this piece can only be appreciated in person. I'm very glad I had the chance to.,"[('admiration', 0.9572941660881042), ('gratitude', 0.7485085129737854), ('joy', 0.4251517951488495)]"
300146,"""The Secret Weapon"" -Pablo Sanchez","[('neutral', 0.9991610050201416)]"
300146,A rare popular  shitpost,"[('neutral', 0.9979612827301025)]"
300146,Send him to Lil' Bits ,"[('neutral', 0.9983097314834595)]"
300146,Do you mind if I use it as my DP?,"[('curiosity', 0.9644603729248047)]"
300146,I thought it was Charlie Kirk,"[('neutral', 0.996483564376831)]"
300146,"Did you get inspiration from Arató András, the stock photo guy?","[('curiosity', 0.9941131472587585)]"
300146,I'm confused. does the S on the end of Hanks somehow correlate to how big his face is?,"[('confusion', 0.9941797256469727)]"
300146,Why did tom hanks swallow Bob Barker?,"[('neutral', 0.38570645451545715)]"
300146,Peyton Manning looking good,"[('admiration', 0.9974679946899414)]"
300146,I would like to offer you $12 for this,"[('desire', 0.5361602306365967), ('neutral', 0.6286056637763977)]"
300146,Reminds me of the “Little bits” commercial from Rick and Morty.,"[('neutral', 0.9926039576530457)]"
300146,Inspired by Charlie Kirk memes?,"[('curiosity', 0.9956939220428467)]"
300146,"Art is weird, and neat, but also really weird.","[('disgust', 0.9418718218803406)]"
300146,I'm not sure I like it. The mini face doesn't blend well with the rest of the face. There is an abrupt change in shading and level of detail. It almost looks photoshoped. This isn't aesthetically pleasing to me.,"[('confusion', 0.8857461810112), ('disapproval', 0.6299393177032471)]"
300146,Gorgeous. Fabulous. Wonderful. Work of art.,"[('admiration', 0.9935392737388611)]"
300147,"I am in love with this. The shadow makes it look like it’s gonna be so scary and then you see the bottom part of the ghost and you think it’s a dress of some old scary Victorian girl, but no! It’s an adorable lil ghosty. I love it Op! Great work!","[('admiration', 0.9906722903251648), ('love', 0.6717351078987122)]"
300147,"Can you guide me in a direction to start with this kind of creative art? I love its so much and want to learn Edit wow, thank you all for the advice! I'm going to go watch blender tutorials and play rocket league!","[('admiration', 0.33162394165992737), ('curiosity', 0.6880857944488525), ('desire', 0.3255443871021271), ('excitement', 0.49150580167770386), ('gratitude', 0.9990434050559998), ('love', 0.8537747263908386)]"
300147,Return of the Obra dinn vibes,"[('neutral', 0.9989491105079651)]"
300147,"Absolutely adorable, would definitely befriend","[('admiration', 0.9583206176757812), ('optimism', 0.7327086925506592)]"
300147,can you scare me up a little bit of love?,"[('curiosity', 0.675649881362915), ('fear', 0.423130601644516), ('love', 0.5139451622962952)]"
300147,Is this made in 3D with a cartoon renderer or painted? Looks amazing,"[('admiration', 0.9884204864501953)]"
300147,"I don't know where he is going, but I hope he has a good day.","[('optimism', 0.927929699420929)]"
300147,Nailed the creepy+cute sweet spot.,"[('admiration', 0.9673579335212708), ('neutral', 0.570644199848175)]"
300147,Posted this then went to bed- definitely didn’t expect to wake up to this amount of love for the lil ghost! Don’t know where to even begin with all the comments. Thanks everyone!,"[('gratitude', 0.9960696697235107)]"
300147,What people in the 50s think ghost look like,"[('neutral', 0.9982882142066956)]"
300147,Someone should add the ghost duet song over this!,"[('neutral', 0.999184787273407)]"
300147,"Little ghost, little ghost One I'm scared of the most Can you scare me up a little bit of love?","[('fear', 0.9696229696273804)]"
300147,Do you have Ig or tiktok with more work?,"[('curiosity', 0.9719983339309692)]"
300147,"If this post blows up, I swear someone is going to write something like ""Cool, perfect loop"" and then someone will reply something like ""Not perfect, because xyz"" Happens almost every time someone posts a looping video/gif lol","[('amusement', 0.9759593605995178)]"
300147,This is the best thing I’ve ever seen in my life,"[('admiration', 0.9933940768241882)]"
300147,Digital is just a follow-up post,"[('neutral', 0.9985976815223694)]"
300147,"Ah the 2am ""I forgot if I locked the door or not"" walk.","[('realization', 0.9809666872024536)]"
300147,I wanna see a version where the ghost is going down stairs at a 45’ angle instead of 0’ like a human with legs would,"[('desire', 0.5170943140983582), ('neutral', 0.9323158860206604)]"
300147,https://youtube.com/watch?v=Mt-XfZowFbU,"[('neutral', 0.9745426774024963)]"
300147,"It looks really neat, but there was something nagging me about it and I think I figured out what it is. The lighting on it seems to be inconsistent on where it is coming from. The stairway seems to be lit from the front , but the ghost is lit from the side at the top of the stairs , and then from above at the bottom of the stairway . Other than that minor nitpick it looks great. Good job!","[('admiration', 0.9952267408370972), ('realization', 0.30609574913978577)]"
300147,I would love to have it as my pet.,"[('love', 0.9864163398742676)]"
300147,would love this as a background,"[('love', 0.9019295573234558), ('optimism', 0.3404545187950134)]"
300147,Digital is just a bit different,"[('neutral', 0.9986444115638733)]"
300147,The ghost really pops out of the screen! Wow. This is great.,"[('admiration', 0.9949788451194763)]"
300147,I love this style and how much noise there is on the image.,"[('love', 0.9796934127807617)]"
300147,"Good job, I really liked this","[('admiration', 0.9946479201316833)]"
300147,Liar! I counted at least 8 ghosts! And that was just in the first minute!,"[('neutral', 0.9988523721694946)]"
300147,Now it needs a sound clip of Little Ghost by The White Stripes playing behind it.,"[('neutral', 0.9987510442733765)]"
300147,"Lil ghost lil ghost, what I'm scared of the most","[('fear', 0.974911093711853)]"
300147,"Little ghost, little ghost","[('neutral', 0.989488422870636)]"
300147,Can you scare me up a little bit of love?,"[('curiosity', 0.4973939061164856), ('fear', 0.40928417444229126), ('love', 0.6683791279792786)]"
300147,Love love love it. Great job!,"[('admiration', 0.9909616112709045), ('love', 0.8507237434387207)]"
300147,"This is the cutest thingg, I love it!","[('admiration', 0.31821751594543457), ('love', 0.9903392195701599)]"
300147,Oh man this is really good. I like the waxing and waning of the shadows as it moves from one light source to the next.,"[('admiration', 0.997984766960144)]"
300147,"Outstanding work. I saw you got featured by True Grit Texture Supply! Awesome, awesome job.","[('admiration', 0.9872071146965027)]"
300147,I just watched this so many times in a row. I love this so much. It makes me feel nostalgic and warm and happy,"[('joy', 0.3291453719139099), ('love', 0.9965324401855469)]"
300147,This is really interesting. I've never seen any art like this before. It's just like at night when you your vision is grainy. Almost makes it more realistic.,"[('admiration', 0.9842655658721924)]"
300147,"Idk why, but I feel like this ghost is super polite.","[('approval', 0.31638047099113464), ('neutral', 0.976844847202301)]"
300147,"The graininess give it a real atmosphere of suspense, +1 from me","[('approval', 0.9333645105361938)]"
300147,Okay but why is he so cute,"[('admiration', 0.740656852722168), ('curiosity', 0.3611701726913452)]"
300147,"I honestly thought it’s gonna do a little scare right after it flew past the screen. NGL I was anticipating, hesitating but instantly relieved and a little disappointed too. but it does look really good","[('admiration', 0.7004609704017639), ('disappointment', 0.9207115769386292), ('realization', 0.4738439917564392)]"
300147,You're a little late posting this since it's Christmas time now.,"[('neutral', 0.9977806210517883)]"
300147,this might be the cutest ghost gif i’ve ever seen,"[('admiration', 0.9898200631141663)]"
300147,Cursed to forever descend the staircase he broke his neck on.,"[('anger', 0.7826858162879944), ('annoyance', 0.7269824743270874)]"
300147,The pixelation really makes it look like what you see in the dark. Makes it really eerie. Nice work!,"[('admiration', 0.9961243271827698)]"
300147,This is awesome! The only thing I see that really pulls my eyes away from the whole thing I will not even mention as I have no clue if what I am seeing is really something to critique and just something that attracts my eye in a way I don't like. Keep it up! I really like the soft style and the flow of this work and I would love to a see a short with this little boo buddy and a human friend/s or some other ghost cohorts.,"[('admiration', 0.9986525774002075)]"
300147,I’d love to see a version of it “tripping “ on the last step or so.,"[('love', 0.9932336211204529)]"
300147,It looks more like a low-frame rate rotoscoping than digital; I’m astounded at the realism! Very cool! I can hear the “whoosh” sound it’s making!,"[('admiration', 0.9964732527732849)]"
300147,So cool. I love this! Spooky and cute,"[('love', 0.9913449287414551)]"
300147,That animation style is so soothing. Well done.,"[('admiration', 0.9983729124069214)]"
300147,Any Tipps to get such a shader? ,"[('curiosity', 0.9929840564727783)]"
300147,this would make for a delightful loading screen,"[('admiration', 0.9914221167564392)]"
300147,This is spectacular cute and awesome,"[('admiration', 0.9937659502029419)]"
300147,"At first i thought that this was going to be super scary….and i was right. How am i going to be able to sleep tonight?  In all seriousness, this was super cool, great job.","[('admiration', 0.99880051612854)]"
300147,The dithered shadows give it a ray traced vibe. Pretty cool,"[('admiration', 0.9185241460800171), ('approval', 0.31976181268692017)]"
300147,That's a seamless loop too! Very very well done!,"[('admiration', 0.9979439377784729)]"
300147,It would be really funny if he tumbled on the last step,"[('amusement', 0.9749370813369751)]"
300147,"If you upload it to imgur, you'll get a gifv that is actually a video which will be much lighter and faster for people to see.","[('neutral', 0.9990678429603577)]"
300147,There is something uncanny about this gif. I just can’t put my finger on it.,"[('surprise', 0.9824681878089905)]"
300147,This is the kind of art that makes me jealous I can’t do it,"[('annoyance', 0.8619677424430847)]"
300147,Seems relevant,"[('approval', 0.8134704232215881), ('neutral', 0.9771718382835388)]"
300147,He’s going downstairs to show his mom the rock he got while trick or treating.,"[('neutral', 0.9987562894821167)]"
300147,The subtle scene movement is perfect.,"[('admiration', 0.9968829154968262)]"
300147,Just needs the pac-man theme.,"[('neutral', 0.9946171641349792)]"
300147,"There's a wonderful illustrator, Fred Banbery, who did a series of illustrations for Alfred Hitchcock's Ghostly Gallery. This has that ""spirit."" So lovely. Nicely done. I think I'll watch this the rest of the day.","[('admiration', 0.9975051283836365)]"
